### ISSUE TITLE
Authoritative notifying new zone before zone SOA is able to be queried

### ISSUE THREAD

**Issue by martinbarlow** [PowerDNS/pdns#11638]
- Program: Authoritative
 - Issue type: Bug report

### Short description
I have authoritative servers setup with auto primaries.
I have found that when a new zone is created, it notifies the auto primary. the auto primary queries for SOA but fails as the zone is not yet able to be queried. (returns REFUSED)

If i wait a while, then trigger a fresh notify, the SOA query works and  auto primary functions.

### Environment
 - Operating system: Centos 7.9
 - Software version: pdns-4.5.1-1pdns.el7.x86_64
 - Software source: PowerDNS repository

### Steps to reproduce

1. Create a zone on primary.
2. auto primary should receive the notify, query for soa and create the auto primary zone.
3. SOA query fails however, and auto primary zone fails.

### Expected behaviour
I dont think it should trigger a notify, until the SOA record is available to be queried.

### Actual behaviour
It triggers a notify, before SOA record is available to be queried.

### Other information
10:52:12 zone created in sql backend database on PRIMARY.

10:52:54.157109 IP PRIMARY.10684 > AUTOPRIMARY.domain: 51472 notify [b2&3=0x2400] [1au] SOA? newzone.com. (143)
10:52:54.158349 IP AUTOPRIMARY.domain > PRIMARY.10684: 51472 notify*- 0/0/1 (143)
10:52:54.843026 IP AUTOPRIMARY.11763 > PRIMARY.domain: 8652 SOA? newzone.com. (31)
10:52:54.843207 IP PRIMARY.domain >AUTOPRIMARY.11763: 8652 Refused- 0/0/0 (31)

**Comment by Habbie** [comment]
Fixed in #11815
