### ISSUE TITLE
rec: QNAME minimization resolves intermediate CNAMEs

### ISSUE THREAD

**Issue by mnordhoff** [PowerDNS/pdns#8699]
- Program: Recursor
 - Issue type: Bug report

### Short description
For example, if you look up `foo.bar.example.com`, and there is a `CNAME` at `bar.example.com`, the Recursor resolves the `CNAME` target before continuing.

It's inefficient, and eats away at `max-qperq`, but it's pretty harmless. (Everything is cached, for better or worse.)

It could potentially cause problems in poorly managed zones, e.g. with very deep names, slow nameservers, and low TTLs.

If you want my opinion, it's not worth putting effort into unless it's very easy to change, or people run into real problems.

### Environment
 - Operating system: Ubuntu 16.04 amd64
 - Software version: 4.3.0~beta1+master.56.g3e56dd19a-1pdns.xenial
 - Software source: PowerDNS repository

### Steps to reproduce
1. Enable QNAME minimization, wipe cache.
2. `dig signaler-pa.clients6.google.com`

### Expected behaviour
No queries for `l.google.com` or `clients.l.google.com`.

### Actual behaviour
2 queries. 34 millisecond higher overall response time. ;-)

### Other information
```
2020-01-13 18:51:04.265042 IP 127.0.0.1.38740 > 127.0.0.1.53: 4829+ [1au] A? signaler-pa.clients6.google.com. (72)
2020-01-13 18:51:04.265907 IP 104.237.139.208.23352 > 216.239.38.10.53: 59105 [1au] A? clients6.google.com. (48)
2020-01-13 18:51:04.273093 IP 216.239.38.10.53 > 104.237.139.208.23352: 59105*- 2/0/1 CNAME clients.l.google.com., A 172.217.9.14 (88)
2020-01-13 18:51:04.273955 IP6 2600:3c00::f03c:91ff:fe96:6bcc.4091 > 2001:4860:4802:32::a.53: 42440 [1au] A? l.google.com. (41)
2020-01-13 18:51:04.289560 IP6 2001:4860:4802:32::a.53 > 2600:3c00::f03c:91ff:fe96:6bcc.4091: 42440*- 0/1/1 (91)
2020-01-13 18:51:04.290534 IP 104.237.139.208.59153 > 216.239.32.10.53: 604 [1au] A? clients.l.google.com. (49)
2020-01-13 18:51:04.306237 IP 216.239.32.10.53 > 104.237.139.208.59153: 604*- 1/0/1 A 172.217.9.14 (65)
2020-01-13 18:51:04.306929 IP 104.237.139.208.2483 > 216.239.36.10.53: 61023 [1au] A? signaler-pa.clients6.google.com. (60)
2020-01-13 18:51:04.313903 IP 216.239.36.10.53 > 104.237.139.208.2483: 61023*- 1/0/1 A 216.58.194.74 (76)
2020-01-13 18:51:04.314456 IP 127.0.0.1.53 > 127.0.0.1.38740: 4829 1/0/1 A 216.58.194.74 (76)
```

**Comment by mnordhoff** [comment]
Is this fixed? Are there still corner cases that aren't covered?

The example in the steps to reproduce appears fixed.

**Comment by omoerbeek** [comment]
Yes, it should be, i wrongly assumed github would mark it closed.
