### ISSUE TITLE
DNSDist picks wrong reply address on FreeBSD for QUIC

### ISSUE THREAD

**Issue by tykling** [PowerDNS/pdns#16248]
- [X] This is not a support question, I have read [about opensource](https://www.powerdns.com/opensource.html) and will send support questions to the IRC channel, [GitHub Discussions](https://github.com/PowerDNS/pdns/discussions/) or the mailing list.
- [X] I have read and understood the ['out in the open' support policy](https://blog.powerdns.com/2016/01/18/open-source-support-out-in-the-open/)
- [X] I have read and understood the [PowerDNS AI policy](https://github.com/PowerDNS/pdns/blob/master/AI_POLICY.md)

 - Program: dnsdist 
 - Issue type: Bug report

### Short description
On FreeBSD dnsdist picks the wrong reply address when serving QUIC on an IP address configured on a loopback interface

### Environment

 - Operating system: FreeBSD 13
 - Software version: disdist 2.0.1
 - Software source: FreeBSD ports

### Steps to reproduce
1. listen on 0.0.0.0
2. Have IP address on both a real interface like `em0` and a loopback interface like `lo1`
3. Send a query to the IP on the loopback interface, see dnsdist use the wrong IP for the response

### Expected behaviour
Send the query response from the IP it came in on

### Actual behaviour
The response was sent with the IP of the real interface as source address

### Other information
`dnsdist`is listening thusly: `addDOQLocal('0.0.0.0:853', .....)` and `addDOQLocal('[::]:853', .....)`

which looks right when checking with `sockstat`:
```
[tykling@deic-lgb ~]$ sudo sockstat -l | grep 853 | grep udp
root     dnsdist    18158 18 udp4   *:853                 *:*
root     dnsdist    18158 21 udp6   *:853                 *:*
[tykling@deic-lgb ~]$ 
```

The queries are received by dnsdist but something goes wrong when picking the source address of the reply packet.

In this tcpdump output `85.209.118.179` is the client, `91.239.100.100` is the dnsdist IP on the loopback interface, and `130.225.244.166` is the IP configured on the "real" interface:
```
08:44:25.150235 IP 85.209.118.179.38067 > 91.239.100.100.853: UDP, length 1252
08:44:25.150399 IP 130.225.244.166.853 > 85.209.118.179.38067: UDP, length 105
08:44:25.362872 IP 85.209.118.179.38067 > 91.239.100.100.853: UDP, length 1252
08:44:25.363042 IP 130.225.244.166.853 > 85.209.118.179.38067: UDP, length 105
08:44:25.363101 IP 85.209.118.179.38067 > 91.239.100.100.853: UDP, length 1252
08:44:25.363192 IP 130.225.244.166.853 > 85.209.118.179.38067: UDP, length 105
```

**Comment by rgacogne** [comment]
I have been able to reproduce the issue, investigating.
