### DISCUSSION TITLE
Dnsdist Frontend Performance Tuning

### DISCUSSION THREAD

**Discussion by paddg** [PowerDNS/pdns#15469] [Q&A] [answered]
I did a `dnsdist` frontend performance test, all queries was answered from packet cache. At a certain point with high IPv6 query rate, dnsdist stops receiving the additional queries and `udp6-recvbuf-errors` and `udp6-in-errors` increase.

I followed the `dnsdist` [performance tuning manual](https://www.dnsdist.org/advanced/tuning.html) and increased the `addLocal()` calls. But that didn't improve things. Then I started increasing the number of `dnsdist` processes. That helped. The `dnsdist` frontend seems to scale very well with the number of processes, but it doesn't benefit from more `addLocal()` calls.

Does anyone have an explanation for this?

**Comment by rgacogne** [comment]
Hi! I can see two possibilities:
- some lock in dnsdist gets contended, either in the receive/send path (unlikely, we are not using locks there as far as I know) or the packet cache, and adding more threads increases the contention so there is no benefit. You could try increasing the number of shards to see if it helps ;
- if the behaviour does not show reproduce with IPv4 it might be that something in the Linux kernel UDP IPv6 receive/send path gets contended, and having more processes works around the contention. I consider this a lot less likely, but we have seen strange things with regard to UDP performance in the past so it's not impossible.
I would have to reproduce the behaviour and investigate, likely using `perf` to see what is happening when dnsdist is dropping packets, to be 100% sure. Would you mind giving us a few more details about how you are testing? How are you sending queries? From where (same host, local network, etc)? Any OS-level tuning? Anything special about your dnsdist configuration?

**Reply by paddg** [reply]
Hi!

> You could try increasing the number of shards to see if it helps

Good point! I will repeat the test without cache with self-generated responses from dnsdist so that caching is not involved.

> if the behavior does not show reproduce with IPv4

I did no tests with queries over IPv4. So I have no result on that.

> How are you sending queries? From where (same host, local network, etc)?

I sent the queries from a server connected to the same switch to the test server. The network cards involved are Intel I350 10 Gigabit adapters connected via a 1 Gbps link.

I generated a pcap file containing ~4M queries with a random sender address from the network 100::/64. It looks like this:

```
13:05:47.688042 IP6 100::d9d1:806e:1f7a:2127.40696 > fd53::192:168:1:2.53: 50731+ [1au] A? localhost. (38)
13:05:47.688115 IP6 100::c2e5:f72c:e2c8:3ce8.44713 > fd53::192:168:1:2.53: 3000+ [1au] A? localhost. (38)
13:05:47.688175 IP6 100::493f:cd50:7067:3d24.35579 > fd53::192:168:1:2.53: 50554+ [1au] A? localhost. (38)
13:05:47.688233 IP6 100::62bb:2eec:66f4:37ce.40445 > fd53::192:168:1:2.53: 14417+ [1au] A? localhost. (38)
13:05:47.688292 IP6 100::ad09:98e5:cded:b835.46903 > fd53::192:168:1:2.53: 53367+ [1au] A? localhost. (38)
13:05:47.688350 IP6 100::b552:a0ed:78cc:68db.58692 > fd53::192:168:1:2.53: 47224+ [1au] A? localhost. (38)
13:05:47.688407 IP6 100::fa1c:b9fb:62ee:7b95.44838 > fd53::192:168:1:2.53: 3027+ [1au] A? localhost. (38)
13:05:47.688466 IP6 100::d058:eb3e:e11d:97ab.38464 > fd53::192:168:1:2.53: 9243+ [1au] A? localhost. (38)
13:05:47.688523 IP6 100::3008:99c2:c274:bf6f.50497 > fd53::192:168:1:2.53: 5234+ [1au] A? localhost. (38)

```

To send the queries from one server to the other, I use the `tcpreplay` tool. For example this way:
```
while true; do cat dns.pcap | tcpreplay --pps=400000 --intf1=eth4 -; sleep .1; done
```

I have dropped the response packets with iptables.

> Any OS-level tuning? 

Yes, the same optimizations we've learned over time. These include some `sysctl` optimizations and a rigid network IRQ mapping to CPU cores (turend off IRQ balancer). Please let me know if you need more specific information on this.

> Anything special about your dnsdist configuration?

I tested with our standard configuration from production environment.  But it might make more sense if I repeat the test with as little configuration as possible.

**Reply by paddg** [reply]
I found the bottleneck. I had implemented custom metrics where `dq.qtype` and `dq.dh:getRD()` were accessed for 5% (`ProbaRule(0.05)`) of the queries. This was killing the throughput. It seems to blocking the entire process at some point of qps.

**Reply by rgacogne** [reply]
Right, I'm guessing this was done via a `LuaAction`? `LuaAction` has the big drawback that it has to take a global Lua lock, thus effectively serializing threads. This can be avoided by using `LuaFFIPerThreadAction` instead, which has a per-thread Lua context and therefore does not need a lock, but it means using the FFI interface which is a bit more tedious to write. Let me know if you want some help to do that!

**Reply by paddg** [reply]
Help would be very appreciated :) I would like to give it a try if it doesn't get too complicated. This is my dnsdist Lua code:

```lua
qtype        = {}
qtype[1]     = "A"
qtype[2]     = "NS"
qtype[5]     = "CNAME"
qtype[6]     = "SOA"
qtype[7]     = "MB"
qtype[8]     = "MG"
qtype[9]     = "MR"
qtype[12]    = "PTR"
-- ...

function CustDqMetrics(dq)
   local qt = qtype[dq.qtype] or "OTHER"
   local lcqt = string.lower(qt)

   if declareMetric("cust-qtype-" .. lcqt, "counter", "QType " .. qt .. " counter" ) then
      incMetric("cust-qtype-" .. lcqt, 20)
   end

   if dq.dh:getRD() then
      if declareMetric("cust-qflag-rd1", "counter", "QFlag RD1 counter" ) then
         incMetric("cust-qflag-rd1", 20)
      end
   else
      if declareMetric("cust-qflag-rd0", "counter", "QFlag RD0 counter" ) then
         incMetric("cust-qflag-rd0", 20)
      end
   end

   return DNSAction.None, ""
end
addAction(ProbaRule(0.05),LuaAction(CustDqMetrics)) -- that kills the throughput at some point of qps
```

**Reply by rgacogne** [reply, marked as answer]
Here is a per-thread FFI version that should be equivalent:
```lua
local custDqMetrics = [[
  local ffi = require("ffi")
  local bit = require("bit")

  qtype        = {}
  qtype[1]     = "A"
  qtype[2]     = "NS"
  qtype[5]     = "CNAME"
  qtype[6]     = "SOA"
  qtype[7]     = "MB"
  qtype[8]     = "MG"
  qtype[9]     = "MR"
  qtype[12]    = "PTR"

  function declareMetric(name, description)
    ffi.C.dnsdist_ffi_metric_declare(name, #name, "counter", description, ffi.NULL)
  end
  function incMetric(name, value)
    ffi.C.dnsdist_ffi_metric_inc_by(name, #name, value)
  end

  declareMetric("cust-qflag-rd0", "QFlag RD0 counter")
  declareMetric("cust-qflag-rd1", "QFlag RD1 counter")

  return function(dq) 
    local qt = qtype[ffi.C.dnsdist_ffi_dnsquestion_get_qtype(dq)] or "OTHER"
    local lcqt = string.lower(qt)

    local metric = "cust-qtype-" .. lcqt
    local description = "QType " .. qt .. " counter"
    declareMetric(metric, description)
    incMetric(metric, 20)

    local header_void = ffi.C.dnsdist_ffi_dnsquestion_get_header(dq)
    local header = ffi.cast("unsigned char *", header_void)
    local rd = bit.band(header[2], bit.lshift(1, 0)) ~= 0
    if rd then
      metric = "cust-qflag-rd1"
    else
      metric = "cust-qflag-rd0"
    end
    
    incMetric(metric, 20)
    
    return DNSAction.None
  end
]]

addAction(ProbaRule(0.05), LuaFFIPerThreadAction(custDqMetrics))
```

**Reply by paddg** [reply]
Hello @rgacogne, 

Your code looks like magic to me :) And it works! Thank you so much for that!

The throughput has improved, but remains well below the throughput without custom metrics. With my `dnsdist` setup, I achieve the following with *one* `dnsdist` process:

Without custom metrics: 105 kqps
With custom metrics `LuaAction`: 75 kqps
With custom metrics `LuaFFIPerThreadAction`: 90 kqps

Nothing is free. But the improvement is clearly visible.

**Reply by rgacogne** [reply]
Hello Winfried!
I'm wondering if we we cannot reduce the impact of the custom metrics by pre-declaring the metric for all types, as calling `declareMetric` involves a global lock. I'll try to test that later today.

**Reply by paddg** [reply]
I tried it with this code now:

```lua
local custDqMetrics = [[
  local ffi = require("ffi")
  local bit = require("bit")

  qtype        = {}
  qtype[1]     = "A"
  qtype[2]     = "NS"
  qtype[5]     = "CNAME"
  qtype[6]     = "SOA"
  qtype[7]     = "MB"
  qtype[8]     = "MG"
  qtype[9]     = "MR"
  qtype[12]    = "PTR"

  function declareMetric(name, description)
    ffi.C.dnsdist_ffi_metric_declare(name, #name, "counter", description, ffi.NULL)
  end
  function incMetric(name, value)
    ffi.C.dnsdist_ffi_metric_inc_by(name, #name, value)
  end

  declareMetric("cust-qflag-rd0", "QFlag RD0 counter")
  declareMetric("cust-qflag-rd1", "QFlag RD1 counter")

  for index, qt in pairs(qtype) do
    local lcqt = string.lower(qt)
    local metric = "cust-qtype-" .. lcqt
    local description = "QType " .. qt .. " counter"
    declareMetric(metric, description)
  end
  declareMetric("cust-qtype-other", "QType OTHER counter")

  return function(dq) 
    local qt = qtype[ffi.C.dnsdist_ffi_dnsquestion_get_qtype(dq)] or "OTHER"
    local lcqt = string.lower(qt)

    local metric = "cust-qtype-" .. lcqt
--  local description = "QType " .. qt .. " counter"
--  declareMetric(metric, description)
    incMetric(metric, 20)

    local header_void = ffi.C.dnsdist_ffi_dnsquestion_get_header(dq)
    local header = ffi.cast("unsigned char *", header_void)
    local rd = bit.band(header[2], bit.lshift(1, 0)) ~= 0
    if rd then
      metric = "cust-qflag-rd1"
    else
      metric = "cust-qflag-rd0"
    end
    
    incMetric(metric, 20)
    
    return DNSAction.None
  end
]]
addAction(ProbaRule(0.01), LuaFFIPerThreadAction(custDqMetrics))
```

And in fact, the throughput is about 5% higher.

**Reply by rgacogne** [reply]
Oh, that's nice, thank you! So the impact of using custom metrics is still noticeable. Looking at the code I think we can make the impact a bit lower, I'll do some tests.

**Reply by paddg** [reply]
Yes, thank you very much! It would be helpful if you could verify the tests, because I can't reliably reproduce them.

**Reply by paddg** [reply]
Sorry, there was an error in my script. will redo the tests.

**Reply by paddg** [reply]
The difference still seems to be ~5%. But please do not trust my tests too much.

**Reply by rgacogne** [reply]
I'm getting very good results with https://github.com/PowerDNS/pdns/pull/15524, but please be aware that this is still a draft pull request at the moment, it needs more testing and a good review!

**Reply by paddg** [reply]
Okay, thank you!

**Reply by paddg** [reply]
Hello Remi,

Just for the Record. Our use case hasn't improved with #15524 (tested with 2.0.0-rc1). However, we're very happy with your per-thread FFI  porting of our custom-metrics implementation.

**Reply by rgacogne** [reply]
Hi Winfried, 

Thanks a lot for the feedback, this is very valuable. I'll do more tests to see if I can reduce the impact of using custom metrics further in a couple days, and update this discussion.
