### ISSUE TITLE
rec: Spoof nearmiss message is miss leading or not triggered sooner?

### ISSUE THREAD

**Issue by phonedph1** [PowerDNS/pdns#9846]
- Program: Recursor
 - Issue type: Bug report

### Environment
 - Operating system: EL7
 - Software version: 4.3.2
 - Software source: compiled

### Steps to reproduce
1. `dig 1-2-3-4.app.xiaofengtest.com @<resolver>`
2. tcpdump for traffic from `50.18.90.107` and watch syslogs.

### Expected behaviour
Spoof attempt logged at something closer to 20 rather than `pdns_recursor: Too many (99 > 20) bogus answers for '1-2-3-4.app.xiaofengtest.com' from 50.18.90.107, assuming spoof attempt.`

### Actual behaviour
```
13:55:51.887752 IP <resolver>.32821 > 50.18.90.107.53: 32099 [1au] A? 1-2-3-4.app.xiaofengtest.com. (57)
13:55:51.914968 IP 50.18.90.107.53 > <resolver>.32821: 32000*- 1/0/1 A 1.2.3.4 (101)
13:55:51.914985 IP 50.18.90.107.53 > <resolver>.32821: 32001*- 1/0/1 A 1.2.3.4 (101)
13:55:51.914990 IP 50.18.90.107.53 > <resolver>.32821: 32002*- 1/0/1 A 1.2.3.4 (101)
13:55:51.915089 IP 50.18.90.107.53 > <resolver>.32821: 32003*- 1/0/1 A 1.2.3.4 (101)
13:55:51.915099 IP 50.18.90.107.53 > <resolver>.32821: 32004*- 1/0/1 A 1.2.3.4 (101)
13:55:51.915112 IP 50.18.90.107.53 > <resolver>.32821: 32005*- 1/0/1 A 1.2.3.4 (101)
13:55:51.915116 IP 50.18.90.107.53 > <resolver>.32821: 32006*- 1/0/1 A 1.2.3.4 (101)
13:55:51.915121 IP 50.18.90.107.53 > <resolver>.32821: 32007*- 1/0/1 A 1.2.3.4 (101)
13:55:51.915124 IP 50.18.90.107.53 > <resolver>.32821: 32008*- 1/0/1 A 1.2.3.4 (101)
13:55:51.915126 IP 50.18.90.107.53 > <resolver>.32821: 32009*- 1/0/1 A 1.2.3.4 (101)
13:55:51.915129 IP 50.18.90.107.53 > <resolver>.32821: 32010*- 1/0/1 A 1.2.3.4 (101)
13:55:51.915131 IP 50.18.90.107.53 > <resolver>.32821: 32011*- 1/0/1 A 1.2.3.4 (101)
13:55:51.915133 IP 50.18.90.107.53 > <resolver>.32821: 32012*- 1/0/1 A 1.2.3.4 (101)
13:55:51.915136 IP 50.18.90.107.53 > <resolver>.32821: 32013*- 1/0/1 A 1.2.3.4 (101)
13:55:51.915139 IP 50.18.90.107.53 > <resolver>.32821: 32014*- 1/0/1 A 1.2.3.4 (101)
13:55:51.915142 IP 50.18.90.107.53 > <resolver>.32821: 32015*- 1/0/1 A 1.2.3.4 (101)
13:55:51.915144 IP 50.18.90.107.53 > <resolver>.32821: 32016*- 1/0/1 A 1.2.3.4 (101)
13:55:51.915147 IP 50.18.90.107.53 > <resolver>.32821: 32017*- 1/0/1 A 1.2.3.4 (101)
13:55:51.915149 IP 50.18.90.107.53 > <resolver>.32821: 32018*- 1/0/1 A 1.2.3.4 (101)
13:55:51.915153 IP 50.18.90.107.53 > <resolver>.32821: 32019*- 1/0/1 A 1.2.3.4 (101)
13:55:51.915155 IP 50.18.90.107.53 > <resolver>.32821: 32020*- 1/0/1 A 1.2.3.4 (101)
13:55:51.915158 IP 50.18.90.107.53 > <resolver>.32821: 32021*- 1/0/1 A 1.2.3.4 (101)
13:55:51.915160 IP 50.18.90.107.53 > <resolver>.32821: 32022*- 1/0/1 A 1.2.3.4 (101)
13:55:51.915163 IP 50.18.90.107.53 > <resolver>.32821: 32023*- 1/0/1 A 1.2.3.4 (101)
13:55:51.915208 IP 50.18.90.107.53 > <resolver>.32821: 32024*- 1/0/1 A 1.2.3.4 (101)
13:55:51.915212 IP 50.18.90.107.53 > <resolver>.32821: 32025*- 1/0/1 A 1.2.3.4 (101)
13:55:51.915215 IP 50.18.90.107.53 > <resolver>.32821: 32026*- 1/0/1 A 1.2.3.4 (101)
13:55:51.915218 IP 50.18.90.107.53 > <resolver>.32821: 32027*- 1/0/1 A 1.2.3.4 (101)
13:55:51.915221 IP 50.18.90.107.53 > <resolver>.32821: 32028*- 1/0/1 A 1.2.3.4 (101)
13:55:51.915223 IP 50.18.90.107.53 > <resolver>.32821: 32029*- 1/0/1 A 1.2.3.4 (101)
13:55:51.915225 IP 50.18.90.107.53 > <resolver>.32821: 32030*- 1/0/1 A 1.2.3.4 (101)
13:55:51.915228 IP 50.18.90.107.53 > <resolver>.32821: 32031*- 1/0/1 A 1.2.3.4 (101)
13:55:51.915231 IP 50.18.90.107.53 > <resolver>.32821: 32032*- 1/0/1 A 1.2.3.4 (101)
13:55:51.915234 IP 50.18.90.107.53 > <resolver>.32821: 32033*- 1/0/1 A 1.2.3.4 (101)
13:55:51.915236 IP 50.18.90.107.53 > <resolver>.32821: 32034*- 1/0/1 A 1.2.3.4 (101)
13:55:51.915239 IP 50.18.90.107.53 > <resolver>.32821: 32035*- 1/0/1 A 1.2.3.4 (101)
13:55:51.915241 IP 50.18.90.107.53 > <resolver>.32821: 32036*- 1/0/1 A 1.2.3.4 (101)
13:55:51.915244 IP 50.18.90.107.53 > <resolver>.32821: 32037*- 1/0/1 A 1.2.3.4 (101)
13:55:51.915246 IP 50.18.90.107.53 > <resolver>.32821: 32038*- 1/0/1 A 1.2.3.4 (101)
13:55:51.915248 IP 50.18.90.107.53 > <resolver>.32821: 32039*- 1/0/1 A 1.2.3.4 (101)
13:55:51.915251 IP 50.18.90.107.53 > <resolver>.32821: 32040*- 1/0/1 A 1.2.3.4 (101)
13:55:51.915253 IP 50.18.90.107.53 > <resolver>.32821: 32041*- 1/0/1 A 1.2.3.4 (101)
13:55:51.915256 IP 50.18.90.107.53 > <resolver>.32821: 32042*- 1/0/1 A 1.2.3.4 (101)
13:55:51.915325 IP 50.18.90.107.53 > <resolver>.32821: 32043*- 1/0/1 A 1.2.3.4 (101)
13:55:51.915331 IP 50.18.90.107.53 > <resolver>.32821: 32044*- 1/0/1 A 1.2.3.4 (101)
13:55:51.915333 IP 50.18.90.107.53 > <resolver>.32821: 32045*- 1/0/1 A 1.2.3.4 (101)
13:55:51.915336 IP 50.18.90.107.53 > <resolver>.32821: 32046*- 1/0/1 A 1.2.3.4 (101)
13:55:51.915339 IP 50.18.90.107.53 > <resolver>.32821: 32047*- 1/0/1 A 1.2.3.4 (101)
13:55:51.915341 IP 50.18.90.107.53 > <resolver>.32821: 32048*- 1/0/1 A 1.2.3.4 (101)
13:55:51.915344 IP 50.18.90.107.53 > <resolver>.32821: 32049*- 1/0/1 A 1.2.3.4 (101)
13:55:51.915346 IP 50.18.90.107.53 > <resolver>.32821: 32050*- 1/0/1 A 1.2.3.4 (101)
13:55:51.915349 IP 50.18.90.107.53 > <resolver>.32821: 32051*- 1/0/1 A 1.2.3.4 (101)
13:55:51.915351 IP 50.18.90.107.53 > <resolver>.32821: 32052*- 1/0/1 A 1.2.3.4 (101)
13:55:51.915354 IP 50.18.90.107.53 > <resolver>.32821: 32053*- 1/0/1 A 1.2.3.4 (101)
13:55:51.915356 IP 50.18.90.107.53 > <resolver>.32821: 32054*- 1/0/1 A 1.2.3.4 (101)
13:55:51.915358 IP 50.18.90.107.53 > <resolver>.32821: 32055*- 1/0/1 A 1.2.3.4 (101)
13:55:51.915360 IP 50.18.90.107.53 > <resolver>.32821: 32056*- 1/0/1 A 1.2.3.4 (101)
13:55:51.915363 IP 50.18.90.107.53 > <resolver>.32821: 32057*- 1/0/1 A 1.2.3.4 (101)
13:55:51.915366 IP 50.18.90.107.53 > <resolver>.32821: 32058*- 1/0/1 A 1.2.3.4 (101)
13:55:51.915368 IP 50.18.90.107.53 > <resolver>.32821: 32059*- 1/0/1 A 1.2.3.4 (101)
13:55:51.915371 IP 50.18.90.107.53 > <resolver>.32821: 32060*- 1/0/1 A 1.2.3.4 (101)
13:55:51.915373 IP 50.18.90.107.53 > <resolver>.32821: 32061*- 1/0/1 A 1.2.3.4 (101)
13:55:51.915386 IP 50.18.90.107.53 > <resolver>.32821: 32062*- 1/0/1 A 1.2.3.4 (101)
13:55:51.915389 IP 50.18.90.107.53 > <resolver>.32821: 32063*- 1/0/1 A 1.2.3.4 (101)
13:55:51.915391 IP 50.18.90.107.53 > <resolver>.32821: 32064*- 1/0/1 A 1.2.3.4 (101)
13:55:51.915393 IP 50.18.90.107.53 > <resolver>.32821: 32065*- 1/0/1 A 1.2.3.4 (101)
13:55:51.915395 IP 50.18.90.107.53 > <resolver>.32821: 32066*- 1/0/1 A 1.2.3.4 (101)
13:55:51.915397 IP 50.18.90.107.53 > <resolver>.32821: 32067*- 1/0/1 A 1.2.3.4 (101)
13:55:51.915446 IP 50.18.90.107.53 > <resolver>.32821: 32068*- 1/0/1 A 1.2.3.4 (101)
13:55:51.915449 IP 50.18.90.107.53 > <resolver>.32821: 32069*- 1/0/1 A 1.2.3.4 (101)
13:55:51.915451 IP 50.18.90.107.53 > <resolver>.32821: 32070*- 1/0/1 A 1.2.3.4 (101)
13:55:51.915453 IP 50.18.90.107.53 > <resolver>.32821: 32071*- 1/0/1 A 1.2.3.4 (101)
13:55:51.915455 IP 50.18.90.107.53 > <resolver>.32821: 32072*- 1/0/1 A 1.2.3.4 (101)
13:55:51.915458 IP 50.18.90.107.53 > <resolver>.32821: 32073*- 1/0/1 A 1.2.3.4 (101)
13:55:51.915460 IP 50.18.90.107.53 > <resolver>.32821: 32074*- 1/0/1 A 1.2.3.4 (101)
13:55:51.915463 IP 50.18.90.107.53 > <resolver>.32821: 32075*- 1/0/1 A 1.2.3.4 (101)
13:55:51.915465 IP 50.18.90.107.53 > <resolver>.32821: 32076*- 1/0/1 A 1.2.3.4 (101)
13:55:51.915467 IP 50.18.90.107.53 > <resolver>.32821: 32077*- 1/0/1 A 1.2.3.4 (101)
13:55:51.915469 IP 50.18.90.107.53 > <resolver>.32821: 32078*- 1/0/1 A 1.2.3.4 (101)
13:55:51.915472 IP 50.18.90.107.53 > <resolver>.32821: 32079*- 1/0/1 A 1.2.3.4 (101)
13:55:51.915474 IP 50.18.90.107.53 > <resolver>.32821: 32080*- 1/0/1 A 1.2.3.4 (101)
13:55:51.915477 IP 50.18.90.107.53 > <resolver>.32821: 32081*- 1/0/1 A 1.2.3.4 (101)
13:55:51.915479 IP 50.18.90.107.53 > <resolver>.32821: 32082*- 1/0/1 A 1.2.3.4 (101)
13:55:51.915481 IP 50.18.90.107.53 > <resolver>.32821: 32083*- 1/0/1 A 1.2.3.4 (101)
13:55:51.915491 IP 50.18.90.107.53 > <resolver>.32821: 32084*- 1/0/1 A 1.2.3.4 (101)
13:55:51.915493 IP 50.18.90.107.53 > <resolver>.32821: 32085*- 1/0/1 A 1.2.3.4 (101)
13:55:51.915495 IP 50.18.90.107.53 > <resolver>.32821: 32086*- 1/0/1 A 1.2.3.4 (101)
13:55:51.915560 IP 50.18.90.107.53 > <resolver>.32821: 32087*- 1/0/1 A 1.2.3.4 (101)
13:55:51.915568 IP 50.18.90.107.53 > <resolver>.32821: 32088*- 1/0/1 A 1.2.3.4 (101)
13:55:51.915590 IP 50.18.90.107.53 > <resolver>.32821: 32089*- 1/0/1 A 1.2.3.4 (101)
13:55:51.915598 IP 50.18.90.107.53 > <resolver>.32821: 32090*- 1/0/1 A 1.2.3.4 (101)
13:55:51.915602 IP 50.18.90.107.53 > <resolver>.32821: 32091*- 1/0/1 A 1.2.3.4 (101)
13:55:51.915605 IP 50.18.90.107.53 > <resolver>.32821: 32092*- 1/0/1 A 1.2.3.4 (101)
13:55:51.915608 IP 50.18.90.107.53 > <resolver>.32821: 32093*- 1/0/1 A 1.2.3.4 (101)
13:55:51.915610 IP 50.18.90.107.53 > <resolver>.32821: 32094*- 1/0/1 A 1.2.3.4 (101)
13:55:51.915613 IP 50.18.90.107.53 > <resolver>.32821: 32095*- 1/0/1 A 1.2.3.4 (101)
13:55:51.915616 IP 50.18.90.107.53 > <resolver>.32821: 32096*- 1/0/1 A 1.2.3.4 (101)
13:55:51.915619 IP 50.18.90.107.53 > <resolver>.32821: 32097*- 1/0/1 A 1.2.3.4 (101)
13:55:51.915622 IP 50.18.90.107.53 > <resolver>.32821: 32098*- 1/0/1 A 1.2.3.4 (101)
13:55:51.915625 IP 50.18.90.107.53 > <resolver>.32821: 32099*- 1/0/1 A 1.2.3.4 (101)
 
pdns_recursor: Too many (99 > 20) bogus answers for '1-2-3-4.app.xiaofengtest.com' from 50.18.90.107, assuming spoof attempt.
```

### Other information
Per IRC discussion, not sure if this is the expected behaviour.

**Comment by phonedph1** [comment]
I'll try with #9744 as well. Should have possibly done that before opening this. :)

**Comment by phonedph1** [comment]
#9744 looks a bit different - this is with log-common-errors on. 

It's not entirely clear at what point it switches to TCP. 

```
Dec  9 22:12:51 slurp pdns_recursor[23824]: Discarding unexpected packet from 50.18.90.107:53: 1-2-3-4.app.xiaofengtest.com., 1, 1 waiters
Dec  9 22:12:51 slurp pdns_recursor[23824]: Discarding unexpected packet from 50.18.90.107:53: 1-2-3-4.app.xiaofengtest.com., 1, 1 waiters
Dec  9 22:12:51 slurp pdns_recursor[23824]: Discarding unexpected packet from 50.18.90.107:53: 1-2-3-4.app.xiaofengtest.com., 1, 1 waiters
Dec  9 22:12:51 slurp pdns_recursor[23824]: Discarding unexpected packet from 50.18.90.107:53: 1-2-3-4.app.xiaofengtest.com., 1, 1 waiters
Dec  9 22:12:51 slurp pdns_recursor[23824]: Discarding unexpected packet from 50.18.90.107:53: 1-2-3-4.app.xiaofengtest.com., 1, 1 waiters
Dec  9 22:12:51 slurp pdns_recursor[23824]: Discarding unexpected packet from 50.18.90.107:53: 1-2-3-4.app.xiaofengtest.com., 1, 1 waiters
Dec  9 22:12:51 slurp pdns_recursor[23824]: Discarding unexpected packet from 50.18.90.107:53: 1-2-3-4.app.xiaofengtest.com., 1, 1 waiters
Dec  9 22:12:51 slurp pdns_recursor[23824]: Discarding unexpected packet from 50.18.90.107:53: 1-2-3-4.app.xiaofengtest.com., 1, 1 waiters
Dec  9 22:12:51 slurp pdns_recursor[23824]: Discarding unexpected packet from 50.18.90.107:53: 1-2-3-4.app.xiaofengtest.com., 1, 1 waiters
Dec  9 22:12:51 slurp pdns_recursor[23824]: Discarding unexpected packet from 50.18.90.107:53: 1-2-3-4.app.xiaofengtest.com., 1, 1 waiters
Dec  9 22:12:51 slurp pdns_recursor[23824]: Discarding unexpected packet from 50.18.90.107:53: 1-2-3-4.app.xiaofengtest.com., 1, 1 waiters
Dec  9 22:12:51 slurp pdns_recursor[23824]: Discarding unexpected packet from 50.18.90.107:53: 1-2-3-4.app.xiaofengtest.com., 1, 1 waiters
Dec  9 22:12:51 slurp pdns_recursor[23824]: Discarding unexpected packet from 50.18.90.107:53: 1-2-3-4.app.xiaofengtest.com., 1, 1 waiters
Dec  9 22:12:51 slurp pdns_recursor[23824]: Discarding unexpected packet from 50.18.90.107:53: 1-2-3-4.app.xiaofengtest.com., 1, 1 waiters
Dec  9 22:12:51 slurp pdns_recursor[23824]: Discarding unexpected packet from 50.18.90.107:53: 1-2-3-4.app.xiaofengtest.com., 1, 1 waiters
Dec  9 22:12:51 slurp pdns_recursor[23824]: Discarding unexpected packet from 50.18.90.107:53: 1-2-3-4.app.xiaofengtest.com., 1, 1 waiters
Dec  9 22:12:51 slurp pdns_recursor[23824]: Discarding unexpected packet from 50.18.90.107:53: 1-2-3-4.app.xiaofengtest.com., 1, 1 waiters
Dec  9 22:12:51 slurp pdns_recursor[23824]: Discarding unexpected packet from 50.18.90.107:53: 1-2-3-4.app.xiaofengtest.com., 1, 1 waiters
Dec  9 22:12:51 slurp pdns_recursor[23824]: Discarding unexpected packet from 50.18.90.107:53: 1-2-3-4.app.xiaofengtest.com., 1, 1 waiters
Dec  9 22:12:51 slurp pdns_recursor[23824]: Discarding unexpected packet from 50.18.90.107:53: 1-2-3-4.app.xiaofengtest.com., 1, 1 waiters
Dec  9 22:12:51 slurp pdns_recursor[23824]: Discarding unexpected packet from 50.18.90.107:53: 1-2-3-4.app.xiaofengtest.com., 1, 1 waiters
Dec  9 22:12:51 slurp pdns_recursor[23824]: Discarding unexpected packet from 50.18.90.107:53: 1-2-3-4.app.xiaofengtest.com., 1, 1 waiters
Dec  9 22:12:51 slurp pdns_recursor[23824]: Discarding unexpected packet from 50.18.90.107:53: 1-2-3-4.app.xiaofengtest.com., 1, 1 waiters
Dec  9 22:12:51 slurp pdns_recursor[23824]: Discarding unexpected packet from 50.18.90.107:53: 1-2-3-4.app.xiaofengtest.com., 1, 1 waiters
Dec  9 22:12:51 slurp pdns_recursor[23824]: Discarding unexpected packet from 50.18.90.107:53: 1-2-3-4.app.xiaofengtest.com., 1, 1 waiters
Dec  9 22:12:51 slurp pdns_recursor[23824]: Discarding unexpected packet from 50.18.90.107:53: 1-2-3-4.app.xiaofengtest.com., 1, 1 waiters
Dec  9 22:12:51 slurp pdns_recursor[23824]: Discarding unexpected packet from 50.18.90.107:53: 1-2-3-4.app.xiaofengtest.com., 1, 1 waiters
Dec  9 22:12:51 slurp pdns_recursor[23824]: Discarding unexpected packet from 50.18.90.107:53: 1-2-3-4.app.xiaofengtest.com., 1, 1 waiters
Dec  9 22:12:51 slurp pdns_recursor[23824]: Discarding unexpected packet from 50.18.90.107:53: 1-2-3-4.app.xiaofengtest.com., 1, 1 waiters
Dec  9 22:12:51 slurp pdns_recursor[23824]: Discarding unexpected packet from 50.18.90.107:53: 1-2-3-4.app.xiaofengtest.com., 1, 1 waiters
Dec  9 22:12:51 slurp pdns_recursor[23824]: Discarding unexpected packet from 50.18.90.107:53: 1-2-3-4.app.xiaofengtest.com., 1, 1 waiters
Dec  9 22:12:51 slurp pdns_recursor[23824]: Discarding unexpected packet from 50.18.90.107:53: 1-2-3-4.app.xiaofengtest.com., 1, 1 waiters
Dec  9 22:12:51 slurp pdns_recursor[23824]: Discarding unexpected packet from 50.18.90.107:53: 1-2-3-4.app.xiaofengtest.com., 1, 1 waiters
Dec  9 22:12:51 slurp pdns_recursor[23824]: Discarding unexpected packet from 50.18.90.107:53: 1-2-3-4.app.xiaofengtest.com., 1, 1 waiters
Dec  9 22:12:51 slurp pdns_recursor[23824]: Discarding unexpected packet from 50.18.90.107:53: 1-2-3-4.app.xiaofengtest.com., 1, 1 waiters
Dec  9 22:12:51 slurp pdns_recursor[23824]: Discarding unexpected packet from 50.18.90.107:53: 1-2-3-4.app.xiaofengtest.com., 1, 1 waiters
Dec  9 22:12:51 slurp pdns_recursor[23824]: Discarding unexpected packet from 50.18.90.107:53: 1-2-3-4.app.xiaofengtest.com., 1, 1 waiters
Dec  9 22:12:51 slurp pdns_recursor[23824]: Discarding unexpected packet from 50.18.90.107:53: 1-2-3-4.app.xiaofengtest.com., 1, 1 waiters
Dec  9 22:12:51 slurp pdns_recursor[23824]: Discarding unexpected packet from 50.18.90.107:53: 1-2-3-4.app.xiaofengtest.com., 1, 1 waiters
Dec  9 22:12:51 slurp pdns_recursor[23824]: Discarding unexpected packet from 50.18.90.107:53: 1-2-3-4.app.xiaofengtest.com., 1, 1 waiters
Dec  9 22:12:51 slurp pdns_recursor[23824]: Discarding unexpected packet from 50.18.90.107:53: 1-2-3-4.app.xiaofengtest.com., 1, 1 waiters
Dec  9 22:12:51 slurp pdns_recursor[23824]: Discarding unexpected packet from 50.18.90.107:53: 1-2-3-4.app.xiaofengtest.com., 1, 1 waiters
Dec  9 22:12:51 slurp pdns_recursor[23824]: Discarding unexpected packet from 50.18.90.107:53: 1-2-3-4.app.xiaofengtest.com., 1, 1 waiters
Dec  9 22:12:51 slurp pdns_recursor[23824]: Discarding unexpected packet from 50.18.90.107:53: 1-2-3-4.app.xiaofengtest.com., 1, 1 waiters
Dec  9 22:12:51 slurp pdns_recursor[23824]: Discarding unexpected packet from 50.18.90.107:53: 1-2-3-4.app.xiaofengtest.com., 1, 1 waiters
Dec  9 22:12:51 slurp pdns_recursor[23824]: Discarding unexpected packet from 50.18.90.107:53: 1-2-3-4.app.xiaofengtest.com., 1, 1 waiters
Dec  9 22:12:51 slurp pdns_recursor[23824]: Discarding unexpected packet from 50.18.90.107:53: 1-2-3-4.app.xiaofengtest.com., 1, 1 waiters
Dec  9 22:12:51 slurp pdns_recursor[23824]: Discarding unexpected packet from 50.18.90.107:53: 1-2-3-4.app.xiaofengtest.com., 1, 1 waiters
Dec  9 22:12:51 slurp pdns_recursor[23824]: Discarding unexpected packet from 50.18.90.107:53: 1-2-3-4.app.xiaofengtest.com., 1, 1 waiters
Dec  9 22:12:51 slurp pdns_recursor[23824]: Discarding unexpected packet from 50.18.90.107:53: 1-2-3-4.app.xiaofengtest.com., 1, 1 waiters
Dec  9 22:12:51 slurp pdns_recursor[23824]: Discarding unexpected packet from 50.18.90.107:53: 1-2-3-4.app.xiaofengtest.com., 1, 1 waiters
Dec  9 22:12:51 slurp pdns_recursor[23824]: Discarding unexpected packet from 50.18.90.107:53: 1-2-3-4.app.xiaofengtest.com., 1, 1 waiters
Dec  9 22:12:51 slurp pdns_recursor[23824]: Discarding unexpected packet from 50.18.90.107:53: 1-2-3-4.app.xiaofengtest.com., 1, 1 waiters
Dec  9 22:12:51 slurp pdns_recursor[23824]: Discarding unexpected packet from 50.18.90.107:53: 1-2-3-4.app.xiaofengtest.com., 1, 1 waiters
Dec  9 22:12:51 slurp pdns_recursor[23824]: Discarding unexpected packet from 50.18.90.107:53: 1-2-3-4.app.xiaofengtest.com., 1, 1 waiters
Dec  9 22:12:51 slurp pdns_recursor[23824]: Discarding unexpected packet from 50.18.90.107:53: 1-2-3-4.app.xiaofengtest.com., 1, 1 waiters
Dec  9 22:12:51 slurp pdns_recursor[23824]: Discarding unexpected packet from 50.18.90.107:53: 1-2-3-4.app.xiaofengtest.com., 1, 1 waiters
Dec  9 22:12:51 slurp pdns_recursor[23824]: Discarding unexpected packet from 50.18.90.107:53: 1-2-3-4.app.xiaofengtest.com., 1, 1 waiters
Dec  9 22:12:51 slurp pdns_recursor[23824]: Discarding unexpected packet from 50.18.90.107:53: 1-2-3-4.app.xiaofengtest.com., 1, 1 waiters
Dec  9 22:12:51 slurp pdns_recursor[23824]: Discarding unexpected packet from 50.18.90.107:53: 1-2-3-4.app.xiaofengtest.com., 1, 1 waiters
Dec  9 22:12:51 slurp pdns_recursor[23824]: Discarding unexpected packet from 50.18.90.107:53: 1-2-3-4.app.xiaofengtest.com., 1, 1 waiters
Dec  9 22:12:51 slurp pdns_recursor[23824]: Discarding unexpected packet from 50.18.90.107:53: 1-2-3-4.app.xiaofengtest.com., 1, 1 waiters
Dec  9 22:12:51 slurp pdns_recursor[23824]: Discarding unexpected packet from 50.18.90.107:53: 1-2-3-4.app.xiaofengtest.com., 1, 1 waiters
Dec  9 22:12:51 slurp pdns_recursor[23824]: Discarding unexpected packet from 50.18.90.107:53: 1-2-3-4.app.xiaofengtest.com., 1, 1 waiters
Dec  9 22:12:51 slurp pdns_recursor[23824]: Discarding unexpected packet from 50.18.90.107:53: 1-2-3-4.app.xiaofengtest.com., 1, 1 waiters
Dec  9 22:12:51 slurp pdns_recursor[23824]: Discarding unexpected packet from 50.18.90.107:53: 1-2-3-4.app.xiaofengtest.com., 1, 1 waiters
Dec  9 22:12:51 slurp pdns_recursor[23824]: Discarding unexpected packet from 50.18.90.107:53: 1-2-3-4.app.xiaofengtest.com., 1, 1 waiters
Dec  9 22:12:51 slurp pdns_recursor[23824]: Discarding unexpected packet from 50.18.90.107:53: 1-2-3-4.app.xiaofengtest.com., 1, 1 waiters
Dec  9 22:12:51 slurp pdns_recursor[23824]: Discarding unexpected packet from 50.18.90.107:53: 1-2-3-4.app.xiaofengtest.com., 1, 1 waiters
Dec  9 22:12:51 slurp pdns_recursor[23824]: Discarding unexpected packet from 50.18.90.107:53: 1-2-3-4.app.xiaofengtest.com., 1, 1 waiters
Dec  9 22:12:51 slurp pdns_recursor[23824]: Discarding unexpected packet from 50.18.90.107:53: 1-2-3-4.app.xiaofengtest.com., 1, 1 waiters
Dec  9 22:12:51 slurp pdns_recursor[23824]: Discarding unexpected packet from 50.18.90.107:53: 1-2-3-4.app.xiaofengtest.com., 1, 1 waiters
Dec  9 22:12:51 slurp pdns_recursor[23824]: Discarding unexpected packet from 50.18.90.107:53: 1-2-3-4.app.xiaofengtest.com., 1, 1 waiters
Dec  9 22:12:51 slurp pdns_recursor[23824]: Discarding unexpected packet from 50.18.90.107:53: 1-2-3-4.app.xiaofengtest.com., 1, 1 waiters
Dec  9 22:12:51 slurp pdns_recursor[23824]: Discarding unexpected packet from 50.18.90.107:53: 1-2-3-4.app.xiaofengtest.com., 1, 1 waiters
Dec  9 22:12:51 slurp pdns_recursor[23824]: Discarding unexpected packet from 50.18.90.107:53: 1-2-3-4.app.xiaofengtest.com., 1, 1 waiters
Dec  9 22:12:51 slurp pdns_recursor[23824]: Discarding unexpected packet from 50.18.90.107:53: 1-2-3-4.app.xiaofengtest.com., 1, 1 waiters
Dec  9 22:12:51 slurp pdns_recursor[23824]: Discarding unexpected packet from 50.18.90.107:53: 1-2-3-4.app.xiaofengtest.com., 1, 1 waiters
Dec  9 22:12:51 slurp pdns_recursor[23824]: Discarding unexpected packet from 50.18.90.107:53: 1-2-3-4.app.xiaofengtest.com., 1, 1 waiters
Dec  9 22:12:51 slurp pdns_recursor[23824]: Discarding unexpected packet from 50.18.90.107:53: 1-2-3-4.app.xiaofengtest.com., 1, 1 waiters
Dec  9 22:12:51 slurp pdns_recursor[23824]: Discarding unexpected packet from 50.18.90.107:53: 1-2-3-4.app.xiaofengtest.com., 1, 1 waiters
Dec  9 22:12:51 slurp pdns_recursor[23824]: Discarding unexpected packet from 50.18.90.107:53: 1-2-3-4.app.xiaofengtest.com., 1, 1 waiters
Dec  9 22:12:51 slurp pdns_recursor[23824]: Discarding unexpected packet from 50.18.90.107:53: 1-2-3-4.app.xiaofengtest.com., 1, 1 waiters
Dec  9 22:12:51 slurp pdns_recursor[23824]: Discarding unexpected packet from 50.18.90.107:53: 1-2-3-4.app.xiaofengtest.com., 1, 1 waiters
Dec  9 22:12:51 slurp pdns_recursor[23824]: Discarding unexpected packet from 50.18.90.107:53: 1-2-3-4.app.xiaofengtest.com., 1, 1 waiters
Dec  9 22:12:51 slurp pdns_recursor[23824]: Discarding unexpected packet from 50.18.90.107:53: 1-2-3-4.app.xiaofengtest.com., 1, 1 waiters
Dec  9 22:12:51 slurp pdns_recursor[23824]: Discarding unexpected packet from 50.18.90.107:53: 1-2-3-4.app.xiaofengtest.com., 1, 1 waiters
Dec  9 22:12:51 slurp pdns_recursor[23824]: Discarding unexpected packet from 50.18.90.107:53: 1-2-3-4.app.xiaofengtest.com., 1, 1 waiters
Dec  9 22:12:51 slurp pdns_recursor[23824]: Discarding unexpected packet from 50.18.90.107:53: 1-2-3-4.app.xiaofengtest.com., 1, 1 waiters
Dec  9 22:12:51 slurp pdns_recursor[23824]: Discarding unexpected packet from 50.18.90.107:53: 1-2-3-4.app.xiaofengtest.com., 1, 1 waiters
Dec  9 22:12:51 slurp pdns_recursor[23824]: Discarding unexpected packet from 50.18.90.107:53: 1-2-3-4.app.xiaofengtest.com., 1, 1 waiters
Dec  9 22:12:51 slurp pdns_recursor[23824]: Discarding unexpected packet from 50.18.90.107:53: 1-2-3-4.app.xiaofengtest.com., 1, 1 waiters
Dec  9 22:12:51 slurp pdns_recursor[23824]: Discarding unexpected packet from 50.18.90.107:53: 1-2-3-4.app.xiaofengtest.com., 1, 1 waiters
Dec  9 22:12:51 slurp pdns_recursor[23824]: Discarding unexpected packet from 50.18.90.107:53: 1-2-3-4.app.xiaofengtest.com., 1, 1 waiters
Dec  9 22:12:51 slurp pdns_recursor[23824]: Discarding unexpected packet from 50.18.90.107:53: 1-2-3-4.app.xiaofengtest.com., 1, 1 waiters
Dec  9 22:12:51 slurp pdns_recursor[23824]: Discarding unexpected packet from 50.18.90.107:53: 1-2-3-4.app.xiaofengtest.com., 1, 1 waiters
Dec  9 22:12:51 slurp pdns_recursor[23824]: Discarding unexpected packet from 50.18.90.107:53: 1-2-3-4.app.xiaofengtest.com., 1, 1 waiters
Dec  9 22:12:51 slurp pdns_recursor[23824]: Discarding unexpected packet from 50.18.90.107:53: 1-2-3-4.app.xiaofengtest.com., 1, 1 waiters
Dec  9 22:12:51 slurp pdns_recursor[23824]: Discarding unexpected packet from 50.18.90.107:53: 1-2-3-4.app.xiaofengtest.com., 1, 1 waiters
Dec  9 22:12:51 slurp pdns_recursor[23824]: Too many (99 > 20) answers with a wrong message ID for '1-2-3-4.app.xiaofengtest.com' from 50.18.90.107, assuming spoof attempt.

22:12:51.714023 IP 172.31.42.68.40081 > 50.18.90.107.53: 47353 [1au] A? 1-2-3-4.app.xiaofengtest.com. (57)
22:12:51.746424 IP 50.18.90.107.53 > 172.31.42.68.40081: 47254*- 1/0/1 A 1.2.3.4 (101)
22:12:51.746432 IP 50.18.90.107.53 > 172.31.42.68.40081: 47255*- 1/0/1 A 1.2.3.4 (101)
22:12:51.746434 IP 50.18.90.107.53 > 172.31.42.68.40081: 47256*- 1/0/1 A 1.2.3.4 (101)
22:12:51.746436 IP 50.18.90.107.53 > 172.31.42.68.40081: 47257*- 1/0/1 A 1.2.3.4 (101)
22:12:51.746437 IP 50.18.90.107.53 > 172.31.42.68.40081: 47258*- 1/0/1 A 1.2.3.4 (101)
22:12:51.746439 IP 50.18.90.107.53 > 172.31.42.68.40081: 47259*- 1/0/1 A 1.2.3.4 (101)
22:12:51.746441 IP 50.18.90.107.53 > 172.31.42.68.40081: 47260*- 1/0/1 A 1.2.3.4 (101)
22:12:51.746454 IP 50.18.90.107.53 > 172.31.42.68.40081: 47261*- 1/0/1 A 1.2.3.4 (101)
22:12:51.746456 IP 50.18.90.107.53 > 172.31.42.68.40081: 47262*- 1/0/1 A 1.2.3.4 (101)
22:12:51.746458 IP 50.18.90.107.53 > 172.31.42.68.40081: 47263*- 1/0/1 A 1.2.3.4 (101)
22:12:51.746461 IP 50.18.90.107.53 > 172.31.42.68.40081: 47264*- 1/0/1 A 1.2.3.4 (101)
22:12:51.746477 IP 50.18.90.107.53 > 172.31.42.68.40081: 47265*- 1/0/1 A 1.2.3.4 (101)
22:12:51.746480 IP 50.18.90.107.53 > 172.31.42.68.40081: 47266*- 1/0/1 A 1.2.3.4 (101)
22:12:51.746496 IP 50.18.90.107.53 > 172.31.42.68.40081: 47267*- 1/0/1 A 1.2.3.4 (101)
22:12:51.746498 IP 50.18.90.107.53 > 172.31.42.68.40081: 47268*- 1/0/1 A 1.2.3.4 (101)
22:12:51.746515 IP 50.18.90.107.53 > 172.31.42.68.40081: 47269*- 1/0/1 A 1.2.3.4 (101)
22:12:51.746517 IP 50.18.90.107.53 > 172.31.42.68.40081: 47270*- 1/0/1 A 1.2.3.4 (101)
22:12:51.746534 IP 50.18.90.107.53 > 172.31.42.68.40081: 47271*- 1/0/1 A 1.2.3.4 (101)
22:12:51.746536 IP 50.18.90.107.53 > 172.31.42.68.40081: 47272*- 1/0/1 A 1.2.3.4 (101)
22:12:51.746564 IP 50.18.90.107.53 > 172.31.42.68.40081: 47273*- 1/0/1 A 1.2.3.4 (101)
22:12:51.746566 IP 50.18.90.107.53 > 172.31.42.68.40081: 47274*- 1/0/1 A 1.2.3.4 (101)
22:12:51.746585 IP 50.18.90.107.53 > 172.31.42.68.40081: 47275*- 1/0/1 A 1.2.3.4 (101)
22:12:51.746587 IP 50.18.90.107.53 > 172.31.42.68.40081: 47276*- 1/0/1 A 1.2.3.4 (101)
22:12:51.746605 IP 50.18.90.107.53 > 172.31.42.68.40081: 47277*- 1/0/1 A 1.2.3.4 (101)
22:12:51.746607 IP 50.18.90.107.53 > 172.31.42.68.40081: 47278*- 1/0/1 A 1.2.3.4 (101)
22:12:51.746636 IP 50.18.90.107.53 > 172.31.42.68.40081: 47279*- 1/0/1 A 1.2.3.4 (101)
22:12:51.746638 IP 50.18.90.107.53 > 172.31.42.68.40081: 47280*- 1/0/1 A 1.2.3.4 (101)
22:12:51.746657 IP 50.18.90.107.53 > 172.31.42.68.40081: 47281*- 1/0/1 A 1.2.3.4 (101)
22:12:51.746672 IP 50.18.90.107.53 > 172.31.42.68.40081: 47282*- 1/0/1 A 1.2.3.4 (101)
22:12:51.746691 IP 50.18.90.107.53 > 172.31.42.68.40081: 47283*- 1/0/1 A 1.2.3.4 (101)
22:12:51.746693 IP 50.18.90.107.53 > 172.31.42.68.40081: 47284*- 1/0/1 A 1.2.3.4 (101)
22:12:51.746712 IP 50.18.90.107.53 > 172.31.42.68.40081: 47285*- 1/0/1 A 1.2.3.4 (101)
22:12:51.746714 IP 50.18.90.107.53 > 172.31.42.68.40081: 47286*- 1/0/1 A 1.2.3.4 (101)
22:12:51.746731 IP 50.18.90.107.53 > 172.31.42.68.40081: 47287*- 1/0/1 A 1.2.3.4 (101)
22:12:51.746733 IP 50.18.90.107.53 > 172.31.42.68.40081: 47288*- 1/0/1 A 1.2.3.4 (101)
22:12:51.746758 IP 50.18.90.107.53 > 172.31.42.68.40081: 47289*- 1/0/1 A 1.2.3.4 (101)
22:12:51.746774 IP 50.18.90.107.53 > 172.31.42.68.40081: 47290*- 1/0/1 A 1.2.3.4 (101)
22:12:51.746777 IP 50.18.90.107.53 > 172.31.42.68.40081: 47291*- 1/0/1 A 1.2.3.4 (101)
22:12:51.746794 IP 50.18.90.107.53 > 172.31.42.68.40081: 47292*- 1/0/1 A 1.2.3.4 (101)
22:12:51.746797 IP 50.18.90.107.53 > 172.31.42.68.40081: 47293*- 1/0/1 A 1.2.3.4 (101)
22:12:51.746812 IP 50.18.90.107.53 > 172.31.42.68.40081: 47294*- 1/0/1 A 1.2.3.4 (101)
22:12:51.746814 IP 50.18.90.107.53 > 172.31.42.68.40081: 47295*- 1/0/1 A 1.2.3.4 (101)
22:12:51.746830 IP 50.18.90.107.53 > 172.31.42.68.40081: 47296*- 1/0/1 A 1.2.3.4 (101)
22:12:51.746833 IP 50.18.90.107.53 > 172.31.42.68.40081: 47297*- 1/0/1 A 1.2.3.4 (101)
22:12:51.746848 IP 50.18.90.107.53 > 172.31.42.68.40081: 47298*- 1/0/1 A 1.2.3.4 (101)
22:12:51.746850 IP 50.18.90.107.53 > 172.31.42.68.40081: 47299*- 1/0/1 A 1.2.3.4 (101)
22:12:51.746867 IP 50.18.90.107.53 > 172.31.42.68.40081: 47300*- 1/0/1 A 1.2.3.4 (101)
22:12:51.746869 IP 50.18.90.107.53 > 172.31.42.68.40081: 47301*- 1/0/1 A 1.2.3.4 (101)
22:12:51.746893 IP 50.18.90.107.53 > 172.31.42.68.40081: 47302*- 1/0/1 A 1.2.3.4 (101)
22:12:51.746911 IP 50.18.90.107.53 > 172.31.42.68.40081: 47303*- 1/0/1 A 1.2.3.4 (101)
22:12:51.746920 IP 50.18.90.107.53 > 172.31.42.68.40081: 47304*- 1/0/1 A 1.2.3.4 (101)
22:12:51.746937 IP 50.18.90.107.53 > 172.31.42.68.40081: 47305*- 1/0/1 A 1.2.3.4 (101)
22:12:51.746998 IP 50.18.90.107.53 > 172.31.42.68.40081: 47306*- 1/0/1 A 1.2.3.4 (101)
22:12:51.747012 IP 50.18.90.107.53 > 172.31.42.68.40081: 47307*- 1/0/1 A 1.2.3.4 (101)
22:12:51.747014 IP 50.18.90.107.53 > 172.31.42.68.40081: 47308*- 1/0/1 A 1.2.3.4 (101)
22:12:51.747015 IP 50.18.90.107.53 > 172.31.42.68.40081: 47309*- 1/0/1 A 1.2.3.4 (101)
22:12:51.747016 IP 50.18.90.107.53 > 172.31.42.68.40081: 47310*- 1/0/1 A 1.2.3.4 (101)
22:12:51.747035 IP 50.18.90.107.53 > 172.31.42.68.40081: 47311*- 1/0/1 A 1.2.3.4 (101)
22:12:51.747037 IP 50.18.90.107.53 > 172.31.42.68.40081: 47312*- 1/0/1 A 1.2.3.4 (101)
22:12:51.747040 IP 50.18.90.107.53 > 172.31.42.68.40081: 47313*- 1/0/1 A 1.2.3.4 (101)
22:12:51.747042 IP 50.18.90.107.53 > 172.31.42.68.40081: 47314*- 1/0/1 A 1.2.3.4 (101)
22:12:51.747057 IP 50.18.90.107.53 > 172.31.42.68.40081: 47315*- 1/0/1 A 1.2.3.4 (101)
22:12:51.747073 IP 50.18.90.107.53 > 172.31.42.68.40081: 47316*- 1/0/1 A 1.2.3.4 (101)
22:12:51.747074 IP 50.18.90.107.53 > 172.31.42.68.40081: 47317*- 1/0/1 A 1.2.3.4 (101)
22:12:51.747093 IP 50.18.90.107.53 > 172.31.42.68.40081: 47318*- 1/0/1 A 1.2.3.4 (101)
22:12:51.747095 IP 50.18.90.107.53 > 172.31.42.68.40081: 47319*- 1/0/1 A 1.2.3.4 (101)
22:12:51.747119 IP 50.18.90.107.53 > 172.31.42.68.40081: 47320*- 1/0/1 A 1.2.3.4 (101)
22:12:51.747136 IP 50.18.90.107.53 > 172.31.42.68.40081: 47321*- 1/0/1 A 1.2.3.4 (101)
22:12:51.747137 IP 50.18.90.107.53 > 172.31.42.68.40081: 47322*- 1/0/1 A 1.2.3.4 (101)
22:12:51.747154 IP 50.18.90.107.53 > 172.31.42.68.40081: 47323*- 1/0/1 A 1.2.3.4 (101)
22:12:51.747155 IP 50.18.90.107.53 > 172.31.42.68.40081: 47324*- 1/0/1 A 1.2.3.4 (101)
22:12:51.747171 IP 50.18.90.107.53 > 172.31.42.68.40081: 47325*- 1/0/1 A 1.2.3.4 (101)
22:12:51.747173 IP 50.18.90.107.53 > 172.31.42.68.40081: 47326*- 1/0/1 A 1.2.3.4 (101)
22:12:51.747190 IP 50.18.90.107.53 > 172.31.42.68.40081: 47327*- 1/0/1 A 1.2.3.4 (101)
22:12:51.747192 IP 50.18.90.107.53 > 172.31.42.68.40081: 47328*- 1/0/1 A 1.2.3.4 (101)
22:12:51.747208 IP 50.18.90.107.53 > 172.31.42.68.40081: 47329*- 1/0/1 A 1.2.3.4 (101)
22:12:51.747210 IP 50.18.90.107.53 > 172.31.42.68.40081: 47330*- 1/0/1 A 1.2.3.4 (101)
22:12:51.747225 IP 50.18.90.107.53 > 172.31.42.68.40081: 47331*- 1/0/1 A 1.2.3.4 (101)
22:12:51.747239 IP 50.18.90.107.53 > 172.31.42.68.40081: 47332*- 1/0/1 A 1.2.3.4 (101)
22:12:51.747240 IP 50.18.90.107.53 > 172.31.42.68.40081: 47333*- 1/0/1 A 1.2.3.4 (101)
22:12:51.747258 IP 50.18.90.107.53 > 172.31.42.68.40081: 47334*- 1/0/1 A 1.2.3.4 (101)
22:12:51.747261 IP 50.18.90.107.53 > 172.31.42.68.40081: 47335*- 1/0/1 A 1.2.3.4 (101)
22:12:51.747275 IP 50.18.90.107.53 > 172.31.42.68.40081: 47336*- 1/0/1 A 1.2.3.4 (101)
22:12:51.747277 IP 50.18.90.107.53 > 172.31.42.68.40081: 47337*- 1/0/1 A 1.2.3.4 (101)
22:12:51.747294 IP 50.18.90.107.53 > 172.31.42.68.40081: 47338*- 1/0/1 A 1.2.3.4 (101)
22:12:51.747296 IP 50.18.90.107.53 > 172.31.42.68.40081: 47339*- 1/0/1 A 1.2.3.4 (101)
22:12:51.747310 IP 50.18.90.107.53 > 172.31.42.68.40081: 47340*- 1/0/1 A 1.2.3.4 (101)
22:12:51.747312 IP 50.18.90.107.53 > 172.31.42.68.40081: 47341*- 1/0/1 A 1.2.3.4 (101)
22:12:51.747327 IP 50.18.90.107.53 > 172.31.42.68.40081: 47342*- 1/0/1 A 1.2.3.4 (101)
22:12:51.747329 IP 50.18.90.107.53 > 172.31.42.68.40081: 47343*- 1/0/1 A 1.2.3.4 (101)
22:12:51.747346 IP 50.18.90.107.53 > 172.31.42.68.40081: 47344*- 1/0/1 A 1.2.3.4 (101)
22:12:51.747347 IP 50.18.90.107.53 > 172.31.42.68.40081: 47345*- 1/0/1 A 1.2.3.4 (101)
22:12:51.747369 IP 50.18.90.107.53 > 172.31.42.68.40081: 47346*- 1/0/1 A 1.2.3.4 (101)
22:12:51.747372 IP 50.18.90.107.53 > 172.31.42.68.40081: 47347*- 1/0/1 A 1.2.3.4 (101)
22:12:51.747394 IP 50.18.90.107.53 > 172.31.42.68.40081: 47348*- 1/0/1 A 1.2.3.4 (101)
22:12:51.747398 IP 50.18.90.107.53 > 172.31.42.68.40081: 47349*- 1/0/1 A 1.2.3.4 (101)
22:12:51.747400 IP 50.18.90.107.53 > 172.31.42.68.40081: 47350*- 1/0/1 A 1.2.3.4 (101)
22:12:51.747401 IP 50.18.90.107.53 > 172.31.42.68.40081: 47351*- 1/0/1 A 1.2.3.4 (101)
22:12:51.747483 IP 50.18.90.107.53 > 172.31.42.68.40081: 47352*- 1/0/1 A 1.2.3.4 (101)
22:12:51.747485 IP 50.18.90.107.53 > 172.31.42.68.40081: 47353*- 1/0/1 A 1.2.3.4 (101)
22:12:51.751381 IP 172.31.42.68.44287 > 50.18.90.107.53: Flags [S], seq 3397989667, win 26883, options [mss 8961,sackOK,TS val 2668298131 ecr 0,nop,wscale 6], length 0
22:12:52.768944 IP 172.31.42.68.44287 > 50.18.90.107.53: Flags [S], seq 3397989667, win 26883, options [mss 8961,sackOK,TS val 2668299148 ecr 0,nop,wscale 6], length 0
```

**Comment by phonedph1** [comment]
This behaviour is probably fine, just a bit confusing how it works at first. If nobody else considers it an issue will close this tomorrow.

As @mnordhoff points out, 
```
22:27 < Peng> If correct, the difference in outcome is how quickly it tries over TCP, right? Immediately switching to 
              TCP when it receives N near misses would be faster. But both are probably equally theoretically secure 
              more or less maybe.
```

**Comment by rgacogne** [comment]
The way it currently works if that we increase the counter on a near-miss, and we only check whether the counter is over the limit when a correct answer goes in, or after the timeout expired. That should not make any difference in terms of security, and we could save a bit of time (up to `network-timeout`) by doing the check and going to TCP immediately after receiving a `near-miss`, but it might require some plumbing. I'm not sure it's worth the trouble, unless we start seeing more spoofing attempts.
