### ISSUE TITLE
rec: QNAME minimization A query once sent to the bottom side of a zone cut

### ISSUE THREAD

**Issue by mnordhoff** [PowerDNS/pdns#8698]
- Program: Recursor
 - Issue type: Bug report

### Short description
One time, while working on `orl2.mattnordhoffdns.org`, Recursor sent an `A` query for `mattnordhoffdns.org` to... one of the nameservers for `mattnordhoffdns.org`. Not one of the `org` nameservers.

That doesn't make sense?

I don't have much information; I'm sorry.

### Environment
 - Operating system: Ubuntu 16.04 amd64
 - Software version: 4.3.0~beta1+master.21.g7b90d30d0-1pdns.xenial
 - Software source:  PowerDNS repository

This happened a while ago, but it was after #8648 was merged, and I don't think anything has happened to this part of the code since.

### Steps to reproduce
I don't know.

It was an `A` and `AAAA` lookup for `orl2.mattnordhoff.net`.

### Expected behaviour
Query for `mattnordhoffdns.org` `A` not to be sent at all, or to be sent to the `org` nameservers.

### Actual behaviour
Query for `mattnordhoffdns.org` `A` sent to one of `mattnordhoffdns.org`'s nameservers

### Other information
`tcpdump` (the odd thing happens a few lines from the end):

```
2019-12-22 00:03:48.090216 IP 127.0.0.1.53337 > 127.0.0.1.53: 64244+ [1au] A? orl2.mattnordhoff.net. (50)
2019-12-22 00:03:48.090225 IP 127.0.0.1.53337 > 127.0.0.1.53: 2615+ [1au] AAAA? orl2.mattnordhoff.net. (50)
2019-12-22 00:03:48.090943 IP6 2600:3c00::f03c:91ff:fe96:6bcc.60500 > 2606:4700:50::adf5:3a69.53: 5154 [1au] DS? orl2.mattnordhoff.net. (50)
2019-12-22 00:03:48.096222 IP6 2606:4700:50::adf5:3a69.53 > 2600:3c00::f03c:91ff:fe96:6bcc.60500: 5154*- 2/0/1 CNAME orl2.mattnordhoffdns.org., RRSIG (200)
2019-12-22 00:03:48.097576 IP6 2600:3c00::f03c:91ff:fe96:6bcc.42997 > 2606:4700:50::adf5:3a69.53: 29464 [1au] AAAA? orl2.mattnordhoff.net. (50)
2019-12-22 00:03:48.098303 IP6 2600:3c00::f03c:91ff:fe96:6bcc.12295 > 2606:4700:50::adf5:3a69.53: 11829 [1au] A? orl2.mattnordhoff.net. (50)
2019-12-22 00:03:48.101577 IP6 2606:4700:50::adf5:3a69.53 > 2600:3c00::f03c:91ff:fe96:6bcc.12295: 11829*- 2/0/1 CNAME orl2.mattnordhoffdns.org., RRSIG (200)
2019-12-22 00:03:48.102151 IP6 2606:4700:50::adf5:3a69.53 > 2600:3c00::f03c:91ff:fe96:6bcc.42997: 29464*- 2/0/1 CNAME orl2.mattnordhoffdns.org., RRSIG (200)
2019-12-22 00:03:48.103260 IP 104.237.139.208.37298 > 199.19.54.1.53: 1603 [1au] DS? mattnordhoffdns.org. (48)
2019-12-22 00:03:48.103966 IP6 2600:3c00::f03c:91ff:fe96:6bcc.35907 > 2001:500:40::1.53: 11611 [1au] DS? mattnordhoffdns.org. (48)
2019-12-22 00:03:48.105154 IP6 2001:500:40::1.53 > 2600:3c00::f03c:91ff:fe96:6bcc.35907: 11611*- 0/6/1 (767)
2019-12-22 00:03:48.105534 IP6 2600:3c00::f03c:91ff:fe96:6bcc.35701 > 2001:500:e::1.53: 63393 [1au] DNSKEY? org. (32)
2019-12-22 00:03:48.133296 IP 199.19.54.1.53 > 104.237.139.208.37298: 1603*- 0/6/1 (767)
2019-12-22 00:03:48.248185 IP6 2001:500:e::1.53 > 2600:3c00::f03c:91ff:fe96:6bcc.35701: 63393*-| 0/0/1 (32)
2019-12-22 00:03:48.248391 IP6 2600:3c00::f03c:91ff:fe96:6bcc.33629 > 2001:500:e::1.53: Flags [S], seq 1819586021, win 64800, options [mss 1440,sackOK,TS val 3319434026 ecr 0,nop,wscale 7], length 0
2019-12-22 00:03:48.248450 IP6 2600:3c00::f03c:91ff:fe96:6bcc.43023 > 2001:500:e::1.53: Flags [S], seq 1665913265, win 64800, options [mss 1440,sackOK,TS val 3319434026 ecr 0,nop,wscale 7], length 0
2019-12-22 00:03:48.280261 IP6 2001:500:e::1.53 > 2600:3c00::f03c:91ff:fe96:6bcc.43023: Flags [S.], seq 2949279688, ack 1665913266, win 65535, options [mss 1440,nop,wscale 6,sackOK,TS val 3505475347 ecr 3319434026], length 0
2019-12-22 00:03:48.280296 IP6 2600:3c00::f03c:91ff:fe96:6bcc.43023 > 2001:500:e::1.53: Flags [.], ack 1, win 507, options [nop,nop,TS val 3319434057 ecr 3505475347], length 0
2019-12-22 00:03:48.280639 IP6 2600:3c00::f03c:91ff:fe96:6bcc.43023 > 2001:500:e::1.53: Flags [P.], seq 1:35, ack 1, win 507, options [nop,nop,TS val 3319434058 ecr 3505475347], length 3451713 [1au] DNSKEY? org. (32)
2019-12-22 00:03:48.312525 IP6 2001:500:e::1.53 > 2600:3c00::f03c:91ff:fe96:6bcc.43023: Flags [P.], seq 1429:1628, ack 35, win 1026, options [nop,nop,TS val 3505475379 ecr 3319434058], length 19950347 zoneRef+ [b2&3=0x7b45] [47513a] [41854q] [39863n] [39417au][|domain]
2019-12-22 00:03:48.312549 IP6 2600:3c00::f03c:91ff:fe96:6bcc.43023 > 2001:500:e::1.53: Flags [.], ack 1, win 507, options [nop,nop,TS val 3319434090 ecr 3505475347,nop,nop,sack 1 {1429:1628}], length 0
2019-12-22 00:03:48.312607 IP6 2600:3c00::f03c:91ff:fe96:6bcc.43023 > 2001:500:e::1.53: Flags [.], ack 1628, win 495, options [nop,nop,TS val 3319434090 ecr 3505475379], length 0
2019-12-22 00:03:48.312879 IP6 2600:3c00::f03c:91ff:fe96:6bcc.43023 > 2001:500:e::1.53: Flags [F.], seq 35, ack 1628, win 501, options [nop,nop,TS val 3319434090 ecr 3505475379], length 0
2019-12-22 00:03:48.313625 IP 104.237.139.208.21488 > 199.19.57.1.53: 55922 [1au] A? mattnordhoffdns.org. (48)
2019-12-22 00:03:48.315465 IP 199.19.57.1.53 > 104.237.139.208.21488: 55922- 0/8/2 (694)
2019-12-22 00:03:48.316013 IP 104.237.139.208.40061 > 205.251.194.49.53: 59252 [1au] AAAA? orl2.mattnordhoffdns.org. (53)
2019-12-22 00:03:48.344535 IP6 2001:500:e::1.53 > 2600:3c00::f03c:91ff:fe96:6bcc.43023: Flags [.], ack 36, win 1026, options [nop,nop,TS val 3505475411 ecr 3319434090], length 0
2019-12-22 00:03:48.344625 IP6 2001:500:e::1.53 > 2600:3c00::f03c:91ff:fe96:6bcc.43023: Flags [F.], seq 1628, ack 36, win 1026, options [nop,nop,TS val 3505475411 ecr 3319434090], length 0
2019-12-22 00:03:48.344638 IP6 2600:3c00::f03c:91ff:fe96:6bcc.43023 > 2001:500:e::1.53: Flags [.], ack 1629, win 501, options [nop,nop,TS val 3319434122 ecr 3505475411], length 0
2019-12-22 00:03:48.346297 IP 205.251.194.49.53 > 104.237.139.208.40061: 59252*- 0/1/1 (119)
2019-12-22 00:03:48.346512 IP 127.0.0.1.53 > 127.0.0.1.53337: 2615 1/1/1 CNAME orl2.mattnordhoffdns.org. (154)
2019-12-22 00:03:48.394625 IP6 2001:500:e::1.53 > 2600:3c00::f03c:91ff:fe96:6bcc.33629: Flags [S.], seq 306049473, ack 1819586022, win 65535, options [mss 1440,nop,wscale 6,sackOK,TS val 2580404567 ecr 3319434026], length 0
2019-12-22 00:03:48.394651 IP6 2600:3c00::f03c:91ff:fe96:6bcc.33629 > 2001:500:e::1.53: Flags [.], ack 1, win 507, options [nop,nop,TS val 3319434172 ecr 2580404567], length 0
2019-12-22 00:03:48.394983 IP6 2600:3c00::f03c:91ff:fe96:6bcc.33629 > 2001:500:e::1.53: Flags [P.], seq 1:35, ack 1, win 507, options [nop,nop,TS val 3319434172 ecr 2580404567], length 3425325 [1au] DNSKEY? org. (32)
2019-12-22 00:03:48.538029 IP6 2600:3c00::f03c:91ff:fe96:6bcc.33629 > 2001:500:e::1.53: Flags [.], ack 1429, win 496, options [nop,nop,TS val 3319434315 ecr 2580404714], length 0
2019-12-22 00:03:48.541220 IP6 2001:500:e::1.53 > 2600:3c00::f03c:91ff:fe96:6bcc.33629: Flags [P.], seq 1429:1628, ack 35, win 1026, options [nop,nop,TS val 2580404714 ecr 3319434172], length 19950347 zoneRef+ [b2&3=0x7b45] [47513a] [41854q] [39863n] [39417au][|domain]
2019-12-22 00:03:48.541232 IP6 2600:3c00::f03c:91ff:fe96:6bcc.33629 > 2001:500:e::1.53: Flags [.], ack 1628, win 501, options [nop,nop,TS val 3319434318 ecr 2580404714], length 0
2019-12-22 00:03:48.541401 IP6 2600:3c00::f03c:91ff:fe96:6bcc.33629 > 2001:500:e::1.53: Flags [F.], seq 35, ack 1628, win 501, options [nop,nop,TS val 3319434319 ecr 2580404714], length 0
2019-12-22 00:03:48.542120 IP6 2600:3c00::f03c:91ff:fe96:6bcc.46519 > 2600:9000:5302:3100::1.53: 28989 [1au] A? mattnordhoffdns.org. (48)
2019-12-22 00:03:48.572609 IP6 2600:9000:5302:3100::1.53 > 2600:3c00::f03c:91ff:fe96:6bcc.46519: 28989*- 0/1/1 (114)
2019-12-22 00:03:48.573138 IP6 2600:3c00::f03c:91ff:fe96:6bcc.37946 > 2600:9000:5304:bc00::1.53: 60893 [1au] A? orl2.mattnordhoffdns.org. (53)
2019-12-22 00:03:48.574502 IP6 2600:9000:5304:bc00::1.53 > 2600:3c00::f03c:91ff:fe96:6bcc.37946: 60893*- 1/4/1 A 67.8.7.204 (206)
2019-12-22 00:03:48.574767 IP 127.0.0.1.53 > 127.0.0.1.53337: 64244 2/0/1 CNAME orl2.mattnordhoffdns.org., A 67.8.7.204 (104)
```

There had been other queries for the same domains (with different subdomains) a few seconds earlier; both threads had sent `mattnordhoffdns.org` `A` queries to the TLD, and one had sent a `mattnordhoffdns.org` `DS` query. It seems odd that those queries would be repeated now...

Configuration:

```
allow-trust-anchor-query
carbon-ourname=clover_mattnordhoff_net
carbon-server=2a02:2770:8::2635:0:1
config-dir=/etc/powerdns
dnssec=validate
dnssec-log-bogus
hint-file=/usr/share/dns/root.hints
include-dir=/etc/powerdns/recursor.d
local-address=127.0.0.1, ::1
log-common-errors
lua-config-file=/etc/powerdns/recursor.lua
max-cache-ttl=172800
max-negative-ttl=10800
max-qperq=100
query-local-address6=::
quiet=yes
setgid=pdns
setuid=pdns
```

`recursor.d` was empty and `recursor.lua` is the stock root key stuff.

**Comment by omoerbeek** [comment]
Our QName Minimization uses A queries for probing (as discussed in https://www.nlnetlabs.nl/downloads/publications/devries2019.pdf). So extra A queries are sent, but I agree the one you mention looks abnormal. In a quick test I'm not seeing the suspicious one, so something else must be going on.

**Comment by mnordhoff** [comment]
This still happens, but I was using the wrong `trace-regex` incantation and don't have more information. ;_; I'LL GET YOU NEXT TIME! MAYBE!

Speculation: Caching race condition? Two tasks go "find me `mattnordhoffdns.org`!" simultaneously. The first one sends a query to the `org` nameservers and gets a response. The second one fires off a query, but the `NS` records are now cached, so it goes to the `mattnordhoffdns.org` nameservers?

**Comment by mnordhoff** [comment]
I have a trace!

https://mn0.us/YpFnGc1Xp2vL/syslog.txt

tcpdump:

```
2020-02-17 05:51:52.468982 IP 127.0.0.1.46844 > 127.0.0.1.53: 4573+ [1au] A? orl2.mattnordhoff.net. (50)
2020-02-17 05:51:52.468988 IP 127.0.0.1.46844 > 127.0.0.1.53: 54741+ [1au] AAAA? orl2.mattnordhoff.net. (50)
2020-02-17 05:51:52.471636 IP 104.237.139.208.43536 > 173.245.58.105.53: 17349 [1au] DS? orl2.mattnordhoff.net. (50)
2020-02-17 05:51:52.477307 IP 173.245.58.105.53 > 104.237.139.208.43536: 17349*- 2/0/1 CNAME orl2.mattnordhoffdns.org., RRSIG (200)
2020-02-17 05:51:52.478548 IP 104.237.139.208.8771 > 173.245.58.105.53: 8503 [1au] AAAA? orl2.mattnordhoff.net. (50)
2020-02-17 05:51:52.479493 IP 104.237.139.208.52678 > 173.245.58.105.53: 40402 [1au] A? orl2.mattnordhoff.net. (50)
2020-02-17 05:51:52.481594 IP 173.245.58.105.53 > 104.237.139.208.8771: 8503*- 2/0/1 CNAME orl2.mattnordhoffdns.org., RRSIG (200)
2020-02-17 05:51:52.483503 IP 104.237.139.208.55886 > 199.19.56.1.53: 56014 [1au] DS? mattnordhoffdns.org. (48)
2020-02-17 05:51:52.484176 IP 173.245.58.105.53 > 104.237.139.208.52678: 40402*- 2/0/1 CNAME orl2.mattnordhoffdns.org., RRSIG (200)
2020-02-17 05:51:52.485056 IP 199.19.56.1.53 > 104.237.139.208.55886: 56014*- 0/6/1 (767)
2020-02-17 05:51:52.485218 IP 104.237.139.208.2793 > 199.249.112.1.53: 19460 [1au] DS? mattnordhoffdns.org. (48)
2020-02-17 05:51:52.485826 IP 104.237.139.208.23910 > 199.19.53.1.53: 6738 [1au] DNSKEY? org. (32)
2020-02-17 05:51:52.486531 IP 199.249.112.1.53 > 104.237.139.208.2793: 19460*- 0/6/1 (767)
2020-02-17 05:51:52.526296 IP 199.19.53.1.53 > 104.237.139.208.23910: 6738*-| 0/0/1 (32)
2020-02-17 05:51:52.526730 IP 104.237.139.208.38327 > 199.19.53.1.53: Flags [S], seq 332872497, win 64240, options [mss 1460,sackOK,TS val 3507771802 ecr 0,nop,wscale 7], length 0
2020-02-17 05:51:52.527126 IP 104.237.139.208.39769 > 199.19.53.1.53: Flags [S], seq 215138300, win 64240, options [mss 1460,sackOK,TS val 3507771802 ecr 0,nop,wscale 7], length 0
2020-02-17 05:51:52.550804 IP 199.19.53.1.53 > 104.237.139.208.38327: Flags [S.], seq 3302142297, ack 332872498, win 28960, options [mss 1460,sackOK,TS val 467548910 ecr 3507771802,nop,wscale 7], length 0
2020-02-17 05:51:52.550889 IP 104.237.139.208.38327 > 199.19.53.1.53: Flags [.], ack 1, win 502, options [nop,nop,TS val 3507771826 ecr 467548910], length 0
2020-02-17 05:51:52.551171 IP 104.237.139.208.38327 > 199.19.53.1.53: Flags [P.], seq 1:35, ack 1, win 502, options [nop,nop,TS val 3507771826 ecr 467548910], length 34 49216 [1au] DNSKEY? org. (32)
2020-02-17 05:51:52.566194 IP 199.19.53.1.53 > 104.237.139.208.39769: Flags [S.], seq 1626287142, ack 215138301, win 28960, options [mss 1460,sackOK,TS val 1305871026 ecr 3507771802,nop,wscale 7], length 0
2020-02-17 05:51:52.566215 IP 104.237.139.208.39769 > 199.19.53.1.53: Flags [.], ack 1, win 502, options [nop,nop,TS val 3507771841 ecr 1305871026], length 0
2020-02-17 05:51:52.566614 IP 104.237.139.208.39769 > 199.19.53.1.53: Flags [P.], seq 1:35, ack 1, win 502, options [nop,nop,TS val 3507771842 ecr 1305871026], length 34 8447 [1au] DNSKEY? org. (32)
2020-02-17 05:51:52.574769 IP 199.19.53.1.53 > 104.237.139.208.38327: Flags [.], ack 35, win 227, options [nop,nop,TS val 467548916 ecr 3507771826], length 0
2020-02-17 05:51:52.574961 IP 199.19.53.1.53 > 104.237.139.208.38327: Flags [P.], seq 1:1628, ack 35, win 227, options [nop,nop,TS val 467548916 ecr 3507771826], length 1627 49216*- 7/0/1 DNSKEY, DNSKEY, DNSKEY, DNSKEY, RRSIG, RRSIG, RRSIG (1625)
2020-02-17 05:51:52.574972 IP 104.237.139.208.38327 > 199.19.53.1.53: Flags [.], ack 1628, win 495, options [nop,nop,TS val 3507771850 ecr 467548916], length 0
2020-02-17 05:51:52.575196 IP 104.237.139.208.38327 > 199.19.53.1.53: Flags [F.], seq 35, ack 1628, win 501, options [nop,nop,TS val 3507771850 ecr 467548916], length 0
2020-02-17 05:51:52.577746 IP6 2600:3c00::f03c:91ff:fe96:6bcc.43350 > 2001:500:e::1.53: 55814 [1au] A? mattnordhoffdns.org. (48)
2020-02-17 05:51:52.579452 IP6 2001:500:e::1.53 > 2600:3c00::f03c:91ff:fe96:6bcc.43350: 55814- 0/8/2 (694)
2020-02-17 05:51:52.580799 IP 104.237.139.208.26354 > 192.52.178.30.53: 38671 [1au] A? awsdns-06.net. (42)
2020-02-17 05:51:52.598969 IP 199.19.53.1.53 > 104.237.139.208.38327: Flags [F.], seq 1628, ack 36, win 227, options [nop,nop,TS val 467548922 ecr 3507771850], length 0
2020-02-17 05:51:52.598989 IP 104.237.139.208.38327 > 199.19.53.1.53: Flags [.], ack 1629, win 501, options [nop,nop,TS val 3507771874 ecr 467548922], length 0
2020-02-17 05:51:52.605982 IP 199.19.53.1.53 > 104.237.139.208.39769: Flags [.], ack 35, win 227, options [nop,nop,TS val 1305871036 ecr 3507771842], length 0
2020-02-17 05:51:52.606022 IP 199.19.53.1.53 > 104.237.139.208.39769: Flags [P.], seq 1:1628, ack 35, win 227, options [nop,nop,TS val 1305871036 ecr 3507771842], length 1627 8447*- 7/0/1 DNSKEY, DNSKEY, DNSKEY, DNSKEY, RRSIG, RRSIG, RRSIG (1625)
2020-02-17 05:51:52.606033 IP 104.237.139.208.39769 > 199.19.53.1.53: Flags [.], ack 1628, win 495, options [nop,nop,TS val 3507771881 ecr 1305871036], length 0
2020-02-17 05:51:52.606242 IP 104.237.139.208.39769 > 199.19.53.1.53: Flags [F.], seq 35, ack 1628, win 501, options [nop,nop,TS val 3507771881 ecr 1305871036], length 0
2020-02-17 05:51:52.607789 IP 104.237.139.208.10558 > 205.251.193.123.53: 83 [1au] A? mattnordhoffdns.org. (48)
2020-02-17 05:51:52.609038 IP 205.251.193.123.53 > 104.237.139.208.10558: 83*- 0/1/1 (116)
2020-02-17 05:51:52.609380 IP 104.237.139.208.2610 > 205.251.196.188.53: 32688 [1au] AAAA? orl2.mattnordhoffdns.org. (53)
2020-02-17 05:51:52.610999 IP 205.251.196.188.53 > 104.237.139.208.2610: 32688*- 0/1/1 (121)
2020-02-17 05:51:52.620438 IP 192.52.178.30.53 > 104.237.139.208.26354: 38671- 0/8/9 (861)
2020-02-17 05:51:52.622144 IP 127.0.0.1.53 > 127.0.0.1.46844: 54741 1/1/1 CNAME orl2.mattnordhoffdns.org. (153)
2020-02-17 05:51:52.626845 IP6 2600:3c00::f03c:91ff:fe96:6bcc.7353 > 2600:9000:5305:4600::1.53: 31908 [1au] A? ns-561.awsdns-06.net. (49)
2020-02-17 05:51:52.628687 IP6 2600:9000:5305:4600::1.53 > 2600:3c00::f03c:91ff:fe96:6bcc.7353: 31908*- 1/4/9 A 205.251.194.49 (335)
2020-02-17 05:51:52.629163 IP 104.237.139.208.53554 > 205.251.194.49.53: 2435 [1au] A? orl2.mattnordhoffdns.org. (53)
2020-02-17 05:51:52.645237 IP 199.19.53.1.53 > 104.237.139.208.39769: Flags [F.], seq 1628, ack 36, win 227, options [nop,nop,TS val 1305871046 ecr 3507771881], length 0
2020-02-17 05:51:52.645259 IP 104.237.139.208.39769 > 199.19.53.1.53: Flags [.], ack 1629, win 501, options [nop,nop,TS val 3507771920 ecr 1305871046], length 0
2020-02-17 05:51:52.659444 IP 205.251.194.49.53 > 104.237.139.208.53554: 2435*- 1/4/1 A 67.8.7.204 (206)
2020-02-17 05:51:52.669834 IP 127.0.0.1.53 > 127.0.0.1.46844: 4573 2/0/1 CNAME orl2.mattnordhoffdns.org., A 67.8.7.204 (104)
```

To highlight it more specifically:

```
2020-02-17 05:51:52.577746 IP6 2600:3c00::f03c:91ff:fe96:6bcc.43350 > 2001:500:e::1.53: 55814 [1au] A? mattnordhoffdns.org. (48)
2020-02-17 05:51:52.579452 IP6 2001:500:e::1.53 > 2600:3c00::f03c:91ff:fe96:6bcc.43350: 55814- 0/8/2 (694)
```
```
2020-02-17 05:51:52.607789 IP 104.237.139.208.10558 > 205.251.193.123.53: 83 [1au] A? mattnordhoffdns.org. (48)
2020-02-17 05:51:52.609038 IP 205.251.193.123.53 > 104.237.139.208.10558: 83*- 0/1/1 (116)
```

The first query went to the TLD, the second query went to the domain's own nameservers.

**Comment by mnordhoff** [comment]
I meant to add -- 4.3.0~beta1+master.265.gac71db62a-1pdns.xenial.

**Comment by omoerbeek** [comment]
I think I can reproduce with an empty cache by doing two dig requests simultaneously in a script. 

```
dig -p 5301 orl2.mattnordhoffdns.org A &
dig -p 5301 orl2.mattnordhoffdns.org AAAA
```

I've attached the trace log with comments. Note that I have used `--trace`, which nicely shows which mthread is doing what.
The `trace-regex` code collects a trace and only dumps it afterwards into the log, so you cannot see what work was done when and how the two queries influence each other.

Now the main question: is this a bug? I tend to think not. The A query to the zone NS is not really needed, but it does not hurt either.

[log.txt](https://github.com/PowerDNS/pdns/files/4213369/log.txt)

**Comment by mnordhoff** [comment]
Thank you for tracking it down!

Closing this issue is okay with me. I reported it to have the behavior looked into and make sure it wasn't something worse (cache corruption, cosmic rays, who knows). Since nothing awful's happening, that's okay.

> The A query to the zone NS is not really needed, but it does not hurt either.

What if someone's using IP over Avian Carrier? They could get bitten. Or a paper cut! :skull:

**Comment by omoerbeek** [comment]
We only apply secure paper zone cuts.
