### ISSUE TITLE
Primary server not sending NOTIFY to secondary server when zone is updated

### ISSUE THREAD

**Issue by slipdip123** [PowerDNS/pdns#12754]
- Program: Authoritative
 - Issue type: Bug report

### Short description
I have setup a primary/secondary setup with 2 servers, with the gsqlite3 backend. When zones are made to begin with, from a fresh install, the zones seem to also transfer to the secondary server. After this, if I add a record to the zone through the API or pdnsutil the secondary server just doesn't update. The SOA serial constantly stays at 0.

Primary: 10.4.2.11
Secondary: 10.4.2.12

### Environment
 - Operating system: AlmaLinux 9
 - Software version: 4.7.3
 - Software source: OS repo

### Steps to reproduce
1. Create servers with ansible playbook (although I would assume it's similar doing it manually:

```yaml
- name: Setup PDNS on primary
  hosts: pdns-master
  become: true
  roles:
    - { role: powerdns.pdns }
  vars:
    pdns_config:
      primary: true
      local-address: '{{ ansible_default_ipv4.address }}'
      api: true
      webserver: true
      webserver-address: 0.0.0.0
      webserver-allow-from: 10.0.0.0/8
      api-key: [redacted]
      allow-axfr-ips: 10.4.2.0/24
    pdns_backends:
      gsqlite3:
        database: "/var/lib/powerdns/pdns.sqlite3"
        dnssec: true
    pdns_sqlite_databases_locations:
      - "/var/lib/powerdns/pdns.sqlite3"

- name: Setup PDNS on secondary
  hosts: pdns-slave
  become: true
  roles:
    - { role: powerdns.pdns }
  vars:
    pdns_config:
      secondary: true
      local-address: '{{ ansible_default_ipv4.address }}'
      api: true
      webserver-address: 0.0.0.0
      webserver-allow-from: 10.0.0.0/8
      api-key: [redacted]
      allow-axfr-ips: 10.4.2.0/24
    pdns_backends:
      gsqlite3:
        database: "/var/lib/powerdns/pdns.sqlite3"
        dnssec: true
    pdns_sqlite_databases_locations:
      - "/var/lib/powerdns/pdns.sqlite3"
```
2. Add zones and records (through API using terraform, again the same issue occurs if I add them normally):

> Note this is just an example, pdns2 also has an A record defined just not showing here for brevity

```
resource "powerdns_zone" "missinghell" {
  name = "missinghell.internal."
  kind = "Native"
  nameservers = ["pdns1.missinghell.internal.", "pdns2.missinghell.internal."]
}

resource "powerdns_zone" "missinghell_secondary" {
  provider = powerdns.secondary
  name = "missinghell.internal."
  kind = "Slave"
  masters = ["10.4.2.11"]
}

resource "powerdns_record" "missinghell-pdns1" {
  zone = "missinghell.internal."
  name = "pdns1.missinghell.internal."
  type = "A"
  ttl = 300
  records = ["10.4.2.11"]
}
```
3. Use dig to see that the primary server responds as expected, but the secondary server doesn't seem to know of the records, returning an NXDOMAIN

### Expected behaviour
The secondary server should be updated and respond appropriately to the request.

### Actual behaviour
The secondary server doesn't get updated beyond the first AXFR?

tcpdump from primary server when I create the zones, then add some records (nothing happened when I added the records)
```
listening on eth0, link-type EN10MB (Ethernet), snapshot length 262144 bytes
00:08:42.469037 IP 10.4.2.12.11456 > 10.4.2.11.53: 31193 [1au] SOA? serv.missinghell.internal. (54)
00:08:42.469037 IP 10.4.2.12.11456 > 10.4.2.11.53: 483 [1au] SOA? missinghell.internal. (49)
00:08:42.469764 IP 10.4.2.11.53 > 10.4.2.12.11456: 483*- 1/0/1 SOA (130)
00:08:42.469782 IP 10.4.2.11.53 > 10.4.2.12.11456: 31193*- 1/0/1 SOA (135)
00:08:42.471928 IP 10.4.2.12.41059 > 10.4.2.11.53: Flags [S], seq 1671421823, win 64860, options [mss 1410,sackOK,TS val 649367128 ecr 0,nop,wscale 7], length 0
00:08:42.471928 IP 10.4.2.12.59177 > 10.4.2.11.53: Flags [S], seq 2215052480, win 64860, options [mss 1410,sackOK,TS val 649367128 ecr 0,nop,wscale 7], length 0
00:08:42.471963 IP 10.4.2.11.53 > 10.4.2.12.41059: Flags [S.], seq 818094190, ack 1671421824, win 64308, options [mss 1410,sackOK,TS val 2863616919 ecr 649367128,nop,wscale 7], length 0
00:08:42.471990 IP 10.4.2.11.53 > 10.4.2.12.59177: Flags [S.], seq 3220276867, ack 2215052481, win 64308, options [mss 1410,sackOK,TS val 2863616919 ecr 649367128,nop,wscale 7], length 0
00:08:42.472337 IP 10.4.2.12.41059 > 10.4.2.11.53: Flags [.], ack 1, win 507, options [nop,nop,TS val 649367128 ecr 2863616919], length 0
00:08:42.472337 IP 10.4.2.12.59177 > 10.4.2.11.53: Flags [.], ack 1, win 507, options [nop,nop,TS val 649367128 ecr 2863616919], length 0
00:08:42.472422 IP 10.4.2.12.59177 > 10.4.2.11.53: Flags [P.], seq 1:46, ack 1, win 507, options [nop,nop,TS val 649367129 ecr 2863616919], length 45 47914 AXFR? serv.missinghell.internal. (43)
00:08:42.472422 IP 10.4.2.12.41059 > 10.4.2.11.53: Flags [P.], seq 1:41, ack 1, win 507, options [nop,nop,TS val 649367129 ecr 2863616919], length 40 9135 AXFR? missinghell.internal. (38)
00:08:42.472435 IP 10.4.2.11.53 > 10.4.2.12.59177: Flags [.], ack 46, win 503, options [nop,nop,TS val 2863616920 ecr 649367129], length 0
00:08:42.472445 IP 10.4.2.11.53 > 10.4.2.12.41059: Flags [.], ack 41, win 503, options [nop,nop,TS val 2863616920 ecr 649367129], length 0
00:08:42.474161 IP 10.4.2.11.53 > 10.4.2.12.59177: Flags [P.], seq 1:127, ack 46, win 503, options [nop,nop,TS val 2863616922 ecr 649367129], length 126 47914*- 1/0/0 SOA (124)
00:08:42.474465 IP 10.4.2.12.59177 > 10.4.2.11.53: Flags [.], ack 127, win 507, options [nop,nop,TS val 649367131 ecr 2863616922], length 0
00:08:42.474537 IP 10.4.2.11.53 > 10.4.2.12.59177: Flags [P.], seq 127:212, ack 46, win 503, options [nop,nop,TS val 2863616922 ecr 649367131], length 85 47914*- 2/0/0 NS pdns1.missinghell.internal., NS pdns2.missinghell.internal. (83)
00:08:42.474882 IP 10.4.2.12.59177 > 10.4.2.11.53: Flags [.], ack 212, win 507, options [nop,nop,TS val 649367131 ecr 2863616922], length 0
00:08:42.474897 IP 10.4.2.11.53 > 10.4.2.12.59177: Flags [P.], seq 212:338, ack 46, win 503, options [nop,nop,TS val 2863616922 ecr 649367131], length 126 47914*- 1/0/0 SOA (124)
00:08:42.475336 IP 10.4.2.12.59177 > 10.4.2.11.53: Flags [.], ack 338, win 507, options [nop,nop,TS val 649367132 ecr 2863616922], length 0
00:08:42.475336 IP 10.4.2.12.59177 > 10.4.2.11.53: Flags [F.], seq 46, ack 338, win 507, options [nop,nop,TS val 649367132 ecr 2863616922], length 0
00:08:42.475414 IP 10.4.2.11.53 > 10.4.2.12.41059: Flags [P.], seq 1:122, ack 41, win 503, options [nop,nop,TS val 2863616923 ecr 649367129], length 121 9135*- 1/0/0 SOA (119)
00:08:42.475436 IP 10.4.2.11.53 > 10.4.2.12.59177: Flags [F.], seq 338, ack 47, win 503, options [nop,nop,TS val 2863616923 ecr 649367132], length 0
00:08:42.475497 IP 10.4.2.12.41059 > 10.4.2.11.53: Flags [.], ack 122, win 507, options [nop,nop,TS val 649367132 ecr 2863616923], length 0
00:08:42.475551 IP 10.4.2.12.59177 > 10.4.2.11.53: Flags [.], ack 339, win 507, options [nop,nop,TS val 649367132 ecr 2863616923], length 0
00:08:42.475695 IP 10.4.2.11.53 > 10.4.2.12.41059: Flags [P.], seq 122:238, ack 41, win 503, options [nop,nop,TS val 2863616923 ecr 649367132], length 116 9135*- 4/0/0 NS pdns1.missinghell.internal., NS pdns2.missinghell.internal., A 10.4.2.13, A 10.4.2.12 (114)
00:08:42.475775 IP 10.4.2.12.41059 > 10.4.2.11.53: Flags [.], ack 238, win 507, options [nop,nop,TS val 649367132 ecr 2863616923], length 0
00:08:42.475786 IP 10.4.2.11.53 > 10.4.2.12.41059: Flags [P.], seq 238:359, ack 41, win 503, options [nop,nop,TS val 2863616923 ecr 649367132], length 121 9135*- 1/0/0 SOA (119)
00:08:42.475851 IP 10.4.2.12.41059 > 10.4.2.11.53: Flags [.], ack 359, win 507, options [nop,nop,TS val 649367132 ecr 2863616923], length 0
00:08:42.475917 IP 10.4.2.12.41059 > 10.4.2.11.53: Flags [F.], seq 41, ack 359, win 507, options [nop,nop,TS val 649367132 ecr 2863616923], length 0
00:08:42.475957 IP 10.4.2.11.53 > 10.4.2.12.41059: Flags [F.], seq 359, ack 42, win 503, options [nop,nop,TS val 2863616923 ecr 649367132], length 0
00:08:42.476023 IP 10.4.2.12.41059 > 10.4.2.11.53: Flags [.], ack 360, win 507, options [nop,nop,TS val 649367132 ecr 2863616923], length 0
00:08:47.620318 ARP, Request who-has 10.4.2.11 tell 10.4.2.12, length 28
00:08:47.620332 ARP, Reply 10.4.2.11 is-at de:25:cd:e8:3c:4a, length 28
00:08:47.675130 ARP, Request who-has 10.4.2.12 tell 10.4.2.11, length 28
00:08:47.675517 ARP, Reply 10.4.2.12 is-at 3a:80:0e:7e:bd:53, length 28
```

Here is an example of a time where I made a record, but the secondary hasn't updated:

```
luna@baphomet ~ $ dig @10.4.2.11 msh-keyc-1.serv.missinghell.internal

; <<>> DiG 9.16.37 <<>> @10.4.2.11 msh-keyc-1.serv.missinghell.internal
; (1 server found)
;; global options: +cmd
;; Got answer:
;; ->>HEADER<<- opcode: QUERY, status: NOERROR, id: 56587
;; flags: qr aa rd; QUERY: 1, ANSWER: 1, AUTHORITY: 0, ADDITIONAL: 1
;; WARNING: recursion requested but not available

;; OPT PSEUDOSECTION:
; EDNS: version: 0, flags:; udp: 1232
;; QUESTION SECTION:
;msh-keyc-1.serv.missinghell.internal. IN A

;; ANSWER SECTION:
msh-keyc-1.serv.missinghell.internal. 300 IN A	10.4.3.11

;; Query time: 0 msec
;; SERVER: 10.4.2.11#53(10.4.2.11)
;; WHEN: Mon Apr 17 01:46:19 BST 2023
;; MSG SIZE  rcvd: 81

luna@baphomet ~ $ dig @10.4.2.12 msh-keyc-1.serv.missinghell.internal

; <<>> DiG 9.16.37 <<>> @10.4.2.12 msh-keyc-1.serv.missinghell.internal
; (1 server found)
;; global options: +cmd
;; Got answer:
;; ->>HEADER<<- opcode: QUERY, status: NXDOMAIN, id: 63354
;; flags: qr aa rd; QUERY: 1, ANSWER: 0, AUTHORITY: 1, ADDITIONAL: 1
;; WARNING: recursion requested but not available

;; OPT PSEUDOSECTION:
; EDNS: version: 0, flags:; udp: 1232
;; QUESTION SECTION:
;msh-keyc-1.serv.missinghell.internal. IN A

;; AUTHORITY SECTION:
serv.missinghell.internal. 3600	IN	SOA	a.misconfigured.dns.server.invalid. hostmaster.serv.missinghell.internal. 0 10800 3600 604800 3600

;; Query time: 0 msec
;; SERVER: 10.4.2.12#53(10.4.2.12)
;; WHEN: Mon Apr 17 01:46:22 BST 2023
;; MSG SIZE  rcvd: 146
```

### Other information
I've tried so many things to get this to work, I don't know really know what I am doing so please be patient:

- changing SOA_EDIT_API to INCEPTION-INCREMENT
- recreating the zones multiple times
- recreating the entire server multiple times 
- using pdns_control to notify manually (this works, but is a manual solution, shouldn't the secondary be updating anyway?)
- setting autosecondary to true (not really sure what this does, but I did also set the supermaster in the database as well)

**Comment by cmouse** [comment]
You should use master instead of native as zone type.

**Comment by Habbie** [comment]
Hello,

our GitHub issue tracker is for bug reports and feature requests. Your question looks like a support question. Support questions are handled in our other online communities: IRC and our mailing lists. Please see https://www.powerdns.com/opensource.html for information about those.

We are closing this ticket. Comments will likely be ignored.
