### ISSUE TITLE
DNS Answer section problem from WAN

### ISSUE THREAD

**Issue by mislav-eu** [PowerDNS/pdns#5685]
- Program: Authoritative, Recursor 
 - Issue type: Bug report 

### Short description

I'm having issues with no DNS/record response when dig-ing through cmd on my powerdns server. Since server is behind NAT - there is no response at all when I do dig @ server hostname (which resolves to public IP) - however, if I try to dig @ local server IP, I always get answer - and what bothers me if I do dig lookup from public IP, this somehow mess up the cache/lookup from local server ip and in next 5-10sec there is no response at all. I've done numerous tests and I just can't figure out why is this happening - if I don't do any lookups on public, I can dig local server IP for hours and I will always get DNS answer/info, but no matter the time I do lookup on public - there is no answer. 
Also, if for example I dig NS record on public - I can still get answer from A record from local IP - however, if I dig NS on public and I dig NS on local ip = problem occurs. Any ideas how to troubleshoot this?

### Environment

 - Operating system: Debian 7
 - Software version: 3.1
 - Software source:  Package download from official pages

### Steps to reproduce

Scenario where it doesn't work:
1. dig A domain.name @ns2.HOSTNAME.TLD (public one) - there is no response
2. dig A domain.name @local.nat.ip - no response 

Scenario where it does work:
1. dig A domain.name @ns2.HOSTNAME.TLD (public one) - there is no response
2. dig NS domain.name @local.nat.ip - there is response 

### Expected behaviour

Both of the results should provide with answer section - lookup info.

### dig from public:
$ dig A domain.name @ns2.hostname

; <<>> DiG 9.9.5-3ubuntu0.15-Ubuntu <<>> A domain.name @ns2.hostname
;; global options: +cmd
;; Got answer:
;; ->>HEADER<<- opcode: QUERY, status: NOERROR, id: 6908
;; flags: qr rd; QUERY: 1, ANSWER: 0, AUTHORITY: 0, ADDITIONAL: 0
;; WARNING: recursion requested but not available

;; QUESTION SECTION:
;domain.name.		IN	A

;; Query time: 43 msec
;; SERVER: PublicIP#53(PublicIP)
;; WHEN: Wed Sep 13 09:56:24 CEST 2017
;; MSG SIZE  rcvd: 37

### dig from local nat IP:
$ dig A domain.name @LocalIP

; <<>> DiG 9.9.5-3ubuntu0.15-Ubuntu <<>> A domain.name @LocalIP
;; global options: +cmd
;; Got answer:
;; ->>HEADER<<- opcode: QUERY, status: NOERROR, id: 36712
;; flags: qr rd ra; QUERY: 1, ANSWER: 1, AUTHORITY: 0, ADDITIONAL: 0

;; QUESTION SECTION:
;domain.name.		IN	A

;; ANSWER SECTION:
domain.name.	22	IN	A	52.213.24.13

;; Query time: 366 msec
;; SERVER: LocalIP#53(LocalIP)
;; WHEN: Wed Sep 13 09:57:34 CEST 2017
;; MSG SIZE  rcvd: 53

tcpdump: verbose output suppressed, use -v or -vv for full protocol decode
listening on eth0, link-type EN10MB (Ethernet), capture size 65535 bytes
09:59:01.160175 IP MyIP.65026 > LocalIP.53: 11749+ [1au] A? domain.name. (48)
09:59:01.599106 IP MyIP.56772 > LocalIP.53: 53271+ [1au] A? domain.name. (48)
09:59:01.907597 IP MyIP.56941 > LocalIP.53: 2232+ [1au] A? domain.name. (48)
09:59:02.611838 IP MyIP.45574 > LocalIP.53: 5488+ [1au] A? domain.name. (48)
09:59:07.730445 IP MyIP.50015 > LocalIP.53: 38853+ [1au] NS? domain.name. (48)
09:59:08.189650 IP MyIP.37771 > LocalIP.53: 53218+ [1au] NS? domain.name. (48)
09:59:10.992032 IP MyIP.35401 > LocalIP.53: 16349+ [1au] MX? domain.name. (48)

### Other information

As mentioned above, if I dig same type of record from public and after that from local - there is no lookup answer for next 5-10 seconds.

**Comment by Habbie** [comment]
Your dig and tcpdump output appears to be mangled. Can you please provide the real, unaltered, output? Please see https://blog.powerdns.com/2016/01/18/open-source-support-out-in-the-open/ for more background on this.

**Comment by Habbie** [comment]
Also, 3.1 is a very old version - can you try running something from the 4.x train?

**Comment by mislav-eu** [comment]
I'm aware that it's old version, but that's how it is at the moment.
I can send output somewhere private if possible, I am not allowed to expose real public ips/domains.

**Comment by Habbie** [comment]
Sorry, that's two reasons we cannot help you then. Closing this.
