### ISSUE TITLE
rec: qname min may send excessive queries to root servers, sometimes?

### ISSUE THREAD

**Issue by phonedph1** [PowerDNS/pdns#12090]
- Program: Recursor
 - Issue type: Bug report

### Short description
With qname min on, some setups end up sending multiple queries to the root servers very often.

### Environment
 - Operating system: Debian
 - Software version: latest 
 - Software source: compiled

### Steps to reproduce
1. Run recursor:

```
$ ./pdns_recursor --dnssec=off --qname-minimization=on --local-port=5353 --socket-dir=/var/tmp  --trace --threads=1 2>&1 | grep LOOP
Oct 13 18:13:58 [3] fp.measure.office.com: We have NS in cache for 'office.com' but part of LOOP (already seen fp.measure.office.com)! Trying less specific NS
Oct 13 18:13:58 [3] fp.measure.office.com: We have NS in cache for 'office.com' but part of LOOP (already seen fp.measure.office.com)! Trying less specific NS
Oct 13 18:13:58 [3] fp.measure.office.com: We have NS in cache for 'com' but part of LOOP (already seen fp.measure.office.com)! Trying less specific NS
Oct 13 18:13:58 [3] fp.measure.office.com: We have NS in cache for 'office.com' but part of LOOP (already seen fp.measure.office.com)! Trying less specific NS
Oct 13 18:13:58 [3] fp.measure.office.com: We have NS in cache for 'com' but part of LOOP (already seen fp.measure.office.com)! Trying less specific NS
Oct 13 18:13:58 [3] fp.measure.office.com: We have NS in cache for '.' but part of LOOP (already seen fp.measure.office.com)! Trying less specific NS
Oct 13 18:13:58 [3] fp.measure.office.com: We have NS in cache for 'office.com' but part of LOOP (already seen fp.measure.office.com)! Trying less specific NS
Oct 13 18:13:58 [3] fp.measure.office.com: We have NS in cache for 'com' but part of LOOP (already seen fp.measure.office.com)! Trying less specific NS
Oct 13 18:13:58 [3] fp.measure.office.com: We have NS in cache for '.' but part of LOOP (already seen fp.measure.office.com)! Trying less specific NS
Oct 13 18:13:58 [3] .: We have NS in cache for '.' but part of LOOP (already seen .)! Trying less specific NS
Oct 13 18:14:02 [5] fp.measure.office.com: We have NS in cache for 'office.com' but part of LOOP (already seen fp.measure.office.com)! Trying less specific NS
Oct 13 18:14:02 [5] fp.measure.office.com: We have NS in cache for 'office.com' but part of LOOP (already seen fp.measure.office.com)! Trying less specific NS
Oct 13 18:14:02 [5] fp.measure.office.com: We have NS in cache for 'com' but part of LOOP (already seen fp.measure.office.com)! Trying less specific NS
Oct 13 18:14:02 [5] fp.measure.office.com: We have NS in cache for 'office.com' but part of LOOP (already seen fp.measure.office.com)! Trying less specific NS
Oct 13 18:14:02 [5] fp.measure.office.com: We have NS in cache for 'com' but part of LOOP (already seen fp.measure.office.com)! Trying less specific NS
Oct 13 18:14:02 [5] fp.measure.office.com: We have NS in cache for '.' but part of LOOP (already seen fp.measure.office.com)! Trying less specific NS
Oct 13 18:14:02 [5] fp.measure.office.com: We have NS in cache for 'office.com' but part of LOOP (already seen fp.measure.office.com)! Trying less specific NS
Oct 13 18:14:02 [5] fp.measure.office.com: We have NS in cache for 'com' but part of LOOP (already seen fp.measure.office.com)! Trying less specific NS
Oct 13 18:14:02 [5] fp.measure.office.com: We have NS in cache for '.' but part of LOOP (already seen fp.measure.office.com)! Trying less specific NS
Oct 13 18:14:02 [5] .: We have NS in cache for '.' but part of LOOP (already seen .)! Trying less specific NS
```

Trigger the behaviour:

```
dig @127.0.0.1 -p 5353 8b9af372d455439b81f1984436691900.fp.measure.office.com.
sleep 3
dig @127.0.0.1 -p 5353 NS fp.measure.office.com
sleep 3
dig @127.0.0.1 -p 5353 ns1.fp.measure.office.com
dig @127.0.0.1 -p 5353 ns2.fp.measure.office.com
sleep 3
dig @127.0.0.1 -p 5353 8b9af372d455439b81f1974436691900.fp.measure.office.com.
```

### Expected behaviour
.com, office.com should already be cached, shouldn't need to ask root servers about.

### Actual behaviour
```
18:13:58.775634 IP slurpee2.29778 > l.root-servers.net.domain: 32515 [1au] A? fp.measure.office.com. (50)
18:14:02.388245 IP slurpee2.41136 > k.root-servers.net.domain: 47298 [1au] A? fp.measure.office.com. (50)
18:14:02.422068 IP slurpee2.56039 > j.root-servers.net.domain: 9280 [1au] A? fp.measure.office.com. (50)
```

trace log is filled with LOOP detection events as above.

### Other information
qname min off doesn't seem to do this.

**Comment by phonedph1** [comment]
I cleaned it up to just this, which "seems" to work OK, but might not be the best idea. I think some leakage is going to be expected because even non-QM stuff will cause that to keep trying less specific NS set and hit the tlds/roots.

```
@@ -1737,6 +1737,18 @@ int SyncRes::doResolve(const DNSName &qname, const QType qtype, vector<DNSRecord
         return res;
       }
 
+      // If we have seen this child during resolution already; just skip it. We tried to QM it already or otherwise broken.
+      bool skipQM = false;
+      for(set<GetBestNSAnswer>::const_iterator j=beenthere.begin(); j!=beenthere.end(); ++j) {
+        if(j->qname == child) {
+          skipQM = true;
+        }
+      }
+      if(skipQM) {
+        QLOG("Step4 Being skipped as visited this child name already");
+        continue;
+      }
+
       // Step 4
       QLOG("Step4 Resolve A for child");
       bool oldFollowCNAME = d_followCNAME;
```
