### ISSUE TITLE
Pdns recursor 4.5.1 without internet connection

### ISSUE THREAD

**Issue by kost1993** [PowerDNS/pdns#10408]
- Program: Recursor
 - Issue type: Bug report

### Short description

We are using pdns recursor in non internet enviroment to serve our internal dns zones for many needs.
At version 4.4.x we are using next config:
```
$ cat /etc/powerdns/recursor-noninternet.conf
config-dir=/etc/powerdns
forward-zones-file=/etc/powerdns/forward_zones_file_noninternet
hint-file=/usr/share/dns/root.hints
include-dir=/etc/powerdns/recursor.d
lua-config-file=/etc/powerdns/recursor.lua
quiet=yes
security-poll-suffix=
setgid=pdns
setuid=pdns
socket-dir=/var/run/pdns-recursor-users
```
And everything was fine. But after upgrading to 4.5.1 we are getting every ~5 second next messages in syslog
```
May 13 17:42:22 pdns_recursor[]: Failed to update . records, RCODE=2
May 13 17:42:29 pdns_recursor[]: Failed to update . records, RCODE=2
May 13 17:42:33 pdns_recursor[]: Failed to update . records, RCODE=2
May 13 17:42:34 pdns_recursor[]: Failed to update . records, RCODE=2
May 13 17:42:41 pdns_recursor[]: Failed to update . records, RCODE=2
May 13 17:42:50 pdns_recursor[]: Failed to update . records, RCODE=2
```
Is there any setting in PowerDNS Recursor Config I'm missing? If i understand correctly recursor is trying to update root, but without internet connecting it cant do this. But why then in version 4.4.x there were no messages about it?

### Environment

 - Operating system: Debian 10
 - Software version: Recursor 4.4.1, 4.5.1
 - Software source: 

### Steps to reproduce

1.  Install recursor 4.5.1 in non internet enviroment.

### Expected behaviour

The same behaviour that was at 4.4.x (when there were no messages about `Failed to update . records`)

### Actual behaviour

Spam every ~5 seconds in syslog with the same message `Failed to update . records`

**Comment by zeha** [comment]
#10182 looks related.

**Comment by phonedph1** [comment]
Alternative: Put a root zone on your non-internet auths and point root hints there as well.

**Comment by phonedph1** [comment]
Also see #10396 where it won't be logged in quiet mode after

**Comment by kost1993** [comment]
I did some experiments.
1) nstest01 (192.16.1.11) - Authoritative internal dns server with zone example.com (this server hasn't internet connection)
2) nsrectest01 (192.16.1.12) - clean server with OS Debian 10 (also without internet connection)
3) I've installed pdns-recursor 4.4.3 on nsrectest01 and modified config `/etc/powerdns/recursor.conf` as
```
config-dir=/etc/powerdns
forward-zones=example.com=192.16.1.11
hint-file=/usr/share/dns/root.hints
include-dir=/etc/powerdns/recursor.d
local-address=0.0.0.0
#local-port=53
lua-config-file=/etc/powerdns/recursor.lua
quiet=yes
security-poll-suffix=
setgid=pdns
setuid=pdns
```
With that config - we are getting in `journalctl -u pdns-recursor` next:
```
May 14 11:56:28 pdns_recursor[703]: Failed to update . records, got an exception: Too much time waiting
May 14 11:56:28 pdns_recursor[703]: Failed to update . records, RCODE=-1
May 14 11:56:39 pdns_recursor[703]: Failed to update . records, got an exception: Too much time waiting
May 14 11:56:39 pdns_recursor[703]: Failed to update . records, RCODE=-1
May 14 11:56:51 pdns_recursor[703]: Failed to update . records, got an exception: Too much time waiting
May 14 11:56:51 pdns_recursor[703]: Failed to update . records, RCODE=-1
```
4) I've modified forward-zones:
```
forward-zones=example.com=192.16.1.11, .=192.16.1.11
```
And - there are no more fails in `journalctl -u pdns-recursor`.
But! with tcpdump i am observing the following situation:
```
12:41:36.661171 IP 192.16.1.12.56928 > 192.16.1.11.53: 30723 [1au] NS? . (28)
12:41:36.661761 IP 192.16.1.11.53 > 192.16.1.12.56928: 30723 Refused- 0/0/1 (28)
12:41:57.189658 IP 192.16.1.12.9364 > 192.16.1.11.53: 6363 [1au] NS? . (28)
12:41:57.190301 IP 192.16.1.11.53 > 192.16.1.12.9364: 6363 Refused- 0/0/1 (28)
12:42:17.717365 IP 192.16.1.12.36769 > 192.16.1.11.53: 59524 [1au] NS? . (28)
12:42:17.717918 IP 192.16.1.11.53 > 192.16.1.12.36769: 59524 Refused- 0/0/1 (28)
```
5) And if now i will upgrade pdns-recursor 4.4.3 to 4.5.1. Then the behavior via tcpdump will remain the same (as in 4) ) and we will constantly receive messages in `journalctl -u pdns-recursor` like:
```
May 14 12:45:41 pdns_recursor[4072]: Failed to update . records, RCODE=2
May 14 12:45:46 pdns_recursor[4072]: Failed to update . records, RCODE=2
May 14 12:45:52 pdns_recursor[4072]: Failed to update . records, RCODE=2
May 14 12:45:57 pdns_recursor[4072]: Failed to update . records, RCODE=2
May 14 12:46:01 pdns_recursor[4072]: Failed to update . records, RCODE=2
May 14 12:46:07 pdns_recursor[4072]: Failed to update . records, RCODE=2
May 14 12:46:12 pdns_recursor[4072]: Failed to update . records, RCODE=2
May 14 12:46:18 pdns_recursor[4072]: Failed to update . records, RCODE=2
```

So it seems something changed with messages in 4.5.1 related to failing with updating of root records but not behavior of doing updating againt root records.
I'm not sure if suppressing of that message is a solution for the situation. Maybe we can somehow stop recursor from updating root records on internal private networks without internet connection? Because making another authoritative internal dns server just for nulling root ns records seems like an overkill task.

**Comment by kost1993** [comment]
And btw - what is point of `hint-file` if recursor is updating root records anyway?
https://doc.powerdns.com/recursor/settings.html#hint-file

**Comment by Habbie** [comment]
> And btw - what is point of `hint-file` if recursor is updating root records anyway?

Without the hint file (or the compiled in version of it), the recursor would not know where to get updated root records.

**Comment by zeha** [comment]
> Because making another authoritative internal dns server just for nulling root ns records seems like an overkill task.

Given you already have an internal auth, just add the root zone to it, too?

**Comment by omoerbeek** [comment]
Hints are supposed to point to server(s) willing to serve `. NS` records and their associated `A/AAA` records to bootstrap the process of getting up-to-date root records. The logging was added to detect issues with this process.

Now I understand that in some cases that server might out of your control. But in this case it is, so the best solution is to fix the "root" server.

**Comment by omoerbeek** [comment]
I'm closing this issue. Newer recursors are not as verbose and various workarounds/fixes in this setup are possible.

**Comment by omoerbeek** [comment]
#11283

**Comment by InvisibleRain** [comment]
I had a similar issue and figured there was a misconfigured `dont-query` options preventing the recursor from contacting root servers in the local network.

**Comment by Rosch** [comment]
I have seen that in #11283 the disabling of the root hint-file can be achieved by setting 
`hint-file=no`
to be implemented in 4.7

I am running 4.8.4 (also in an environment without internet) but seems not to work for me.
I am still flooded with "Failed to update . records"

Is there something else to do?

Thanks

Roland

**Comment by omoerbeek** [comment]
> I have seen that in #11283 the disabling of the root hint-file can be achieved by setting `hint-file=no` to be implemented in 4.7
> 
> I am running 4.8.4 (also in an environment without internet) but seems not to work for me. I am still flooded with "Failed to update . records"
> 
> Is there something else to do?
> 
> Thanks
> 
> Roland

read https://docs.powerdns.com/recursor/appendices/FAQ.html#handling-of-root-hints

In 4.9, there is a new value: `no-refresh` which completely disables hint refreshing. Note that that only makes sense in limited use-cases, as you disable the capability of the recursor to resolve names itself.

**Comment by Rosch** [comment]
Thanks @omoerbeek.

The messages with the failing updates of the . records is just a symptom.

My scenerio is:

- isolated network from the internet
- dns data for my machines is in ldap
- I need to redirect certain hostnames via script - the rest shall come out of ldap DNS. I do not care if internet domains are resolvable in this network or not.
- pdns and pdns-recursor 4.8.4 coming with Oracle Linux 9.3

so I use pdns with pipe backend together with ldap backend running in port 8953
pdns-recursor is on port 53 forwarding to pdns

Maybe I doing something damned wrong. I am open for any suggestiosn

Here is my config. 
```
pdns-recursor.conf:
--------------------
security-poll-suffix=
allow-notify-from=0.0.0.0/0,::/0
dont-query=
local-address=0.0.0.0
local-port=53
forward-zones=domain.com=127.0.0.1:8953, domain.com=127.0.0.1:8953, domain.org=127.0.0.1:8953
forward-zones+=in-addr.arpa=127.0.0.1:8953, 192.in-addr.arpa=127.0.0.1:8953;192.168.9.3
log-common-errors=yes
loglevel=4
serve-rfc1918=no
hint-file=no

pdns.conf:
----------
local-port=8953
local-address=0.0.0.0
security-poll-suffix=
allow-notify-from=127.0.0.1/24
zone-cache-refresh-interval=0
loglevel=4
launch=pipe,ldap
ldap-method=strict
ldap-host=ldap://localhost:389/
ldap-starttls=yes
ldap-basedn=ou=dns,dc=domain,dc=my
pipe-command=/etc/pdns/pdns_pipebackend.sh
pipe-timeout=2000
pipe-regex=^(subnet-homes)|(subnet-homes\..*)|(subnet-ldap)|(subnet-ldap\..*).*$
pipe-abi-version=2
zone-cache-refresh-interval=0

```

It worked flawlessly with old pdns 3.x. Now I switched to pdns 4.8.4 and it is not running without problems anymore. I even have problems in standard config that I receive SERVFAIL on any request sometimes.

Thanks for your help

Roland

**Comment by omoerbeek** [comment]
Hello,

our GitHub issue tracker is for bug reports and feature requests. Your
question looks like a support question. Support questions are handled
in our other online communities: IRC and our mailing lists. Please see
https://www.powerdns.com/opensource.html for information about those.
