### ISSUE TITLE
DNS over HTTP mode fails to select a backend with downstream proxy protocol enable and upstream containing an X-Forwarded-For IPv6 adress

### ISSUE THREAD

**Issue by WRMSRwasTaken** [PowerDNS/pdns#11801]
- Program: dnsdist 
 - Issue type: Bug report

### Short description

Having enabled a DNS over HTTP listener (behind HAproxy), dnsdist fails to select a downstream server for incoming queries with an IPv6 Address set in `X-Forwarded-For` and having set `trustForwardedForHeader=true` on the `addDOHLocal` and `useProxyProtocol=true` in `newServer`.

### Environment

 - Operating system: Arch Linux, Kernel 5.18.12-arch1-1
 - Software version: dnsdist 1.7.2, haproxy 2.6.0, powerdns-recursor 4.7.1
 - Software source: HAProxy & PowerDNS-Recursor: Arch Repos, dnsdist: AUR

### Steps to reproduce

1. dnsdist config:
```
setACL({"0.0.0.0/0", "::/0"})

addDOHLocal("127.0.0.1:8080", nil, nil, "/dns-query", { reusePort=true, trustForwardedForHeader=true })

newServer({address="127.0.0.2", useProxyProtocol=true})
```
2. HAProxy config:
```
global
    maxconn     20000
    log stdout format short daemon
    user        haproxy
    pidfile     /run/haproxy.pid

defaults
    option http-keep-alive
    mode http
    log global
    option httpslog
    default_backend be_dnsdist

frontend fe_https
    bind 0.0.0.0:443,[::]:443 tfo ssl curves X448:X25519:P-256 alpn h2,http/1.1 crt /etc/ssl/private/mcl.gg.pem

    http-request add-header X-Forwarded-For %[src]
    http-request add-header X-Forwarded-Proto https

backend be_dnsdist
    server dnsdist 127.0.0.1:8080
```
3. PowerDNS-Recursor config:
Everything stock except `proxy-protocol-from=127.0.0.0/8` and `local-address=127.0.0.2`

### Expected behaviour
Queries should be passed to downstream servers with either IPv4 or IPv6 Adresses set in `X-Forwarded-For`

### Actual behaviour
dnsdist answers with `no downstream server available` for received queries on the DNS over HTTP port with an IPv6 Adress set in `X-Forwarded-For`, but it works for IPv4 Adresses set in `X-Forwarded-For`.

Tested with kdig:
```
$ kdig google.com +https=::1 @::1 +tls-hostname=mcl.gg
;; HTTP session (HTTP/2-POST)-(mcl.gg/dns-query)-(status: 502)
;; ERROR: failed to query server ::1@443(TCP)

$ kdig google.com +https=127.0.0.1 @127.0.0.1 +tls-hostname=mcl.gg
;; TLS session (TLS1.3)-(ECDHE-SECP256R1)-(RSA-PSS-RSAE-SHA256)-(AES-256-GCM);; HTTP session (HTTP/2-POST)-(mcl.gg/dns-query)-(status: 200)
;; ->>HEADER<<- opcode: QUERY; status: NOERROR; id: 0
;; Flags: qr rd ra; QUERY: 1; ANSWER: 1; AUTHORITY: 0; ADDITIONAL: 1

;; EDNS PSEUDOSECTION:
;; Version: 0; flags: ; UDP size: 512 B; ext-rcode: NOERROR

;; QUESTION SECTION:
;; google.com.         		IN	A

;; ANSWER SECTION:
google.com.         	300	IN	A	142.250.74.206

;; Received 55 B
;; Time 2022-07-21 15:09:43 CEST
;; From 127.0.0.1@443(TCP) in 40.7 ms
```

As seen in tcpdump for a successful query with an IPv4 set:
``` 
15:10:35.075138 IP 127.0.0.1.42540 > 127.0.0.1.8080: Flags [P.], seq 1:318, ack 1, win 43, options [nop,nop,TS val 1106016912 ecr 1106016912], length 317: HTTP: POST /dns-query HTTP/1.1
	0x0000:  4502 0171 b8db 4000 4006 82a7 7f00 0001  E..q..@.@.......
	0x0010:  7f00 0001 a62c 1f90 be8f ab7e e43a 950f  .....,.....~.:..
	0x0020:  8018 002b ff65 0000 0101 080a 41ec 7a90  ...+.e......A.z.
	0x0030:  41ec 7a90 504f 5354 202f 646e 732d 7175  A.z.POST./dns-qu
	0x0040:  6572 7920 4854 5450 2f31 2e31 0d0a 686f  ery.HTTP/1.1..ho
	0x0050:  7374 3a20 6d63 6c2e 6767 0d0a 6163 6365  st:.mcl.gg..acce
	0x0060:  7074 3a20 6170 706c 6963 6174 696f 6e2f  pt:.application/
	0x0070:  646e 732d 6d65 7373 6167 650d 0a63 6f6e  dns-message..con
	0x0080:  7465 6e74 2d74 7970 653a 2061 7070 6c69  tent-type:.appli
	0x0090:  6361 7469 6f6e 2f64 6e73 2d6d 6573 7361  cation/dns-messa
	0x00a0:  6765 0d0a 636f 6e74 656e 742d 6c65 6e67  ge..content-leng
	0x00b0:  7468 3a20 3132 380d 0a78 2d66 6f72 7761  th:.128..x-forwa
	0x00c0:  7264 6564 2d66 6f72 3a20 3132 372e 302e  rded-for:.127.0.
	0x00d0:  302e 310d 0a78 2d66 6f72 7761 7264 6564  0.1..x-forwarded
	0x00e0:  2d70 726f 746f 3a20 6874 7470 730d 0a0d  -proto:.https...
	0x00f0:  0a00 0001 0000 0100 0000 0000 0106 676f  ..............go
	0x0100:  6f67 6c65 0363 6f6d 0000 0100 0100 0029  ogle.com.......)
	0x0110:  1000 0000 0000 0059 000c 0055 0000 0000  .......Y...U....
	0x0120:  0000 0000 0000 0000 0000 0000 0000 0000  ................
	0x0130:  0000 0000 0000 0000 0000 0000 0000 0000  ................
	0x0140:  0000 0000 0000 0000 0000 0000 0000 0000  ................
	0x0150:  0000 0000 0000 0000 0000 0000 0000 0000  ................
	0x0160:  0000 0000 0000 0000 0000 0000 0000 0000  ................
	0x0170:  00                                       .
15:10:35.075162 IP 127.0.0.1.8080 > 127.0.0.1.42540: Flags [.], ack 318, win 43, options [nop,nop,TS val 1106016912 ecr 1106016912], length 0
	0x0000:  4500 0034 4141 4000 4006 fb80 7f00 0001  E..4AA@.@.......
	0x0010:  7f00 0001 1f90 a62c e43a 950f be8f acbb  .......,.:......
	0x0020:  8010 002b fe28 0000 0101 080a 41ec 7a90  ...+.(......A.z.
	0x0030:  41ec 7a90                                A.z.
15:10:35.075647 IP 127.0.0.1.8080 > 127.0.0.1.42540: Flags [P.], seq 1:244, ack 318, win 43, options [nop,nop,TS val 1106016913 ecr 1106016912], length 243: HTTP: HTTP/1.1 200 OK
	0x0000:  4502 0127 4142 4000 4006 fa8a 7f00 0001  E..'AB@.@.......
	0x0010:  7f00 0001 1f90 a62c e43a 950f be8f acbb  .......,.:......
	0x0020:  8018 002b ff1b 0000 0101 080a 41ec 7a91  ...+........A.z.
	0x0030:  41ec 7a90 4854 5450 2f31 2e31 2032 3030  A.z.HTTP/1.1.200
	0x0040:  204f 4b0d 0a44 6174 653a 2054 6875 2c20  .OK..Date:.Thu,.
	0x0050:  3231 204a 756c 2032 3032 3220 3133 3a31  21.Jul.2022.13:1
	0x0060:  303a 3335 2047 4d54 0d0a 436f 6e6e 6563  0:35.GMT..Connec
	0x0070:  7469 6f6e 3a20 6b65 6570 2d61 6c69 7665  tion:.keep-alive
	0x0080:  0d0a 436f 6e74 656e 742d 4c65 6e67 7468  ..Content-Length
	0x0090:  3a20 3535 0d0a 5365 7276 6572 3a20 6832  :.55..Server:.h2
	0x00a0:  6f2f 646e 7364 6973 740d 0a63 6f6e 7465  o/dnsdist..conte
	0x00b0:  6e74 2d74 7970 653a 2061 7070 6c69 6361  nt-type:.applica
	0x00c0:  7469 6f6e 2f64 6e73 2d6d 6573 7361 6765  tion/dns-message
	0x00d0:  0d0a 6361 6368 652d 636f 6e74 726f 6c3a  ..cache-control:
	0x00e0:  206d 6178 2d61 6765 3d32 3438 0d0a 0d0a  .max-age=248....
	0x00f0:  0000 8180 0001 0001 0000 0001 0667 6f6f  .............goo
	0x0100:  676c 6503 636f 6d00 0001 0001 c00c 0001  gle.com.........
	0x0110:  0001 0000 00f8 0004 8efa 4ace 0000 2902  ..........J...).
	0x0120:  0000 0000 0000 00                        .......
```
And an IPv6 set:
```
15:12:10.811583 IP 127.0.0.1.33576 > 127.0.0.1.8080: Flags [P.], seq 1:312, ack 1, win 43, options [nop,nop,TS val 1106112648 ecr 1106112648], length 311: HTTP: POST /dns-query HTTP/1.1
	0x0000:  4502 016b 1941 4000 4006 2248 7f00 0001  E..k.A@.@."H....
	0x0010:  7f00 0001 8328 1f90 b099 eb1c 86ef 1642  .....(.........B
	0x0020:  8018 002b ff5f 0000 0101 080a 41ed f088  ...+._......A...
	0x0030:  41ed f088 504f 5354 202f 646e 732d 7175  A...POST./dns-qu
	0x0040:  6572 7920 4854 5450 2f31 2e31 0d0a 686f  ery.HTTP/1.1..ho
	0x0050:  7374 3a20 6d63 6c2e 6767 0d0a 6163 6365  st:.mcl.gg..acce
	0x0060:  7074 3a20 6170 706c 6963 6174 696f 6e2f  pt:.application/
	0x0070:  646e 732d 6d65 7373 6167 650d 0a63 6f6e  dns-message..con
	0x0080:  7465 6e74 2d74 7970 653a 2061 7070 6c69  tent-type:.appli
	0x0090:  6361 7469 6f6e 2f64 6e73 2d6d 6573 7361  cation/dns-messa
	0x00a0:  6765 0d0a 636f 6e74 656e 742d 6c65 6e67  ge..content-leng
	0x00b0:  7468 3a20 3132 380d 0a78 2d66 6f72 7761  th:.128..x-forwa
	0x00c0:  7264 6564 2d66 6f72 3a20 3a3a 310d 0a78  rded-for:.::1..x
	0x00d0:  2d66 6f72 7761 7264 6564 2d70 726f 746f  -forwarded-proto
	0x00e0:  3a20 6874 7470 730d 0a0d 0a00 0001 0000  :.https.........
	0x00f0:  0100 0000 0000 0106 676f 6f67 6c65 0363  ........google.c
	0x0100:  6f6d 0000 0100 0100 0029 1000 0000 0000  om.......)......
	0x0110:  0059 000c 0055 0000 0000 0000 0000 0000  .Y...U..........
	0x0120:  0000 0000 0000 0000 0000 0000 0000 0000  ................
	0x0130:  0000 0000 0000 0000 0000 0000 0000 0000  ................
	0x0140:  0000 0000 0000 0000 0000 0000 0000 0000  ................
	0x0150:  0000 0000 0000 0000 0000 0000 0000 0000  ................
	0x0160:  0000 0000 0000 0000 0000 00              ...........
15:12:10.811598 IP 127.0.0.1.8080 > 127.0.0.1.33576: Flags [.], ack 312, win 43, options [nop,nop,TS val 1106112648 ecr 1106112648], length 0
	0x0000:  4500 0034 0908 4000 4006 33ba 7f00 0001  E..4..@.@.3.....
	0x0010:  7f00 0001 1f90 8328 86ef 1642 b099 ec53  .......(...B...S
	0x0020:  8010 002b fe28 0000 0101 080a 41ed f088  ...+.(......A...
	0x0030:  41ed f088                                A...
15:12:10.812021 IP 127.0.0.1.8080 > 127.0.0.1.33576: Flags [P.], seq 1:202, ack 312, win 43, options [nop,nop,TS val 1106112649 ecr 1106112648], length 201: HTTP: HTTP/1.1 502 Bad Gateway
	0x0000:  4502 00fd 0909 4000 4006 32ee 7f00 0001  E.....@.@.2.....
	0x0010:  7f00 0001 1f90 8328 86ef 1642 b099 ec53  .......(...B...S
	0x0020:  8018 002b fef1 0000 0101 080a 41ed f089  ...+........A...
	0x0030:  41ed f088 4854 5450 2f31 2e31 2035 3032  A...HTTP/1.1.502
	0x0040:  2042 6164 2047 6174 6577 6179 0d0a 4461  .Bad.Gateway..Da
	0x0050:  7465 3a20 5468 752c 2032 3120 4a75 6c20  te:.Thu,.21.Jul.
	0x0060:  3230 3232 2031 333a 3132 3a31 3020 474d  2022.13:12:10.GM
	0x0070:  540d 0a43 6f6e 6e65 6374 696f 6e3a 206b  T..Connection:.k
	0x0080:  6565 702d 616c 6976 650d 0a43 6f6e 7465  eep-alive..Conte
	0x0090:  6e74 2d4c 656e 6774 683a 2033 300d 0a53  nt-Length:.30..S
	0x00a0:  6572 7665 723a 2068 326f 2f64 6e73 6469  erver:.h2o/dnsdi
	0x00b0:  7374 0d0a 636f 6e74 656e 742d 7479 7065  st..content-type
	0x00c0:  3a20 7465 7874 2f70 6c61 696e 3b20 6368  :.text/plain;.ch
	0x00d0:  6172 7365 743d 7574 662d 380d 0a0d 0a6e  arset=utf-8....n
	0x00e0:  6f20 646f 776e 7374 7265 616d 2073 6572  o.downstream.ser
	0x00f0:  7665 7220 6176 6169 6c61 626c 65         ver.available
```

Removing `trustForwardedForHeader` from `addDOHLocal` or removing `useProxyProtocol` from `newServer` makes it starting to work.

The error also persists when adding or only having an IPv6 downstream configured:
`newServer({address="::1", useProxyProtocol=true})`

### Other information
I tried to break down the config as much as possible, and I haven't tried to look into dnsdist more closely (in terms of debuggin options) yet.

**Comment by rgacogne** [comment]
The issue is that a proxy protocol contains both the initial source and destination address, and that these addresses cannot be of a different family (mixing IPv4 and IPv6 is not possible). In your setup, the initial source IP address, as seen by haproxy, is forwarded via `X-Forwarded-For` but the initial destination address is not. Thus dnsdist tries to use the address it received the query on, which in your case is 127.0.0.1 (port 8080). It works if the initial source address was an IPv4 one, but not if it was an IPv6 one, as then we would have to mix IPv4 and IPv6 which cannot be done with the proxy protocol.
I would suggest adding a second `addDOHLocal` directive to listen on IPv6 (`::1`) and forwarding queries received by haproxy over IPv6 to this address, which should work.

**Comment by WRMSRwasTaken** [comment]
Yes, that made it work, thanks!
