### ISSUE TITLE
consider defaulting source ip for carbon-server tcp connections to query-local-address{,6}

### ISSUE THREAD

**Issue by jellytoo** [PowerDNS/pdns#1936]
Priority: wishlist
Found: 0.0-git-20141211-1611-ba98c6d-1 (semistatic amd64 deb package from autobuilder)

Hi.  Using `rec_control set-carbon-server 82.94.213.34 pick-something` command from http://blog.powerdns.com/2014/12/11/powerdns-graphing-as-a-service/, pdns-recursor tries to open tcp connections using the default public ip address.  I'd prefer if it used the same source ip as used for dns queries by default, and not expose any other IP addresses on the machine unnecessarily.
Separate options for `carbon-local-address{,6}` might or might not be useful, but it'd be nice if its values defaulted to `query-local-address{,6}` when set.

```
[17:10] /etc/powerdns # rec_control set-carbon-server 82.94.213.34 immemorial2
set carbon-server to '82.94.213.34'
set carbon-ourname to 'immemorial2'
[17:13] /etc/powerdns # tcpdump -ni bond0 port 2003
Dec 11 17:13:53 dns2 kernel: [15972964.388420] device bond0 entered promiscuous mode
Dec 11 17:13:53 dns2 kernel: [15972964.388457] device eth0 entered promiscuous mode
Dec 11 17:13:53 dns2 kernel: [15972964.388500] device eth1 entered promiscuous mode
tcpdump: verbose output suppressed, use -v or -vv for full protocol decode
listening on bond0, link-type EN10MB (Ethernet), capture size 65535 bytes
17:14:15.000182 IP [secret ip that can't go out to the internet].35192 > 82.94.213.34.2003: Flags [S], seq 2815743248, win 14600, options [mss 1460,sackOK,TS val 3998914624 ecr 0,nop,wscale 7], length 0
17:14:15.996371 IP [secret ip].35192 > 82.94.213.34.2003: Flags [S], seq 2815743248, win 14600, options [mss 1460,sackOK,TS val 3998914874 ecr 0,nop,wscale 7], length 0
17:14:45.000113 IP [secret ip].35193 > 82.94.213.34.2003: Flags [S], seq 3020104981, win 14600, options [mss 1460,sackOK,TS val 3998922124 ecr 0,nop,wscale 7], length 0
```

**Comment by Habbie** [comment]
Given that we have a single dual-stack enabled (I presume) `carbon-server`, this related option would be `carbon-local-address` without a '6' sibling.
