### ISSUE TITLE
rec: QNAME minimization sometimes uses 1 label too many

### ISSUE THREAD

**Issue by mnordhoff** [PowerDNS/pdns#8697]
- Program:  Recursor
 - Issue type: Bug report

### Short description
QNAME minimization queries sometimes have 1 extra label. E.g. it will send a query for `example.org` to the root, or maybe send a query for `www.example.org` to the `org` nameservers.

I have little useful information, sorry. I have a suspicion that it doesn't happen when the recursor has just been started, suggesting that it might have something to do with data expiring from the cache. But who knows.

### Environment
 - Operating system: Ubuntu 16.04 amd64
 - Software version: 4.3.0~beta1+master.52.ga9d432dc0-1pdns.xenial
 - Software source: PowerDNS repository

### Steps to reproduce
?

### Expected behaviour
E.g. `mattnordhoffdns.org` `DS` query sent to the `org` nameservers.

### Actual behaviour
E.g. `mattnordhoffdns.org` `DS` query sent to the root.

### Other information
This resolver receives very little traffic.

I think I saw an `A` query for something`.mattnordhoffdns.org` go to the `org` nameservers once, but I don't have any evidence.

Some `tcpdump` data:

```
2020-01-11 11:57:31.497122 IP 127.0.0.1.54595 > 127.0.0.1.53: 21675+ [1au] SOA? mattnordhoffdns.org. (60)
2020-01-11 11:57:31.497596 IP6 2600:3c00::f03c:91ff:fe96:6bcc.56208 > 2001:503:c27::2:30.53: 31577 [1au] DS? mattnordhoffdns.org. (48)
2020-01-11 11:57:31.535338 IP6 2001:503:c27::2:30.53 > 2600:3c00::f03c:91ff:fe96:6bcc.56208: 31577- 0/9/13 (821)
2020-01-11 11:57:31.536363 IP6 2600:3c00::f03c:91ff:fe96:6bcc.52870 > 2001:500:c::1.53: 59813 [1au] DS? mattnordhoffdns.org. (48)
2020-01-11 11:57:31.568333 IP6 2001:500:c::1.53 > 2600:3c00::f03c:91ff:fe96:6bcc.52870: 59813*- 0/6/1 (767)
2020-01-11 11:57:31.568735 IP 104.237.139.208.36283 > 199.19.53.1.53: 17987 [1au] DNSKEY? org. (32)
2020-01-11 11:57:31.716303 IP 199.19.53.1.53 > 104.237.139.208.36283: 17987*-| 0/0/1 (32)
2020-01-11 11:57:31.716538 IP 104.237.139.208.42717 > 199.19.53.1.53: Flags [S], seq 241789300, win 64240, options [mss 1460,sackOK,TS val 332910992 ecr 0,nop,wscale 7], length 0
2020-01-11 11:57:31.862535 IP 199.19.53.1.53 > 104.237.139.208.42717: Flags [S.], seq 235611117, ack 241789301, win 65535, options [mss 1460,nop,wscale 6,sackOK,TS val 2875835595 ecr 332910992], length 0
2020-01-11 11:57:31.862589 IP 104.237.139.208.42717 > 199.19.53.1.53: Flags [.], ack 1, win 502, options [nop,nop,TS val 332911138 ecr 2875835595], length 0
2020-01-11 11:57:31.862863 IP 104.237.139.208.42717 > 199.19.53.1.53: Flags [P.], seq 1:35, ack 1, win 502, options [nop,nop,TS val 332911138 ecr 2875835595], length 3450549 [1au] DNSKEY? org. (32)
2020-01-11 11:57:32.009031 IP 199.19.53.1.53 > 104.237.139.208.42717: Flags [P.], seq 1:1628, ack 35, win 1040, options [nop,nop,TS val 2875835742 ecr 332911138], length 162750549*- 7/0/1 DNSKEY, DNSKEY, DNSKEY, DNSKEY, RRSIG, RRSIG, RRSIG (1625)
2020-01-11 11:57:32.009061 IP 104.237.139.208.42717 > 199.19.53.1.53: Flags [.], ack 1628, win 495, options [nop,nop,TS val 332911284 ecr 2875835742], length 0
2020-01-11 11:57:32.016402 IP 104.237.139.208.42717 > 199.19.53.1.53: Flags [F.], seq 35, ack 1628, win 501, options [nop,nop,TS val 332911292 ecr 2875835742], length 0
2020-01-11 11:57:32.018490 IP 104.237.139.208.18848 > 205.251.194.49.53: 47979 [1au] SOA? mattnordhoffdns.org. (48)
2020-01-11 11:57:32.048380 IP 205.251.194.49.53 > 104.237.139.208.18848: 47979*- 1/4/1 SOA (233)
2020-01-11 11:57:32.048829 IP 127.0.0.1.53 > 127.0.0.1.54595: 21675 1/0/1 SOA (114)
```

The `DS` query on line 2 was sent to the root.

```
2020-01-11 02:15:14.131159 IP 127.0.0.1.33752 > 127.0.0.1.53: 41571+ [1au] SOA? mattnordhoffdns.work. (61)
2020-01-11 02:15:14.131865 IP6 2600:3c00::f03c:91ff:fe96:6bcc.39360 > 2001:7fd::1.53: 27254 [1au] DS? work. (33)
2020-01-11 02:15:14.167770 IP6 2001:7fd::1.53 > 2600:3c00::f03c:91ff:fe96:6bcc.39360: 27254*- 2/0/1 DS, RRSIG (368)
2020-01-11 02:15:14.168401 IP 104.237.139.208.6028 > 199.7.91.13.53: 3254 [1au] DS? mattnordhoffdns.work. (49)
2020-01-11 02:15:14.169911 IP 199.7.91.13.53 > 104.237.139.208.6028: 3254- 0/10/14 (808)
2020-01-11 02:15:14.170320 IP 104.237.139.208.29709 > 43.230.49.35.53: 469 [1au] DS? mattnordhoffdns.work. (49)
2020-01-11 02:15:14.275961 IP 43.230.49.35.53 > 104.237.139.208.29709: 469*- 2/0/1 DS, RRSIG (389)
2020-01-11 02:15:14.276281 IP 104.237.139.208.60067 > 156.154.102.3.53: 60538 [1au] DNSKEY? work. (33)
2020-01-11 02:15:14.277319 IP 156.154.102.3.53 > 104.237.139.208.60067: 60538*- 3/0/1 DNSKEY, DNSKEY, RRSIG (877)
2020-01-11 02:15:14.277858 IP 104.237.139.208.26034 > 205.251.196.188.53: 26509 [1au] A? ns11.mattnordhoffdns.org. (53)
2020-01-11 02:15:14.279056 IP 205.251.196.188.53 > 104.237.139.208.26034: 26509*- 1/4/1 A 13.58.6.55 (206)
2020-01-11 02:15:14.279265 IP 104.237.139.208.6094 > 13.58.6.55.53: 37402 [1au] SOA? mattnordhoffdns.work. (49)
2020-01-11 02:15:14.307103 IP 13.58.6.55.53 > 104.237.139.208.6094: 37402*- 2/0/1 RRSIG, SOA (235)
2020-01-11 02:15:14.307658 IP6 2600:3c00::f03c:91ff:fe96:6bcc.42458 > 2606:4700:50::adf5:3a69.53: 8020 [1au] A? ns11.mattnordhoffdns.com. (53)
2020-01-11 02:15:14.311793 IP6 2606:4700:50::adf5:3a69.53 > 2600:3c00::f03c:91ff:fe96:6bcc.42458: 8020*- 2/0/1 A 45.33.103.94, RRSIG (184)
2020-01-11 02:15:14.311998 IP 104.237.139.208.34343 > 45.33.103.94.53: 41734 [1au] DNSKEY? mattnordhoffdns.work. (49)
2020-01-11 02:15:14.329778 IP 45.33.103.94.53 > 104.237.139.208.34343: 41734*- 2/0/1 DNSKEY, RRSIG (245)
2020-01-11 02:15:14.330290 IP 127.0.0.1.53 > 127.0.0.1.33752: 41571$ 1/0/1 SOA (119)
```

The `DS` query on line 4 was sent to the root.

Configuration:

```
$ grep -ve ^# -e '^$' recursor.conf
allow-trust-anchor-query
carbon-ourname=clover_mattnordhoff_net
carbon-server=2a02:2770:8::2635:0:1
config-dir=/etc/powerdns
dnssec=validate
dnssec-log-bogus
hint-file=/usr/share/dns/root.hints
include-dir=/etc/powerdns/recursor.d
local-address=127.0.0.1, ::1
log-common-errors
lua-config-file=/etc/powerdns/recursor.lua
max-cache-ttl=172800
max-negative-ttl=10800
query-local-address6=::
quiet=yes
setgid=pdns
setuid=pdns
threads=1
```

`recursor.d` is empty and `recursor.lua` is the stock root key stuff.

**Comment by omoerbeek** [comment]
We do fall back to a regular resolve if the qname minimization resolve does not succeed (for various reasons). Were there failing attempts before the recursor decided to consult a root server? Trace data might help here, since that  shows more of the decision process of the recursor.

**Comment by mnordhoff** [comment]
> Were there failing attempts before the recursor decided to consult a root server?

While resolving that query, or while resolving other things? In my first tcpdump snippet, the odd query is the very first one, sent 0.5 ms after Recursor received the query. There shouldn't have been time for anything to fail.

> Trace data might help here, since that shows more of the decision process of the recursor.

Yes. I've been trying to get some, but no luck so far. :(

**Comment by omoerbeek** [comment]
qname minimizations are driven by cache contents, so previous activity does have impact. Are you saying that there were no queries done by the recursor before your first trace? I would expect to see `.org` queries going to a root server at the start of your trace in that case.

**Comment by mnordhoff** [comment]
It had probably been running for a few days and probably received a few thousand queries.

**Comment by omoerbeek** [comment]
OK, in that case I misinterpreted "the odd query is the very first one".

**Comment by mnordhoff** [comment]
Sorry, I meant "the first outgoing query it made as part of resolving that incoming query".

**Comment by mnordhoff** [comment]
Okay I did "`sudo rec_control trace-regex mattnordhoffdns`" and "`dig +dnssec mattnordhoffdns.work soa`" and it sent a `DS` query for `mattnordhoffdns.work` to `d.root-servers.net` (`199.7.91.13`).

```
2020-01-30 03:49:33.515294 IP 127.0.0.1.47799 > 127.0.0.1.53: 1800+ [1au] SOA? mattnordhoffdns.work. (61)
2020-01-30 03:49:33.521026 IP6 2600:3c00::f03c:91ff:fe96:6bcc.45705 > 2001:dc3::35.53: 24230 [1au] DS? work. (33)
2020-01-30 03:49:33.637041 IP6 2001:dc3::35.53 > 2600:3c00::f03c:91ff:fe96:6bcc.45705: 24230*- 2/0/1 DS, RRSIG (368)
2020-01-30 03:49:33.639114 IP 104.237.139.208.55402 > 199.7.91.13.53: 6188 [1au] DS? mattnordhoffdns.work. (49)
2020-01-30 03:49:33.673263 IP 199.7.91.13.53 > 104.237.139.208.55402: 6188- 0/10/14 (808)
2020-01-30 03:49:33.675553 IP6 2600:3c00::f03c:91ff:fe96:6bcc.47145 > 2401:fd80:405::35.53: 31455 [1au] DS? mattnordhoffdns.work. (49)
2020-01-30 03:49:33.780716 IP6 2401:fd80:405::35.53 > 2600:3c00::f03c:91ff:fe96:6bcc.47145: 31455*- 2/0/1 DS, RRSIG (389)
2020-01-30 03:49:33.781714 IP 104.237.139.208.28711 > 43.230.49.35.53: 22094 [1au] DNSKEY? work. (33)
2020-01-30 03:49:33.886580 IP 43.230.49.35.53 > 104.237.139.208.28711: 22094*- 3/0/1 DNSKEY, DNSKEY, RRSIG (877)
2020-01-30 03:49:33.889514 IP 104.237.139.208.16510 > 199.249.120.1.53: 2506 [1au] A? mattnordhoffdns.org. (48)
2020-01-30 03:49:33.891009 IP 199.249.120.1.53 > 104.237.139.208.16510: 2506- 0/8/2 (694)
2020-01-30 03:49:33.892227 IP 104.237.139.208.52761 > 205.251.193.123.53: 43949 [1au] A? ns11.mattnordhoffdns.org. (53)
2020-01-30 03:49:33.893442 IP 205.251.193.123.53 > 104.237.139.208.52761: 43949*- 1/4/1 A 13.58.6.55 (206)
2020-01-30 03:49:33.894038 IP 104.237.139.208.18776 > 13.58.6.55.53: 52909 [1au] SOA? mattnordhoffdns.work. (49)
2020-01-30 03:49:33.922270 IP 13.58.6.55.53 > 104.237.139.208.18776: 52909*- 2/0/1 RRSIG, SOA (235)
2020-01-30 03:49:33.924104 IP 104.237.139.208.3522 > 192.26.92.30.53: 46501 [1au] A? mattnordhoffdns.com. (48)
2020-01-30 03:49:33.959804 IP 192.26.92.30.53 > 104.237.139.208.3522: 46501- 0/4/5 (431)
2020-01-30 03:49:33.964257 IP6 2600:3c00::f03c:91ff:fe96:6bcc.60348 > 2606:4700:58::adf5:3b6b.53: 56085 [1au] A? ns10.mattnordhoffdns.com. (53)
2020-01-30 03:49:35.572246 IP 104.237.139.208.46729 > 173.245.59.107.53: 13643 [1au] A? ns10.mattnordhoffdns.com. (53)
2020-01-30 03:49:35.576990 IP 173.245.59.107.53 > 104.237.139.208.46729: 13643*- 2/0/1 A 159.203.186.41, RRSIG (184)
2020-01-30 03:49:35.577903 IP 104.237.139.208.33445 > 159.203.186.41.53: 54598 [1au] DNSKEY? mattnordhoffdns.work. (49)
2020-01-30 03:49:35.618917 IP 159.203.186.41.53 > 104.237.139.208.33445: 54598*- 2/0/1 DNSKEY, RRSIG (245)
2020-01-30 03:49:35.650004 IP 127.0.0.1.53 > 127.0.0.1.47799: 1800$ 2/0/1 SOA, RRSIG (235)
```

Trace: https://mn0.us/E8AgYKUz6ZqY/syslog.txt

**Comment by mnordhoff** [comment]
Looking at the trace for two minutes, I have a theory. It might be wrong, but here it is:

1. Query comes in for `mattnordhoffdns.work` `SOA`
2. `doResolve`
3. `NS` records for `mattnordhoffdns.work` are in cache. `NS` records for `work` are not in cache.
4. `doResolve` finds `NS` records for `mattnordhoffdns.work`, thinks "Yay! All done!" and takes a shortcut straight to:
https://github.com/PowerDNS/pdns/blob/2444ca575a9c10b46bfe00a65f97b9e8b72576b3/pdns/syncres.cc#L718-L724
5. 99% of the entire request is handled by that call to `doResolveNoQNameMinimization`, including all the DNSSEC validation
6. Therefore the `mattnordhoffdns.work` `DS` query goes to the root
7. Nothing else in `tcpdump` looks wrong because the other cached data (e.g. `com`) coincidentally makes it appear that QNAME minimization is still in play

**Comment by omoerbeek** [comment]
Yes, that was my theory as well. It happens when a target NS records are cached  but not (all) ancestors.

**Comment by mnordhoff** [comment]
> 7. Nothing else in tcpdump looks wrong because the other cached data (e.g. com) coincidentally makes it appear that QNAME minimization is still in play

That was wrong. There was definitely still QNAME minimization for some things:

```
2020-01-30 03:49:33.889514 IP 104.237.139.208.16510 > 199.249.120.1.53: 2506 [1au] A? mattnordhoffdns.org. (48)
2020-01-30 03:49:33.891009 IP 199.249.120.1.53 > 104.237.139.208.16510: 2506- 0/8/2 (694)
```

Maybe "resolving nameservers" and "resolving DNSSEC" take different code paths, and the former reactivates qmin?

**Comment by omoerbeek** [comment]
OK, I can reproduce. I have a local diff thart allows me to flush specific record types.

Steps to reproduce:

1. Start a fresh recursor on port 5301
2. `dig -p 5301 +dnssec mattnordhoffdns.work soa`
Dnstap output:
```
10:52:55.049322 RQ 199.7.91.13 UDP 33b "work." IN DS
10:52:55.053971 RR 199.7.91.13 UDP 368b "work." IN DS
10:52:55.057359 RQ 192.58.128.30 UDP 33b "work." IN A
10:52:55.069933 RR 192.58.128.30 UDP 792b "work." IN A
10:52:55.072373 RQ 213.248.221.35 UDP 49b "mattnordhoffdns.work." IN DS
10:52:55.077918 RR 213.248.221.35 UDP 389b "mattnordhoffdns.work." IN DS
10:52:55.078824 RQ 156.154.100.3 UDP 33b "work." IN DNSKEY
10:52:55.091663 RR 156.154.100.3 UDP 877b "work." IN DNSKEY
10:52:55.093333 RQ 156.154.103.3 UDP 49b "mattnordhoffdns.work." IN SOA
10:52:55.098124 RR 156.154.103.3 UDP 503b "mattnordhoffdns.work." IN SOA
10:52:55.100066 RQ 198.97.190.53 UDP 32b "org." IN A
10:52:55.112016 RR 198.97.190.53 UDP 805b "org." IN A
10:52:55.113828 RQ 199.249.120.1 UDP 48b "mattnordhoffdns.org." IN A
10:52:55.119224 RR 199.249.120.1 UDP 694b "mattnordhoffdns.org." IN A
10:52:55.121454 RQ 192.5.5.241 UDP 32b "com." IN A
10:52:55.127116 RR 192.5.5.241 UDP 1163b "com." IN A
10:52:55.131066 RQ 192.35.51.30 UDP 42b "awsdns-47.com." IN A
10:52:55.137568 RR 192.35.51.30 UDP 860b "awsdns-47.com." IN A
10:52:55.139254 RQ 205.251.198.239 UDP 49b "ns-379.awsdns-47.com." IN A
10:52:55.144548 RR 205.251.198.239 UDP 334b "ns-379.awsdns-47.com." IN A
10:52:55.145308 RQ 205.251.193.123 UDP 53b "ns10.mattnordhoffdns.org." IN A
10:52:55.160825 RR 205.251.193.123 UDP 206b "ns10.mattnordhoffdns.org." IN A
10:52:55.161291 RQ 104.237.139.208 UDP 49b "mattnordhoffdns.work." IN SOA
10:52:55.288308 RR 104.237.139.208 UDP 235b "mattnordhoffdns.work." IN SOA
10:52:55.289472 RQ 205.251.196.188 UDP 53b "ns11.mattnordhoffdns.org." IN A
10:52:55.300819 RR 205.251.196.188 UDP 206b "ns11.mattnordhoffdns.org." IN A
10:52:55.301230 RQ 13.58.6.55 UDP 49b "mattnordhoffdns.work." IN DNSKEY
10:52:55.407011 RR 13.58.6.55 UDP 245b "mattnordhoffdns.work." IN DNSKEY
```
3. Flush some specific cache entries:
````
./rc wipe-cache-typed soa mattnordhoffdns.work 
./rc wipe-cache-typed ds mattnordhoffdns.work 
./rc wipe-cache-typed ns work 
./rc wipe-cache-typed ds work
``` 
4. Do the query again and see the following dnstap output:
```
10:50:04.166278 RQ 199.7.91.13 UDP 33b "work." IN DS
10:50:04.172025 RR 199.7.91.13 UDP 368b "work." IN DS
10:50:04.173409 RQ 198.41.0.4 UDP 49b "mattnordhoffdns.work." IN DS
10:50:04.179832 RR 198.41.0.4 UDP 808b "mattnordhoffdns.work." IN DS
10:50:04.181310 RQ 43.230.49.35 UDP 49b "mattnordhoffdns.work." IN DS
10:50:04.187597 RR 43.230.49.35 UDP 389b "mattnordhoffdns.work." IN DS
10:50:04.188681 RQ 13.58.6.55 UDP 49b "mattnordhoffdns.work." IN SOA
10:50:04.299551 RR 13.58.6.55 UDP 235b "mattnordhoffdns.work." IN SOA
```

The first DS query is going to a root name server instead of a work nameserver.
