### DISCUSSION TITLE
After update zone update fails. After getting notified the slave often reports 'Unable to retrieve SOA for' and no AXFR happens

### DISCUSSION THREAD

**Discussion by ramuller** [PowerDNS/pdns#14958] [Q&A]
We use PowerDNS with 1 authoritative master with 5 authoritative slaves the slave also use dnsdist for load balancing.
I have updated PowerDNS from version 4.1.14 to 4.8.4. After the update the zone-transfer to the slave is very unreliable.
I can see the NOTIFY in the slave but at least half of the time I get "Unable to retrieve SOA for" and no AXFR is initiated.

Example for OK and NOK
```
Dec 12 12:28:19 dns-slave.example.net pdns_server[863666]: Received NOTIFY for foo-test.example.net from 127.0.0.1<-1.2.3.4/32 - queueing check
Dec 12 12:28:21 dns-slave.example.net pdns_server[863666]: Unable to retrieve SOA for foo-test.example.net, this was the first time. NOTE: For every subsequent failed SOA check the domain will be suspended from freshness checks for 'num-errors x 60 seconds', with a maximum of 3600 seconds. Skipping SOA checks until 1734006561
Dec 12 12:28:21 dns-slave.example.net pdns_server[863666]: Got NOTIFY for foo-test.example.net, removing zone from list of failed slave-checks and going to check SOA serial
Dec 12 12:28:22 dns-slave.example.net pdns_server[863666]: Received NOTIFY for foo-test.example.net from 127.0.0.1<-1.2.3.4/32
Dec 12 12:28:22 dns-slave.example.net pdns_server[863666]: Received NOTIFY for foo-test.example.net from trusted-notification-proxy 127.0.0.1<-1.2.3.4/32
Dec 12 12:28:22 dns-slave.example.net pdns_server[863666]: Received NOTIFY for foo-test.example.net from 127.0.0.1<-1.2.3.4/32 - queueing check
Dec 12 12:28:24 dns-slave.example.net pdns_server[863666]: Domain 'foo-test.example.net' is stale, master 1.2.3.4 serial 2024124065, our serial 2024124063
```

The network connection is stable and no additional firewall except nftables is between the nodes.
Even with loglevel 9 I don't get more detailed.
Has anyone else seen similar problems and good ideas how to debug the situation?

**Comment by Habbie** [comment]
Please:
* read https://github.com/PowerDNS/pdns/discussions/13200
* then update your post with real log output
* see if the logs on the primary show anything interesting

**Reply by ramuller** [reply]
It's real journalctl output, I only replaced the domainame and master IP with sed.

**Reply by Habbie** [reply]
> It's real journalctl output, I only replaced the domainame and master IP with sed.

and I am asking you to not sed the output. We can only offer help with real, unmodified, log output.

**Reply by ramuller** [reply]
Hi,

here are the original logs.  First set  a failure case and 2nd set a success case. Both cases are on the same set-up. I have no exact statistics but definitly more than 50% of case fail! The same happens on 6 slaves in different datacenters.

In failure case the slave does not even try to check domain's SOA from the master.

Any idea what I can do to improve the situation or how I can further debug the situation?

**Failure case**
**Journal from slave**
```
# journalctl -fu pdns
Dec 13 07:43:36 dns-slave-6.nesc.nokia.net pdns_server[96128]: Domain 'nesc-test.dyn.nesc.nokia.net' is stale, master 10.129.189.23 serial 2024151147, our serial 2024151145
Dec 13 07:43:36 dns-slave-6.nesc.nokia.net pdns_server[96128]: XFR-in zone: 'nesc-test.dyn.nesc.nokia.net', primary: '10.129.189.23', initiating transfer
Dec 13 07:43:36 dns-slave-6.nesc.nokia.net pdns_server[96128]: No new unfresh slave domains, 0 queued for AXFR already, 1 in progress
Dec 13 07:43:36 dns-slave-6.nesc.nokia.net pdns_server[96128]: gmysql Connection successful. Connected to database 'powerdns' on '127.0.0.1'.
Dec 13 07:43:36 dns-slave-6.nesc.nokia.net pdns_server[96128]: XFR-in zone: 'nesc-test.dyn.nesc.nokia.net', primary: '10.129.189.23', starting AXFR
Dec 13 07:43:36 dns-slave-6.nesc.nokia.net pdns_server[96128]: AXFR-in zone 'nesc-test.dyn.nesc.nokia.net', primary '10.129.189.23', retrieval started
Dec 13 07:43:36 dns-slave-6.nesc.nokia.net pdns_server[96128]: AXFR-in zone: 'nesc-test.dyn.nesc.nokia.net', primary: '10.129.189.23', retrieval finished
Dec 13 07:43:36 dns-slave-6.nesc.nokia.net pdns_server[96128]: AXFR-in zone: 'nesc-test.dyn.nesc.nokia.net', primary: '10.129.189.23', storage transaction started
Dec 13 07:43:36 dns-slave-6.nesc.nokia.net pdns_server[96128]: AXFR-in zone: 'nesc-test.dyn.nesc.nokia.net', primary: '10.129.189.23', zone committed with serial 2024151147
Dec 13 07:44:36 dns-slave-6.nesc.nokia.net pdns_server[96128]: No new unfresh slave domains, 0 queued for AXFR already, 0 in progress
Dec 13 07:47:12 dns-slave-6.nesc.nokia.net pdns_server[96128]: Received NOTIFY for nesc-test.dyn.nesc.nokia.net from 127.0.0.1<-10.129.189.23/32
Dec 13 07:47:12 dns-slave-6.nesc.nokia.net pdns_server[96128]: Received NOTIFY for nesc-test.dyn.nesc.nokia.net from trusted-notification-proxy 127.0.0.1<-10.129.189.23/32
Dec 13 07:47:12 dns-slave-6.nesc.nokia.net pdns_server[96128]: Received NOTIFY for nesc-test.dyn.nesc.nokia.net from 127.0.0.1<-10.129.189.23/32 - queueing check
Dec 13 07:47:12 dns-slave-6.nesc.nokia.net pdns_server[96128]: Got NOTIFY for nesc-test.dyn.nesc.nokia.net, going to check SOA serial
Dec 13 07:47:12 dns-slave-6.nesc.nokia.net pdns_server[96128]: 1 slave domain needs checking, 0 queued for AXFR
Dec 13 07:47:15 dns-slave-6.nesc.nokia.net pdns_server[96128]: Received serial number updates for 0 zones, had 1 timeout
Dec 13 07:47:15 dns-slave-6.nesc.nokia.net pdns_server[96128]: Unable to retrieve SOA for nesc-test.dyn.nesc.nokia.net, this was the first time. NOTE: For every subsequent failed SOA check the domain will be suspended from freshness checks for 'num-errors x 60 seconds', with a maximum of 3600 seconds. Skipping SOA checks until 1734076095
Dec 13 07:47:15 dns-slave-6.nesc.nokia.net pdns_server[96128]: Zone 'nesc-test.dyn.nesc.nokia.net' is on the list of failed SOA checks. Skipping SOA checks until 1734076095
Dec 13 07:47:29 dns-slave-6.nesc.nokia.net pdns_server[96128]: gmysql Connection successful. Connected to database 'powerdns' on '127.0.0.1'.
```

**tcpdump from the slave**
```
[root@dns-slave-6 ~]# tcpdump port 53 and host 10.129.189.23
dropped privs to tcpdump
tcpdump: verbose output suppressed, use -v[v]... for full protocol decode
listening on ens3, link-type EN10MB (Ethernet), snapshot length 262144 bytes
07:47:12.697876 IP dyndns-master-1.nesc.nokia.net.19914 > dns-slave-6.nesc.nokia.net.domain: 8876 notify [b2&3=0x2400] SOA? nesc-test.dyn.nesc.nokia.net. (46)
07:47:12.699017 IP dns-slave-6.nesc.nokia.net.domain > dyndns-master-1.nesc.nokia.net.19914: 8876 notify*- 0/0/0 (46)
```

**tcpdump from the master**
```
[root@dyndns-master-1 ~]# tcpdump port 53 and host 10.129.189.51
dropped privs to tcpdump
tcpdump: verbose output suppressed, use -v[v]... for full protocol decode
listening on eth0, link-type EN10MB (Ethernet), snapshot length 262144 bytes
07:47:12.697626 IP dyndns-master-1.nesc.nokia.net.19914 > dns-slave-6.nesc.nokia.net.domain: 8876 notify [b2&3=0x2400] SOA? nesc-test.dyn.nesc.nokia.net. (46)
07:47:12.699362 IP dns-slave-6.nesc.nokia.net.domain > dyndns-master-1.nesc.nokia.net.19914: 8876 notify*- 0/0/0 (46)

```

**Success case**
**Journal from slave**
```
[root@dns-slave-6 ~]# journalctl -fu pdns
Dec 13 07:52:29 dns-slave-6.nesc.nokia.net pdns_server[96128]: gmysql Connection successful. Connected to database 'powerdns' on '127.0.0.1'.
Dec 13 07:52:46 dns-slave-6.nesc.nokia.net pdns_server[96128]: Received NOTIFY for nesc-test.dyn.nesc.nokia.net from 127.0.0.1<-10.129.189.23/32
Dec 13 07:52:46 dns-slave-6.nesc.nokia.net pdns_server[96128]: Received NOTIFY for nesc-test.dyn.nesc.nokia.net from trusted-notification-proxy 127.0.0.1<-10.129.189.23/32
Dec 13 07:52:46 dns-slave-6.nesc.nokia.net pdns_server[96128]: Received NOTIFY for nesc-test.dyn.nesc.nokia.net from 127.0.0.1<-10.129.189.23/32 - queueing check
Dec 13 07:52:47 dns-slave-6.nesc.nokia.net pdns_server[96128]: Got NOTIFY for nesc-test.dyn.nesc.nokia.net, removing zone from list of failed slave-checks and going to check SOA serial
Dec 13 07:52:47 dns-slave-6.nesc.nokia.net pdns_server[96128]: 1 slave domain needs checking, 0 queued for AXFR
Dec 13 07:52:50 dns-slave-6.nesc.nokia.net pdns_server[96128]: Received serial number updates for 0 zones, had 1 timeout
Dec 13 07:52:50 dns-slave-6.nesc.nokia.net pdns_server[96128]: Unable to retrieve SOA for nesc-test.dyn.nesc.nokia.net, this was the first time. NOTE: For every subsequent failed SOA check the domain will be suspended from freshness checks for 'num-errors x 60 seconds', with a maximum of 3600 seconds. Skipping SOA checks until 1734076430
Dec 13 07:52:50 dns-slave-6.nesc.nokia.net pdns_server[96128]: Zone 'nesc-test.dyn.nesc.nokia.net' is on the list of failed SOA checks. Skipping SOA checks until 1734076430
Dec 13 07:52:50 dns-slave-6.nesc.nokia.net pdns_server[96128]: No new unfresh slave domains, 0 queued for AXFR already, 0 in progress
Dec 13 07:53:04 dns-slave-6.nesc.nokia.net pdns_server[96128]: Received NOTIFY for nesc-test.dyn.nesc.nokia.net from 127.0.0.1<-10.129.189.23/32
Dec 13 07:53:04 dns-slave-6.nesc.nokia.net pdns_server[96128]: Received NOTIFY for nesc-test.dyn.nesc.nokia.net from trusted-notification-proxy 127.0.0.1<-10.129.189.23/32
Dec 13 07:53:04 dns-slave-6.nesc.nokia.net pdns_server[96128]: Received NOTIFY for nesc-test.dyn.nesc.nokia.net from 127.0.0.1<-10.129.189.23/32 - queueing check
Dec 13 07:53:05 dns-slave-6.nesc.nokia.net pdns_server[96128]: Got NOTIFY for nesc-test.dyn.nesc.nokia.net, removing zone from list of failed slave-checks and going to check SOA serial
Dec 13 07:53:05 dns-slave-6.nesc.nokia.net pdns_server[96128]: 1 slave domain needs checking, 0 queued for AXFR
Dec 13 07:53:05 dns-slave-6.nesc.nokia.net pdns_server[96128]: Received serial number updates for 1 zone
Dec 13 07:53:05 dns-slave-6.nesc.nokia.net pdns_server[96128]: Domain 'nesc-test.dyn.nesc.nokia.net' is stale, master 10.129.189.23 serial 2024151150, our serial 2024151147
Dec 13 07:53:05 dns-slave-6.nesc.nokia.net pdns_server[96128]: XFR-in zone: 'nesc-test.dyn.nesc.nokia.net', primary: '10.129.189.23', initiating transfer
Dec 13 07:53:05 dns-slave-6.nesc.nokia.net pdns_server[96128]: No new unfresh slave domains, 0 queued for AXFR already, 1 in progress
Dec 13 07:53:05 dns-slave-6.nesc.nokia.net pdns_server[96128]: gmysql Connection successful. Connected to database 'powerdns' on '127.0.0.1'.
Dec 13 07:53:05 dns-slave-6.nesc.nokia.net pdns_server[96128]: XFR-in zone: 'nesc-test.dyn.nesc.nokia.net', primary: '10.129.189.23', starting AXFR
Dec 13 07:53:05 dns-slave-6.nesc.nokia.net pdns_server[96128]: AXFR-in zone 'nesc-test.dyn.nesc.nokia.net', primary '10.129.189.23', retrieval started
Dec 13 07:53:05 dns-slave-6.nesc.nokia.net pdns_server[96128]: AXFR-in zone: 'nesc-test.dyn.nesc.nokia.net', primary: '10.129.189.23', retrieval finished
Dec 13 07:53:05 dns-slave-6.nesc.nokia.net pdns_server[96128]: AXFR-in zone: 'nesc-test.dyn.nesc.nokia.net', primary: '10.129.189.23', storage transaction started
Dec 13 07:53:05 dns-slave-6.nesc.nokia.net pdns_server[96128]: AXFR-in zone: 'nesc-test.dyn.nesc.nokia.net', primary: '10.129.189.23', zone committed with serial 2024151150
Dec 13 07:54:05 dns-slave-6.nesc.nokia.net pdns_server[96128]: No new unfresh slave domains, 0 queued for AXFR already, 0 in progress
```

**tcpdump from the slave**
```
[root@dns-slave-6 ~]# tcpdump port 53 and host 10.129.189.23
dropped privs to tcpdump
tcpdump: verbose output suppressed, use -v[v]... for full protocol decode
listening on ens3, link-type EN10MB (Ethernet), snapshot length 262144 bytes
07:53:04.896432 IP dyndns-master-1.nesc.nokia.net.19914 > dns-slave-6.nesc.nokia.net.domain: 17306 notify [b2&3=0x2400] SOA? nesc-test.dyn.nesc.nokia.net. (46)
07:53:04.897809 IP dns-slave-6.nesc.nokia.net.domain > dyndns-master-1.nesc.nokia.net.19914: 17306 notify*- 0/0/0 (46)
07:53:05.767753 IP dns-slave-6.nesc.nokia.net.16765 > dyndns-master-1.nesc.nokia.net.domain: 44286 SOA? nesc-test.dyn.nesc.nokia.net. (46)
07:53:05.768016 IP dyndns-master-1.nesc.nokia.net.domain > dns-slave-6.nesc.nokia.net.16765: 44286*- 1/0/0 SOA (117)
07:53:05.772638 IP dns-slave-6.nesc.nokia.net.45961 > dyndns-master-1.nesc.nokia.net.domain: Flags [S], seq 1182683708, win 32120, options [mss 1460,sackOK,TS val 1193012700 ecr 0,nop,wscale 7], length 0
07:53:05.772880 IP dyndns-master-1.nesc.nokia.net.domain > dns-slave-6.nesc.nokia.net.45961: Flags [S.], seq 184707947, ack 1182683709, win 31856, options [mss 1460,sackOK,TS val 2229637619 ecr 1193012700,nop,wscale 7], length 0
07:53:05.772914 IP dns-slave-6.nesc.nokia.net.45961 > dyndns-master-1.nesc.nokia.net.domain: Flags [.], ack 1, win 251, options [nop,nop,TS val 1193012701 ecr 2229637619], length 0
07:53:05.772941 IP dns-slave-6.nesc.nokia.net.45961 > dyndns-master-1.nesc.nokia.net.domain: Flags [P.], seq 1:49, ack 1, win 251, options [nop,nop,TS val 1193012701 ecr 2229637619], length 48 27084 AXFR? nesc-test.dyn.nesc.nokia.net. (46)
07:53:05.773094 IP dyndns-master-1.nesc.nokia.net.domain > dns-slave-6.nesc.nokia.net.45961: Flags [.], ack 49, win 249, options [nop,nop,TS val 2229637620 ecr 1193012701], length 0
07:53:05.775721 IP dyndns-master-1.nesc.nokia.net.domain > dns-slave-6.nesc.nokia.net.45961: Flags [P.], seq 1:120, ack 49, win 249, options [nop,nop,TS val 2229637622 ecr 1193012701], length 119 27084*- 1/0/0 SOA (117)
07:53:05.775750 IP dns-slave-6.nesc.nokia.net.45961 > dyndns-master-1.nesc.nokia.net.domain: Flags [.], ack 120, win 251, options [nop,nop,TS val 1193012703 ecr 2229637622], length 0
07:53:05.776269 IP dyndns-master-1.nesc.nokia.net.domain > dns-slave-6.nesc.nokia.net.45961: Flags [P.], seq 120:503, ack 49, win 249, options [nop,nop,TS val 2229637623 ecr 1193012703], length 383 27084*- 9/0/0 A 127.0.1.87, HINFO, NS bh-dc-dns-slave.nesc.nokia.net., NS ch-dc-dns-slave.nesc.nokia.net., NS dns-slave-6.nesc.nokia.net., NS es-si-z4-dns-slave.nesc.nokia.net., NS he-pi-dns-slave.nesc.nokia.net., NS hz-dc-dns-slave.nesc.nokia.net., TXT "ralf.1.mueller@nokia.com" (381)
07:53:05.776296 IP dns-slave-6.nesc.nokia.net.45961 > dyndns-master-1.nesc.nokia.net.domain: Flags [.], ack 503, win 249, options [nop,nop,TS val 1193012704 ecr 2229637623], length 0
07:53:05.776443 IP dyndns-master-1.nesc.nokia.net.domain > dns-slave-6.nesc.nokia.net.45961: Flags [P.], seq 503:622, ack 49, win 249, options [nop,nop,TS val 2229637623 ecr 1193012704], length 119 27084*- 1/0/0 SOA (117)
07:53:05.776466 IP dns-slave-6.nesc.nokia.net.45961 > dyndns-master-1.nesc.nokia.net.domain: Flags [.], ack 622, win 249, options [nop,nop,TS val 1193012704 ecr 2229637623], length 0
07:53:05.776504 IP dns-slave-6.nesc.nokia.net.45961 > dyndns-master-1.nesc.nokia.net.domain: Flags [F.], seq 49, ack 622, win 249, options [nop,nop,TS val 1193012704 ecr 2229637623], length 0
07:53:05.776634 IP dyndns-master-1.nesc.nokia.net.domain > dns-slave-6.nesc.nokia.net.45961: Flags [F.], seq 622, ack 50, win 249, options [nop,nop,TS val 2229637623 ecr 1193012704], length 0
07:53:05.776650 IP dns-slave-6.nesc.nokia.net.45961 > dyndns-master-1.nesc.nokia.net.domain: Flags [.], ack 623, win 249, options [nop,nop,TS val 1193012704 ecr 2229637623], length 0
```

**tcpdump from the master**
```
root@dyndns-master-1 ~]# tcpdump port 53 and host 10.129.189.51
dropped privs to tcpdump
tcpdump: verbose output suppressed, use -v[v]... for full protocol decode
listening on eth0, link-type EN10MB (Ethernet), snapshot length 262144 bytes
07:53:04.896301 IP dyndns-master-1.nesc.nokia.net.19914 > dns-slave-6.nesc.nokia.net.domain: 17306 notify [b2&3=0x2400] SOA? nesc-test.dyn.nesc.nokia.net. (46)
07:53:04.898109 IP dns-slave-6.nesc.nokia.net.domain > dyndns-master-1.nesc.nokia.net.19914: 17306 notify*- 0/0/0 (46)
07:53:05.767989 IP dns-slave-6.nesc.nokia.net.16765 > dyndns-master-1.nesc.nokia.net.domain: 44286 SOA? nesc-test.dyn.nesc.nokia.net. (46)
07:53:05.768084 IP dyndns-master-1.nesc.nokia.net.domain > dns-slave-6.nesc.nokia.net.16765: 44286*- 1/0/0 SOA (117)
07:53:05.772888 IP dns-slave-6.nesc.nokia.net.45961 > dyndns-master-1.nesc.nokia.net.domain: Flags [S], seq 1182683708, win 32120, options [mss 1460,sackOK,TS val 1193012700 ecr 0,nop,wscale 7], length 0
07:53:05.772949 IP dyndns-master-1.nesc.nokia.net.domain > dns-slave-6.nesc.nokia.net.45961: Flags [S.], seq 184707947, ack 1182683709, win 31856, options [mss 1460,sackOK,TS val 2229637619 ecr 1193012700,nop,wscale 7], length 0
07:53:05.773096 IP dns-slave-6.nesc.nokia.net.45961 > dyndns-master-1.nesc.nokia.net.domain: Flags [.], ack 1, win 251, options [nop,nop,TS val 1193012701 ecr 2229637619], length 0
07:53:05.773096 IP dns-slave-6.nesc.nokia.net.45961 > dyndns-master-1.nesc.nokia.net.domain: Flags [P.], seq 1:49, ack 1, win 251, options [nop,nop,TS val 1193012701 ecr 2229637619], length 48 27084 AXFR? nesc-test.dyn.nesc.nokia.net. (46)
07:53:05.773167 IP dyndns-master-1.nesc.nokia.net.domain > dns-slave-6.nesc.nokia.net.45961: Flags [.], ack 49, win 249, options [nop,nop,TS val 2229637620 ecr 1193012701], length 0
07:53:05.775740 IP dyndns-master-1.nesc.nokia.net.domain > dns-slave-6.nesc.nokia.net.45961: Flags [P.], seq 1:120, ack 49, win 249, options [nop,nop,TS val 2229637622 ecr 1193012701], length 119 27084*- 1/0/0 SOA (117)
07:53:05.775965 IP dns-slave-6.nesc.nokia.net.45961 > dyndns-master-1.nesc.nokia.net.domain: Flags [.], ack 120, win 251, options [nop,nop,TS val 1193012703 ecr 2229637622], length 0
07:53:05.776310 IP dyndns-master-1.nesc.nokia.net.domain > dns-slave-6.nesc.nokia.net.45961: Flags [P.], seq 120:503, ack 49, win 249, options [nop,nop,TS val 2229637623 ecr 1193012703], length 383 27084*- 9/0/0 A 127.0.1.87, HINFO, NS bh-dc-dns-slave.nesc.nokia.net., NS ch-dc-dns-slave.nesc.nokia.net., NS dns-slave-6.nesc.nokia.net., NS es-si-z4-dns-slave.nesc.nokia.net., NS he-pi-dns-slave.nesc.nokia.net., NS hz-dc-dns-slave.nesc.nokia.net., TXT "ralf.1.mueller@nokia.com" (381)
07:53:05.776488 IP dns-slave-6.nesc.nokia.net.45961 > dyndns-master-1.nesc.nokia.net.domain: Flags [.], ack 503, win 249, options [nop,nop,TS val 1193012704 ecr 2229637623], length 0
07:53:05.776514 IP dyndns-master-1.nesc.nokia.net.domain > dns-slave-6.nesc.nokia.net.45961: Flags [P.], seq 503:622, ack 49, win 249, options [nop,nop,TS val 2229637623 ecr 1193012704], length 119 27084*- 1/0/0 SOA (117)
07:53:05.776650 IP dns-slave-6.nesc.nokia.net.45961 > dyndns-master-1.nesc.nokia.net.domain: Flags [.], ack 622, win 249, options [nop,nop,TS val 1193012704 ecr 2229637623], length 0
07:53:05.776664 IP dns-slave-6.nesc.nokia.net.45961 > dyndns-master-1.nesc.nokia.net.domain: Flags [F.], seq 49, ack 622, win 249, options [nop,nop,TS val 1193012704 ecr 2229637623], length 0
07:53:05.776709 IP dyndns-master-1.nesc.nokia.net.domain > dns-slave-6.nesc.nokia.net.45961: Flags [F.], seq 622, ack 50, win 249, options [nop,nop,TS val 2229637623 ecr 1193012704], length 0
07:53:05.776819 IP dns-slave-6.nesc.nokia.net.45961 > dyndns-master-1.nesc.nokia.net.domain: Flags [.], ack 623, win 249, options [nop,nop,TS val 1193012704 ecr 2229637623], length 0

```

**Reply by Habbie** [reply]
can we see `pdnsutil show-zone nesc-test.dyn.nesc.nokia.net`  from the slave? (and perhaps the master too)

**Reply by ramuller** [reply]
Yes I can see the zone and it also comes back, if I delete it!
I have multiple supermaster for redundancy but only 1 active and I think that's the problem.

**Reply by Habbie** [reply]
That might explain that the failed case does not see a SOA query to the one master you were monitoring with tcpdump.

**Reply by ramuller** [reply]
Yep looks like that's the problem. Is there a way to stick the SOA request to the source of notification?

**Reply by Habbie** [reply]
no, we pick a random primary from the set

**Reply by ramuller** [reply]
From the master column in the domain table?
Do I understand that correct?

**Reply by Habbie** [reply]
yes
