### ISSUE TITLE
rec: Repetitive refetches to parent zones (occasionally)

### ISSUE THREAD

**Issue by mnordhoff** [PowerDNS/pdns#12078]
- Program: Recursor
 - Issue type: Bug report

### Short description
A couple times recently, I've seen Recursor trying to refetch nameservers(?), and sending somewhat repetitive queries of e.g. `example.net` `A`, and `ns1.example.net` `A` and `AAAA` queries to the root and `net` zone. It makes progress figuring out the delegations but seems to usually give up before actually sending `ns1.example.net` queries to the `example.net` nameservers.

I haven't noticed any real consequences, like `SERVFAIL`.

My only recent changes I can think of are upgrading Recursor and enabling serve-stale. (There shouldn't _be_ any stale responses -- and a cache dump doesn't show any -- but the feature is on.)

Similar to #11371.

### Environment
 - Operating system: Ubuntu 20.04 (amd64)
 - Software version: 4.9.0~alpha0+master.11.g054012aeb-1pdns.focal
 - Software source: PowerDNS repository

### Steps to reproduce
I don't know. Today, "`dig dnsflagday.net`" and "`dig dnsflagday.net aaaa`".

### Expected behaviour
Fewer, successful refetch queries, to the right zones, with QNAME minimisation. :-)

### Actual behaviour
`tcpdump` sample:

```
2022-10-07 21:06:04.801119 IP6 ::1.39726 > ::1.53: 43005+ [1au] A? dnsflagday.net. (55)
2022-10-07 21:06:04.808303 IP 45.79.214.107.29235 > 185.136.98.79.53: 58318 [1au] A? dnsflagday.net. (43)
2022-10-07 21:06:04.827210 IP 185.136.98.79.53 > 45.79.214.107.29235: 58318*- 0/4/1 (409)
2022-10-07 21:06:04.831269 IP6 ::1.53 > ::1.39726: 43005$ 0/1/1 (101)
2022-10-07 21:06:06.025160 IP6 ::1.52261 > ::1.53: 5215+ [1au] AAAA? dnsflagday.net. (55)
2022-10-07 21:06:06.025527 IP 45.79.214.107.17621 > 185.136.96.79.53: 22497 [1au] AAAA? dnsflagday.net. (43)
2022-10-07 21:06:06.044852 IP 185.136.96.79.53 > 45.79.214.107.17621: 22497*- 0/4/1 (409)
2022-10-07 21:06:06.045896 IP6 ::1.53 > ::1.52261: 5215$ 0/1/1 (101)
2022-10-07 21:06:06.047483 IP 45.79.214.107.64181 > 192.31.80.30.53: 18043 [1au] A? cloudns.net. (40)
2022-10-07 21:06:06.061905 IP 192.31.80.30.53 > 45.79.214.107.64181: 18043- 0/9/11 (903)
2022-10-07 21:06:06.063720 IP6 2600:3c02:e000:74::53c:1.34568 > 2001:500:2d::d.53: 21324 [1au] A? cloudns.net. (40)
2022-10-07 21:06:06.064372 IP6 2001:500:2d::d.53 > 2600:3c02:e000:74::53c:1.34568: 21324- 0/15/27 (1168)
2022-10-07 21:06:06.064940 IP 45.79.214.107.24975 > 192.203.230.10.53: 24002 [1au] A? cloudns.net. (40)
2022-10-07 21:06:06.065806 IP 192.203.230.10.53 > 45.79.214.107.24975: 24002- 0/15/27 (1168)
2022-10-07 21:06:06.066535 IP 45.79.214.107.37286 > 192.5.6.30.53: 13205 [1au] A? pns41.cloudns.net. (46)
2022-10-07 21:06:06.080943 IP 192.5.6.30.53 > 45.79.214.107.37286: 13205- 0/9/11 (909)
2022-10-07 21:06:06.082144 IP 45.79.214.107.11918 > 192.26.92.30.53: 1694 [1au] A? ns4.cloudns.net. (44)
2022-10-07 21:06:06.094988 IP 192.26.92.30.53 > 45.79.214.107.11918: 1694- 0/9/11 (903)
2022-10-07 21:06:06.096762 IP 45.79.214.107.65087 > 192.12.94.30.53: 46195 [1au] A? dns2.cloudns.net. (45)
2022-10-07 21:06:06.111147 IP 192.12.94.30.53 > 45.79.214.107.65087: 46195- 0/9/11 (903)
2022-10-07 21:06:06.112508 IP6 2600:3c02:e000:74::53c:1.26288 > 2001:502:8cc::30.53: 8086 [1au] A? pns4.cloudns.net. (45)
2022-10-07 21:06:06.129599 IP6 2001:502:8cc::30.53 > 2600:3c02:e000:74::53c:1.26288: 8086- 0/9/11 (903)
2022-10-07 21:06:06.130548 IP6 2600:3c02:e000:74::53c:1.3193 > 2001:500:a8::e.53: 4213 [1au] A? ns4.cloudns.net. (44)
2022-10-07 21:06:06.131499 IP6 2001:500:a8::e.53 > 2600:3c02:e000:74::53c:1.3193: 4213- 0/15/27 (1172)
2022-10-07 21:06:06.132095 IP6 2600:3c02:e000:74::53c:1.40618 > 2001:503:39c1::30.53: 40060 [1au] A? ns4.cloudns.net. (44)
2022-10-07 21:06:06.149689 IP6 2001:503:39c1::30.53 > 2600:3c02:e000:74::53c:1.40618: 40060- 0/9/11 (903)
2022-10-07 21:06:06.151235 IP 45.79.214.107.53421 > 192.5.5.241.53: 49443 [1au] A? dns2.cloudns.net. (45)
2022-10-07 21:06:06.152014 IP 192.5.5.241.53 > 45.79.214.107.53421: 49443- 0/15/27 (1173)
2022-10-07 21:06:06.152934 IP 45.79.214.107.15712 > 192.35.51.30.53: 714 [1au] A? dns2.cloudns.net. (45)
2022-10-07 21:06:06.170053 IP 192.35.51.30.53 > 45.79.214.107.15712: 714- 0/9/11 (903)
...
```

### Other information
More tcpdump, configuration: https://gist.github.com/mnordhoff/c30a38a7d747b500c77d55813bdc18ad

**Comment by KiranPatil30** [comment]
Hello Sir , Can You Assign This Issue to Me?

**Comment by kpfleming** [comment]
GitHub only allows issues to be assigned to people who are 'developers' or 'maintainers' in the repository where the issue lives.

**Comment by omoerbeek** [comment]
A question: do you observe the `qname-min-fallback-success` metric increasing when this happens?

**Comment by omoerbeek** [comment]
Wondering if this is another instance of #12090 ... If so, it should be fixed in master

**Comment by omoerbeek** [comment]
I *think * this is a trace of the case. I am running with a small max ttl.
[fail1.txt](https://github.com/PowerDNS/pdns/files/9870279/fail1.txt)

**Comment by omoerbeek** [comment]
Below is the interesting part. It looks like the net -> cloudns.net delegation does not end up in the cache for some reason.
```
Oct 26 16:02:22  cloudns.net: Trying IP 192.55.83.30:53, asking 'cloudns.net|A'
Oct 26 16:02:22  cloudns.net: Got 20 answers from m.gtld-servers.net (192.55.83.30), rcode=0 (No Error), aa=0, in 6ms
Oct 26 16:02:22  cloudns.net: accept answer 'cloudns.net|NS|ns4.cloudns.net.' from 'net' nameservers? ttl=30, place=2 YES!
Oct 26 16:02:22  cloudns.net: accept answer 'cloudns.net|NS|pns1.cloudns.net.' from 'net' nameservers? ttl=30, place=2 YES!
Oct 26 16:02:22  cloudns.net: accept answer 'cloudns.net|NS|pns4.cloudns.net.' from 'net' nameservers? ttl=30, place=2 YES!
Oct 26 16:02:22  cloudns.net: accept answer 'cloudns.net|NS|dns2.cloudns.net.' from 'net' nameservers? ttl=30, place=2 YES!
Oct 26 16:02:22  cloudns.net: accept answer 'cloudns.net|NS|dns7.cloudns.net.' from 'net' nameservers? ttl=30, place=2 YES!
Oct 26 16:02:22  cloudns.net: accept answer 'A1RT98BS5QGC9NFI51S9HCI47ULJG6JH.net|NSEC3|1 1 0 - A1RTLNPGULOGN7B9A62SHJE1U3TTP8DR NS SOA RRSIG DNSKEY NSEC3PARAM' from 'net' nameservers? ttl=30, place=2 YES!
Oct 26 16:02:22  cloudns.net: accept answer 'A1RT98BS5QGC9NFI51S9HCI47ULJG6JH.net|RRSIG|NSEC3 8 2 86400 20221030061831 20221023050831 57635 net. J47t7MjWkHrhH77vzcOZmhnm3bbKlMf8sNMBfLVaNkEn1cu24Rtam2tLo11xMuix/5pwjYqYala9CdGf2vtTZFa26vzZJB1yuaTOEPBctx1cEmTqKXjMx+9Z/vEaqhP5H+VllFwAPIKjgIRSTRVkLPHMiIldb6mPhx5yn71YrGq9MEomYx5cZSwy54wFsZ+Kaz8xahJMumHnw64Sgpd0qA==' from 'net' nameservers? ttl=30, place=2 RRSIG - separate
Oct 26 16:02:22  cloudns.net: accept answer '3Q7Q1564M3CNRJ2PVUKCIN9ETVQ01V3N.net|NSEC3|1 1 0 - 3Q829NV8G17FAEDG22HF4E09NOVJFRRG NS DS RRSIG' from 'net' nameservers? ttl=30, place=2 YES!
Oct 26 16:02:22  cloudns.net: accept answer '3Q7Q1564M3CNRJ2PVUKCIN9ETVQ01V3N.net|RRSIG|NSEC3 8 2 86400 20221102062635 20221026051635 57635 net. SAoxV3wgJTZaGpl6Bi/sxuxdD7NuvSqBzEKuaPpbpEP3ptaemFwYcAGzl6qHesk8ap32kFpZ1BSEB/3HJ5p55I132Dr3rhp74wuJtA2w4tAZ42q/0I34/V14NGSEkAdThE4EmFxCVJeZZx3RlAOYdq0cmOb8drH6q5XHCGQQHj+tf3ik6HS79roBGCC/1R1sWBE9NtJ/Q2UGZ5Z4ieXhuQ==' from 'net' nameservers? ttl=30, place=2 RRSIG - separate
Oct 26 16:02:22  cloudns.net: accept answer 'ns4.cloudns.net|AAAA|2a00:c98:2030:a00f:1::1' from 'net' nameservers? ttl=30, place=3 YES!
Oct 26 16:02:22  cloudns.net: accept answer 'ns4.cloudns.net|A|46.165.223.182' from 'net' nameservers? ttl=30, place=3 YES!
Oct 26 16:02:22  cloudns.net: accept answer 'pns1.cloudns.net|A|185.136.96.111' from 'net' nameservers? ttl=30, place=3 YES!
Oct 26 16:02:22  cloudns.net: accept answer 'pns1.cloudns.net|AAAA|2a06:fb00:1::1:111' from 'net' nameservers? ttl=30, place=3 YES!
Oct 26 16:02:22  cloudns.net: accept answer 'pns4.cloudns.net|A|185.136.99.111' from 'net' nameservers? ttl=30, place=3 YES!
Oct 26 16:02:22  cloudns.net: accept answer 'pns4.cloudns.net|AAAA|2a06:fb00:1::4:111' from 'net' nameservers? ttl=30, place=3 YES!
Oct 26 16:02:22  cloudns.net: accept answer 'dns2.cloudns.net|A|185.136.97.77' from 'net' nameservers? ttl=30, place=3 YES!
Oct 26 16:02:22  cloudns.net: accept answer 'dns2.cloudns.net|AAAA|2a06:fb00:1::2:77' from 'net' nameservers? ttl=30, place=3 YES!
Oct 26 16:02:22  cloudns.net: accept answer 'dns7.cloudns.net|A|185.136.98.88' from 'net' nameservers? ttl=30, place=3 YES!
Oct 26 16:02:22  cloudns.net: accept answer 'dns7.cloudns.net|AAAA|2a06:fb00:1::3:88' from 'net' nameservers? ttl=30, place=3 YES!
Oct 26 16:02:22  cloudns.net: OPT answer '.' from 'net' nameservers
Oct 26 16:02:22  cloudns.net: determining status after receiving this packet
Oct 26 16:02:22  cloudns.net: got NS record 'cloudns.net' -> 'ns4.cloudns.net.'
Oct 26 16:02:22  cloudns.net: got NS record 'cloudns.net' -> 'pns1.cloudns.net.'
Oct 26 16:02:22  cloudns.net: got NS record 'cloudns.net' -> 'pns4.cloudns.net.'
Oct 26 16:02:22  cloudns.net: got NS record 'cloudns.net' -> 'dns2.cloudns.net.'
Oct 26 16:02:22  cloudns.net: got NS record 'cloudns.net' -> 'dns7.cloudns.net.'
Oct 26 16:02:22  cloudns.net: status=did not resolve, got 5 NS, looping to them
Oct 26 16:02:22  QM pns42.cloudns.net.|A child=cloudns.net: Step4 Resolve A result is No Error/0/2
Oct 26 16:02:22  QM pns42.cloudns.net.|A child=cloudns.net: Delegation seen, continue at step 1
Oct 26 16:02:22  pns42.cloudns.net: Checking if we have NS in cache for 'pns42.cloudns.net'
Oct 26 16:02:22  pns42.cloudns.net: no valid/useful NS in cache for 'pns42.cloudns.net'
Oct 26 16:02:22  pns42.cloudns.net: Checking if we have NS in cache for 'cloudns.net'
Oct 26 16:02:22  pns42.cloudns.net: no valid/useful NS in cache for 'cloudns.net'
```

**Comment by omoerbeek** [comment]
It's the first few lines in `MemRecursorCache::CacheEntry::shouldReplace`, which decides that in some cases the cache will not be updated. The "new delegation seen" flag will get set, but in the meantime the entry expires.
There used to be a 5s margin in `SyncRe` that got removed. Likely it would prevent this case. I'll play with reinrucing that in the cache itself.

**Comment by omoerbeek** [comment]
What happens with `refresh-on-ttl-perc` active: the refresh task get triggered for NS records as well, even when asking for `auth=false` records. These refresh tasks always ask for authoritative data. So there are way more authoritative NS records in the cache, causing it to hit the first condition in `shouldReplace` more often. QM does the lookup in to steps: one to determine the best NS, and then it decides how to do the actual resolve itself, in between there is a chance for the NS record to expire.

So I think this does not happen if no nonauth records are in the cache, as the non-auth glue records seen will update the cache. My testing confirms that.

Even if I would modify the refresh tasks only trigger for auth lookups (which I think I should do), there remains the case of auth NS records in the cache inserted by a user querying for them.

So the 5s margin should probably be reintroduced anyway, as it mostly avoid the race berten the two-step QM approach.

**Comment by mnordhoff** [comment]
Thank you for the fix!

I don't have much to say here because I only saw the issue happen once recently.
