### ISSUE TITLE
Dnsdist tap multi-destination logging not working

### ISSUE THREAD

**Issue by PenelopeFudd** [PowerDNS/pdns#15951]
- [x] This is not a support question, I have read [about opensource](https://www.powerdns.com/opensource.html) and will send support questions to the IRC channel, [GitHub Discussions](https://github.com/PowerDNS/pdns/discussions/) or the mailing list.
- [x] I have read and understood the ['out in the open' support policy](https://blog.powerdns.com/2016/01/18/open-source-support-out-in-the-open/)

 - Program: dnsdist 
 - Issue type: Bug report

### Short description
I've configured dnstap logging, and the console appears to show that it's working, but tcpdump of the logging traffic shows the tcp connections are idle.

### Environment

 - Operating system: Ubuntu 22.04
 - Software version: dnsdist 0.0.HEAD.gcbb3fd1f8 (Lua 5.1.4 [LuaJIT 2.1.0-beta3])
 - Software source: compiled yourself

### Steps to reproduce

1.  Configuration file `/etc/dnsdist/dnsdist-backend1.conf`:
```
-- This configuration assumes that this is the only dnsdist running.
dohlocals=10
pdnsbackends=2
newservers=1
cache_on=true
infinite_mode=true
logging=25

-- Inbound regular DNS (TCP and UDP):
setLocal('0.0.0.0:53', {reusePort=true})
addLocal('[::]:53', {reusePort=true})

-- Let everyone access it:
setACL({'0.0.0.0/0','::/0'})

-- Readonly console for viewing throughput and status:
webserver("0.0.0.0:1081")
setWebserverConfig({password="elided", apiKey="extinguished", acl="0.0.0.0/0"})

-- Localhost control port:
controlSocket('127.0.0.1:1181')
setKey("extirpated")
setConsoleACL("0.0.0.0/0")
-- Run `dnsdist -c 127.0.0.1:1181 -C /etc/dnsdist/dnsdist-backend1.conf`
-- Type '?' to see available commands (long!)
-- Type 'showTCPStats()' to see the stats for backend tcp connections.
-- Type 'quit' to exit.

if dohlocals > 0 then
  for n=1,dohlocals do
    addDOHLocal('0.0.0.0:443', '/etc/dnsdist/dnsdist.pem', '/etc/dnsdist/dnsdist.key', nil, {
      reusePort=true,
      tcpFastOpenQueueSize=121393,
      releaseBuffers=false,
      ktls=true,
      internalPipeBufferSize=1048576,
      idleTimeout=3600
      })
    addDOHLocal('[::]:443', '/etc/dnsdist/dnsdist.pem', '/etc/dnsdist/dnsdist.key', nil, {
      reusePort=true,
      tcpFastOpenQueueSize=121393,
      releaseBuffers=false,
      ktls=true,
      internalPipeBufferSize=1048576,
      idleTimeout=3600
      })
  end
end

if pdnsbackends > 0 then
  for n=1,pdnsbackends do
    if newservers > 0 then
      for m=1,newservers do
        newServer({
          address="127.0.3."..n..":54",
          name="pdns@backend"..n,
          releaseBuffers=true,
          ktls=true,
          pool="pdns",
          useClientSubnet=false,
          checkInterval=120,
          tcpOnly=false,
          useProxyProtocol=true,
          disableZeroScope=true
        })
      end
    end
  end
end

setServerPolicy(leastOutstanding)
-- setServerPolicy(roundrobin)

-- --- LOGGING

-- Copied from https://github.com/dmachard/lua-dnsdist-config-examples/blob/main/logging_dnstap_extra.lua
-- Needs https://github.com/dmachard/go-dnscollector to receive
if logging then

  -- Assign a selector tag with a value from 0 to logging:
  local ffi_luathing = [[
    local ffi = require("ffi")
    return function(dq)
      ffi.C.dnsdist_ffi_dnsquestion_set_tag(dq, 'selector', tostring(ffi.C.dnsdist_ffi_dnsquestion_get_id(dq)%logging))
      return DNSAction.None
    end
  ]]
  local flt=string.gsub(ffi_luathing,"logging",logging)
  addAction(AllRule(), LuaFFIPerThreadAction(flt))

  -- Assign log streams for the ten selectors:
  for n=0,logging-1 do
    logport = 6000 + n + 1
    tap_logging = newFrameStreamTcpLogger("10.168.0.81:"..logport,
       {
       bufferHint=65536,
       flushTimeout=600,
       inputQueueSize=16384,
       outputQueueSize=1024,
       reopenInterval=0
       })
    addAction(                TagRule("selector",n), DnstapLogAction(        "dnsdist_server", tap_logging))
    addResponseAction(        TagRule("selector",n), DnstapLogResponseAction("dnsdist_server", tap_logging))
    addCacheHitResponseAction(TagRule("selector",n), DnstapLogResponseAction("dnsdist_server", tap_logging))
  end

end

--- CACHING
if cache_on then
  pc = newPacketCache(1000000, {maxTTL=86400, minTTL=0, temporaryFailureTTL=60, staleTTL=60, dontAge=infinite_mode, parseECS=true, parseResolverIP=true})
  getPool("pdns"):setCache(pc)
  setCacheCleaningPercentage(0)
end

addAction(AllRule(), PoolAction("pdns"))                                             
```
2. 
```
sudo tcpdump -n -i en01 host 10.168.0.65 and host 10.168.0.81
```
3. 
```
while true; do kdig +short +subnet=$(random-subnet.sh) TXT v1.pool +https @10.168.0.65
```

### Expected behaviour

I'd expect to see approximately the same number of tcp packets going to the log host as are being sent by kdig.

### Actual behaviour

```
16:21:05.030073 IP 10.168.0.81.6002 > 10.168.0.65.43152: Flags [.], ack 1, win 15267, options [nop,nop,TS val 864046008 ecr 3921968770], length 0
16:21:05.030075 IP 10.168.0.81.6012 > 10.168.0.65.54764: Flags [.], ack 1, win 16131, options [nop,nop,TS val 864046008 ecr 3921968770], length 0
16:21:05.030082 IP 10.168.0.81.6008 > 10.168.0.65.39420: Flags [.], ack 1, win 16372, options [nop,nop,TS val 864046008 ecr 3921968770], length 0
16:21:05.030088 IP 10.168.0.81.6015 > 10.168.0.65.58046: Flags [.], ack 1, win 15154, options [nop,nop,TS val 864046008 ecr 3921968770], length 0
16:21:05.030090 IP 10.168.0.81.6017 > 10.168.0.65.57870: Flags [.], ack 1, win 7950, options [nop,nop,TS val 864046008 ecr 3921968770], length 0
16:21:05.030091 IP 10.168.0.81.6014 > 10.168.0.65.58390: Flags [.], ack 1, win 15056, options [nop,nop,TS val 864046008 ecr 3921968770], length 0
16:21:05.030106 IP 10.168.0.81.6007 > 10.168.0.65.47962: Flags [.], ack 1, win 10123, options [nop,nop,TS val 864046008 ecr 3921968770], length 0
16:21:05.030104 IP 10.168.0.81.6010 > 10.168.0.65.47812: Flags [.], ack 1, win 15626, options [nop,nop,TS val 864046008 ecr 3921968770], length 0
16:21:05.030180 IP 10.168.0.81.6013 > 10.168.0.65.51530: Flags [.], ack 1, win 15100, options [nop,nop,TS val 864046008 ecr 3921968770], length 0
16:21:05.030184 IP 10.168.0.81.6009 > 10.168.0.65.45040: Flags [.], ack 1, win 13980, options [nop,nop,TS val 864046008 ecr 3921968770], length 0
16:21:05.030495 IP 10.168.0.65.43152 > 10.168.0.81.6002: Flags [.], ack 1, win 502, options [nop,nop,TS val 3921983874 ecr 863517232], length 0
16:21:05.030495 IP 10.168.0.65.47364 > 10.168.0.81.6020: Flags [.], ack 1, win 502, options [nop,nop,TS val 3921983874 ecr 863517216], length 0
16:21:05.030519 IP 10.168.0.65.58390 > 10.168.0.81.6014: Flags [.], ack 1, win 502, options [nop,nop,TS val 3921983874 ecr 863517225], length 0
16:21:05.030519 IP 10.168.0.65.58604 > 10.168.0.81.6023: Flags [.], ack 1, win 502, options [nop,nop,TS val 3921983874 ecr 863517218], length 0
16:21:05.030519 IP 10.168.0.65.47962 > 10.168.0.81.6007: Flags [.], ack 1, win 502, options [nop,nop,TS val 3921983874 ecr 863517234], length 0
16:21:05.030519 IP 10.168.0.65.44210 > 10.168.0.81.6022: Flags [.], ack 1, win 502, options [nop,nop,TS val 3921983874 ecr 863517228], length 0
16:21:05.030536 IP 10.168.0.65.39420 > 10.168.0.81.6008: Flags [.], ack 1, win 502, options [nop,nop,TS val 3921983874 ecr 863517227], length 0
16:21:05.030536 IP 10.168.0.65.58046 > 10.168.0.81.6015: Flags [.], ack 1, win 502, options [nop,nop,TS val 3921983874 ecr 863517231], length 0
16:21:05.030549 IP 10.168.0.65.47658 > 10.168.0.81.6018: Flags [.], ack 1, win 502, options [nop,nop,TS val 3921983874 ecr 863517229], length 0
16:21:05.030549 IP 10.168.0.65.57870 > 10.168.0.81.6017: Flags [.], ack 1, win 502, options [nop,nop,TS val 3921983874 ecr 863517228], length 0
16:21:05.030573 IP 10.168.0.65.37230 > 10.168.0.81.6024: Flags [.], ack 1, win 502, options [nop,nop,TS val 3921983874 ecr 863517224], length 0
16:21:05.030584 IP 10.168.0.65.59732 > 10.168.0.81.6004: Flags [.], ack 1, win 502, options [nop,nop,TS val 3921983874 ecr 863517217], length 0
16:21:05.030583 IP 10.168.0.65.54764 > 10.168.0.81.6012: Flags [.], ack 1, win 502, options [nop,nop,TS val 3921983874 ecr 863517226], length 0
16:21:05.030583 IP 10.168.0.65.45040 > 10.168.0.81.6009: Flags [.], ack 1, win 502, options [nop,nop,TS val 3921983874 ecr 863517225], length 0
16:21:05.030583 IP 10.168.0.65.51530 > 10.168.0.81.6013: Flags [.], ack 1, win 502, options [nop,nop,TS val 3921983874 ecr 863517222], length 0
16:21:05.030614 IP 10.168.0.65.47812 > 10.168.0.81.6010: Flags [.], ack 1, win 502, options [nop,nop,TS val 3921983874 ecr 863517219], length 0
16:21:06.822042 ARP, Request who-has 10.168.0.65 tell 10.168.0.81, length 28
16:21:06.822416 ARP, Reply 10.168.0.65 is-at 52:54:00:fc:9c:c0, length 42

```

### Other information

The dnsdist console appears to be saying that logging is occurring correctly:
<img width="1359" height="778" alt="Image" src="https://github.com/user-attachments/assets/ac597457-9e0c-401d-801e-6bd79745b34d" />

**Comment by PenelopeFudd** [comment]
We've made some changes, forking from 
```
10e42ba43 Merge pull request #15094 from mind04/auth49-backport-15093
```

**Comment by Habbie** [comment]
(as discussed on IRC) that is such a weird point to fork from that @PenelopeFudd is going to check a bit more first

**Comment by omoerbeek** [comment]
flushTimeout is quite long. I'd say: start with default values. That said, I did not look into anything in a detail.

**Comment by rgacogne** [comment]
I did some tests and I can confirm that:
- the values are always properly sent by dnsdist to the dnstap endpoint
- with the default settings it happens very quickly
- but with `flushTimeout=600` it can takes up to 1200s for the value to be sent
- testing with lower values for `flushTimeout`, it seems that the `fstrm` library flushes its buffer every 2*`flushTimeout` seconds, while I would have expected every `flushTimeout` seconds

So as far as I can tell there is no issue in DNSdist itself. I would follow Otto's suggestion and lower `flushTimeout`.

**Comment by edmonds** [comment]
> I did some tests and I can confirm that:
> 
>     * the values are always properly sent by dnsdist to the dnstap endpoint
> 
>     * with the default settings it happens very quickly
> 
>     * but with `flushTimeout=600` it can takes up to 1200s for the value to be sent
> 
>     * testing with lower values for `flushTimeout`, it seems that the `fstrm` library flushes its buffer every 2*`flushTimeout` seconds, while I would have expected every `flushTimeout` seconds
> 
> 
> So as far as I can tell there is no issue in DNSdist itself. I would follow Otto's suggestion and lower `flushTimeout`.

Hello, original author of `fstrm` here.

I do not immediately see a bug that would result in a flush exactly every 2*`flushTimeout` seconds, but I do see another bug in the flush timeout handling here:

https://github.com/farsightsec/fstrm/blob/1d6e11d750dfa8d15419814dfe0aa86d80000741/fstrm/iothr.c#L632-L639

```c
		pthread_mutex_lock(&iothr->cv_lock);
		res = pthread_cond_timedwait(&iothr->cv, &iothr->cv_lock, &ts);
		pthread_mutex_unlock(&iothr->cv_lock);

		if (res == ETIMEDOUT)
			fstrm__iothr_flush_output(iothr);
```

It looks like the timeout is only considered to be tripped if `pthread_cond_timedwait()` returns `ETIMEDOUT`, but if the condition variable was signaled, the return value would be success. And signaling of the condition variable happens in `fstrm_iothr_submit()` when the queue notify threshold is reached (default every 32 submissions). So if it's not flushing due to the flush timeout, flushes should be driven by the output queue limit being reached (1024 messages here), or the output buffer accumulating at least `bufferHint` bytes (64 KB here).

**Comment by rgacogne** [comment]
Thanks for looking into it! I had a quick look as well, and I think what is going on is:
-  my tests are not sending enough data to reach the `queue_notify_threshold` so I have to wait until `pthread_cond_timedwait()` to expire once (after `flushTimeout` seconds) so that `fstrm__iothr_process_queues` is called
- At this point we have data to send but `buffer_hint` is not reached, so we go back to sleep for `flushTimeout` seconds (since I'm no longer sending data at this point)
- after that `pthread_cond_timedwait()` returns  `ETIMEDOUT` and the data is sent

So I do have to wait 2 times `flushTimeout`, but only because I'm not sending a lot of data and trigger an unlucky path :)
