### ISSUE TITLE
rec: QNAME minimization isn't used to resolve nameservers

### ISSUE THREAD

**Issue by mnordhoff** [PowerDNS/pdns#13424]
- [x] This is not a support question, I have read [about opensource](https://www.powerdns.com/opensource.html) and will send support questions to the IRC channel, [Github Discussions](https://github.com/PowerDNS/pdns/discussions/) or the mailing list.
- [x] I have read and understood the ['out in the open' support policy](https://blog.powerdns.com/2016/01/18/open-source-support-out-in-the-open/)

 - Program: Recursor
 - Issue type: Bug report

### Short description
When QNAME minimization is enabled, it is used for normal queries (e.g. `www.example.net`) but does not seem to be used when resolving nameservers (e.g. `ns1.example.com`). Or at least sometimes.

I think this is a regression circa 2023-10-18, around when #13364 was merged, but I have not verified that. Maybe it was always like this and I never noticed.

Arguably this is not much of a problem, since nameservers are usually not very unique. (But sometimes they are.) Maybe it's intended behavior.

### Environment
 - Operating system: Ubuntu 20.04 amd64
 - Software version: 5.0.0\~alpha1+master.277.g9e905f9e8-1pdns.focal, 5.0.0\~alpha2+master.51.g4e41c4285-1pdns.focal
 - Software source: PowerDNS repository

### Steps to reproduce
1. Enable QNAME minimization
2. Restart Recursor, or `sudo rec_control wipe-cache 'com$'` and `sudo rec_control wipe-cache 'google.net$'`
3. `dig google.net`

### Expected behaviour
`com` QNAME minimization query sent to root nameservers (if you wiped the cache). `google.com` QNAME minimization query sent to `com` TLD nameservers.

### Actual behaviour
E.g. `ns1.google.com` query/queries sent instead.

```
2023-10-27 06:37:40.333176 IP6 ::1.39805 > ::1.53: 30774+ [1au] A? google.net. (51)
2023-10-27 06:37:40.341123 IP6 2600:3c02:e000:74::443:1.46933 > 2001:500:856e::30.53: 63044 [1au] A? google.net. (39)
2023-10-27 06:37:40.356963 IP6 2001:500:856e::30.53 > 2600:3c02:e000:74::443:1.46933: 63044- 0/8/1 (670)
2023-10-27 06:37:40.357951 IP6 2600:3c02:e000:74::443:1.28830 > 2001:503:c27::2:30.53: 3936 [1au] A? ns3.google.com. (43)
2023-10-27 06:37:40.372310 IP6 2001:503:c27::2:30.53 > 2600:3c02:e000:74::443:1.28830: 3936- 0/15/27 (1174)
2023-10-27 06:37:40.372585 IP 45.79.214.107.51261 > 192.12.94.30.53: 55184 [1au] A? ns3.google.com. (43)
2023-10-27 06:37:40.388784 IP 192.12.94.30.53 > 45.79.214.107.51261: 55184- 0/8/9 (836)
2023-10-27 06:37:40.389139 IP 45.79.214.107.26824 > 216.239.34.10.53: 59482 [1au] A? ns3.google.com. (43)
2023-10-27 06:37:40.393694 IP 216.239.34.10.53 > 45.79.214.107.26824: 59482*- 1/0/1 A 216.239.36.10 (59)
2023-10-27 06:37:40.393854 IP 45.79.214.107.63955 > 216.239.36.10.53: 27438 [1au] A? google.net. (39)
2023-10-27 06:37:40.395030 IP 216.239.36.10.53 > 45.79.214.107.63955: 27438*- 6/0/1 A 172.253.124.106, A 172.253.124.104, A 172.253.124.105, A 172.253.124.103, A 172.253.124.147, A 172.253.124.99 (135)
2023-10-27 06:37:40.395631 IP6 ::1.53 > ::1.39805: 30774 6/0/1 A 172.253.124.99, A 172.253.124.103, A 172.253.124.105, A 172.253.124.104, A 172.253.124.147, A 172.253.124.106 (135)
```

### Other information
```
$ sudo rg -vN '^(#|$)' /etc/powerdns/recursor.conf
aggressive-nsec-cache-size=10000
allow-from=100.64.0.0/10, 127.0.0.0/8, ::1/128, 2600:3c02::f03c:91ff:fe70:fd08/128, 2600:3c02::f03c:91ff:febc:a28b/128, 2600:3c02::f03c:92ff:fefd:f09a/128, 2600:3c02:e000:74::/64, 2600:3c02:e000:bc::/64, 2600:3c02:e001:1d00::/56, fd7a:115c:a1e0::/48
allow-trust-anchor-query
any-to-tcp
carbon-ourname=ultimate_mattnordhoff_net
carbon-server=2a02:2770:8::2635:0:1
config-dir=/etc/powerdns
dnssec=validate
dnssec-log-bogus
edns-padding-from=100.64.0.0/10, fd7a:115c:a1e0::/48
edns-padding-mode=always
extended-resolution-errors
forward-zones=76.100.in-addr.arpa=2600:3c02:e000:74::53a:1, 82.100.in-addr.arpa=2600:3c02:e000:74::53a:1, 83.100.in-addr.arpa=2600:3c02:e000:74::53a:1, 85.100.in-addr.arpa=2600:3c02:e000:74::53a:1, 98.100.in-addr.arpa=2600:3c02:e000:74::53a:1, 122.100.in-addr.arpa=2600:3c02:e000:74::53a:1, d.f.ip6.arpa=2600:3c02:e000:74::53a:1
hint-file=/usr/share/dns/root.hints
include-dir=/etc/powerdns/recursor.d
local-address=100.82.87.107, 127.0.0.1, ::1, 2600:3c02:e000:74::53c:0, fd7a:115c:a1e0:ab12:4843:cd96:6252:576b
log-common-errors
lua-config-file=/etc/powerdns/recursor.lua
max-cache-entries=100000
max-cache-ttl=172800
max-negative-ttl=10800
max-packetcache-entries=50000
non-local-bind
query-local-address=0.0.0.0, ::
quiet=yes
refresh-on-ttl-perc=10
serve-stale-extensions=5760
tcp-fast-open-connect
threads=1
udp-source-port-avoid=11211,41641
udp-truncation-threshold=1452
```
```
$ cat /etc/powerdns/recursor.lua
dofile("/usr/share/pdns-recursor/lua-config/rootkeys.lua")

addNTA("76.100.in-addr.arpa")
addNTA("82.100.in-addr.arpa")
addNTA("83.100.in-addr.arpa")
addNTA("85.100.in-addr.arpa")
addNTA("98.100.in-addr.arpa")
addNTA("122.100.in-addr.arpa")
addNTA("d.f.ip6.arpa")
```

**Comment by omoerbeek** [comment]
This was introduced deliberately in #13295

**Comment by mnordhoff** [comment]
Well heck. Okay.
