### ISSUE TITLE
No SOA on ALIAS record types - pdn recursor

### ISSUE THREAD

**Issue by gitshaw** [PowerDNS/pdns#4556]
Hopefully someone can help here - not sure if this is expected or not.

Im using pdns auth and rec. 

My pdns server is authoritative for the domain foo.mydomain.net and i am using the ALIAS record type to point to an external hostname on akamai. The problem im having is when i request an IPv6 record no SOA value is returned. 

```
dig foo.mydomain.net @localhost AAAA

; <<>> DiG 9.9.5-3ubuntu0.9-Ubuntu <<>> foo.mydomain.net @localhost AAAA
;; global options: +cmd
;; Got answer:
;; ->>HEADER<<- opcode: QUERY, status: NOERROR, id: 5163
;; flags: qr aa rd ra; QUERY: 1, ANSWER: 0, AUTHORITY: 0, ADDITIONAL: 1

;; OPT PSEUDOSECTION:
; EDNS: version: 0, flags:; udp: 1680
;; QUESTION SECTION:
;foo.mydomain.net.      IN      AAAA

;; Query time: 31 msec
;; SERVER: 127.0.0.1#53(127.0.0.1)
;; WHEN: Tue Oct 11 06:47:06 UTC 2016
;; MSG SIZE  rcvd: 53`
```

however you can see in the logs that the akamai SOA value is returned its just not passed through to the client requesting.

```
Oct 11 06:41:02 09d8cbc01d94 pdns_recursor[1981]: 2 [1/1] question for 'XXX.com.akadns.net|AAAA' from 172.17.0.3
Oct 11 06:41:02 09d8cbc01d94 pdns_recursor[1981]: [1] XXX.com.akadns.net: Wants NO DNSSEC processing in query for AAAA
Oct 11 06:41:02 09d8cbc01d94 pdns_recursor[1981]: [1] XXX.com.akadns.net: Looking for CNAME cache hit of 'XXX.com.akadns.net|CNAME'
Oct 11 06:41:02 09d8cbc01d94 pdns_recursor[1981]: [1] XXX.com.akadns.net: No CNAME cache hit of 'XXX.com.akadns.net|CNAME' found
Oct 11 06:41:02 09d8cbc01d94 pdns_recursor[1981]: [1] XXX.com.akadns.net: No cache hit for 'XXX.com.akadns.net|AAAA', trying to find an appropriate NS record
Oct 11 06:41:02 09d8cbc01d94 pdns_recursor[1981]: [1] XXX.com.akadns.net: Cache consultations done, have 1 NS to contact
Oct 11 06:41:02 09d8cbc01d94 pdns_recursor[1981]: [1] XXX.com.akadns.net.: Nameservers: <empty>(7.50ms)
Oct 11 06:41:02 09d8cbc01d94 pdns_recursor[1981]: [1] XXX.com.akadns.net: Domain has hardcoded nameservers
Oct 11 06:41:02 09d8cbc01d94 pdns_recursor[1981]: [1] XXX.com.akadns.net: Resolved '.' NS (empty) to: 10.88.0.1, 10.88.0.2
Oct 11 06:41:02 09d8cbc01d94 pdns_recursor[1981]: [1] XXX.com.akadns.net: Trying IP 10.88.0.1:53, asking 'XXX.com.akadns.net|AAAA'
Oct 11 06:41:02 09d8cbc01d94 pdns_recursor[1981]: [1] XXX.com.akadns.net: Got 2 answers from (empty) (10.88.0.1), rcode=0 (No Error), aa=0, in 21ms
Oct 11 06:41:02 09d8cbc01d94 pdns_recursor[1981]: [1] XXX.com.akadns.net: accept answer 'akadns.net|SOA|internal.akadns.net. hostmaster.akamai.com. 1476167936 90000 90000 90000 180' from '.' nameservers? 2 YES! - This answer was received from a server we forward to.
Oct 11 06:41:02 09d8cbc01d94 pdns_recursor[1981]: [1] XXX.com.akadns.net: OPT answer '.' from '.' nameservers
Oct 11 06:41:02 09d8cbc01d94 pdns_recursor[1981]: [1] XXX.com.akadns.net: determining status after receiving this packet
Oct 11 06:41:02 09d8cbc01d94 pdns_recursor[1981]: [1] XXX.com.akadns.net: got negative caching indication for 'XXX.com.akadns.net|AAAA'
Oct 11 06:41:02 09d8cbc01d94 pdns_recursor[1981]: [1] XXX.com.akadns.net: status=noerror, other types may exist, but we are done (have negative SOA) 
Oct 11 06:41:02 09d8cbc01d94 pdns_recursor[1981]: 2 [1/1] answer to question 'XXX.com.akadns.net|AAAA': 0 answers, 0 additional, took 1 packets, 21.317 ms, 0 throttled, 0 timeouts, 0 tcp connections, rcode=0
```

If i request a record that passes straight through the recursor then there are no problems - the SOA is returned.

```
dig github.com @localhost AAAA

; <<>> DiG 9.9.5-3ubuntu0.9-Ubuntu <<>> github.com @localhost AAAA
;; global options: +cmd
;; Got answer:
;; ->>HEADER<<- opcode: QUERY, status: NOERROR, id: 19653
;; flags: qr rd ra; QUERY: 1, ANSWER: 0, AUTHORITY: 1, ADDITIONAL: 1

;; OPT PSEUDOSECTION:
; EDNS: version: 0, flags:; udp: 4096
;; QUESTION SECTION:
;github.com.                    IN      AAAA

;; AUTHORITY SECTION:
github.com.             30      IN      SOA     ns1.p16.dynect.net. hostmaster.github.com. 1474079943 3600 600 604800 60

;; Query time: 18 msec
;; SERVER: 127.0.0.1#53(127.0.0.1)
;; WHEN: Tue Oct 11 06:52:34 UTC 2016
;; MSG SIZE  rcvd: 104
```

This only happens when using the ALIAS record type, other records are fine.

thanks.

**Comment by Habbie** [comment]
Can you please updated your pastes to be unedited? Thanks!

**Comment by gitshaw** [comment]
Code updated using exact info from the logs - thanks

**Comment by gitshaw** [comment]
I have a packet capture showing the request flow:

```
15:57:41.918328 IP 172.17.0.1.36136 > 172.17.0.3.53: 20770+ [1au] AAAA? stg2.oogway.mydomain.net. (53)
        0x0000:  0242 ac11 0003 0242 540e 2767 0800 4500  .B.....BT.'g..E.
        0x0010:  0051 95e8 0000 4011 8c8d ac11 0001 ac11  .Q....@.........
        0x0020:  0003 8d28 0035 003d 5875 5122 0120 0001  ...(.5.=XuQ"....
        0x0030:  0000 0000 0001 0473 7467 3206 6f6f 6777  .......stg2.oogw
        0x0040:  6179 086d 7964 6f6d 6169 6e03 6e65 7400  ay.mydomain.net.
        0x0050:  001c 0001 0000 2910 0000 0000 0000 00    ......)........
15:57:41.920076 IP 172.17.0.3.22054 > 10.88.16.1.53: 16043+ [1au] AAAA? stg1.oogway.jpsnetworks.net. (56)
        0x0000:  0242 540e 2767 0242 ac11 0003 0800 4500  .BT.'g.B......E.
        0x0010:  0054 6b35 4000 4011 08f7 ac11 0003 0a58  .Tk5@.@........X
        0x0020:  1001 5626 0035 0040 c6be 3eab 0100 0001  ..V&.5.@..>.....
        0x0030:  0000 0000 0001 0473 7467 3106 6f6f 6777  .......stg1.oogw
        0x0040:  6179 0b6a 7073 6e65 7477 6f72 6b73 036e  ay.jpsnetworks.n
        0x0050:  6574 0000 1c00 0100 0029 0690 0000 0000  et.......)......
        0x0060:  0000                                     ..
15:57:41.945938 IP 10.88.16.1.53 > 172.17.0.3.22054: 16043 0/1/1 (116)
        0x0000:  0242 ac11 0003 0242 540e 2767 0800 4500  .B.....BT.'g..E.
        0x0010:  0090 a9b9 0000 3f11 0b37 0a58 1001 ac11  ......?..7.X....
        0x0020:  0003 0035 5626 007c d8d9 3eab 8180 0001  ...5V&.|..>.....
        0x0030:  0000 0001 0001 0473 7467 3106 6f6f 6777  .......stg1.oogw
        0x0040:  6179 0b6a 7073 6e65 7477 6f72 6b73 036e  ay.jpsnetworks.n
        0x0050:  6574 0000 1c00 01c0 1800 0600 0100 0000  et..............
        0x0060:  b400 3004 6e73 3130 0b64 6e73 6d61 6465  ..0.ns10.dnsmade
        0x0070:  6561 7379 0363 6f6d 0003 646e 73c0 3e77  easy.com..dns.>w
        0x0080:  bf0f f000 00a8 c000 000e 1000 1275 0000  .............u..
        0x0090:  0000 b400 0029 0fa0 0000 0000 0000       .....)........
15:57:41.946615 IP 172.17.0.3.53 > 172.17.0.1.36136: 20770* 0/0/1 (53)
        0x0000:  0242 540e 2767 0242 ac11 0003 0800 4500  .BT.'g.B......E.
        0x0010:  0051 773f 4000 4011 6b36 ac11 0003 ac11  .Qw?@.@.k6......
        0x0020:  0001 0035 8d28 003d 5875 5122 8580 0001  ...5.(.=XuQ"....
        0x0030:  0000 0000 0001 0473 7467 3206 6f6f 6777  .......stg2.oogw
        0x0040:  6179 086d 7964 6f6d 6169 6e03 6e65 7400  ay.mydomain.net.
        0x0050:  001c 0001 0000 2906 9000 0000 0000 00    ......)........
```

15:57:41.945938 IP 10.88.16.1.53 > 172.17.0.3.22054 gets a correct NOERROR response as there are no AAAA records and also i can see the SOA but this never reaches the client.

**Comment by gitshaw** [comment]
Hay guys - just wondering if anyone had any thoughts on this - or if i can provide any further information.

**Comment by Habbie** [comment]
@gitshaw your information looks complete! We'll try to look into it as soon as possible.

**Comment by Habbie** [comment]
@gitshaw on second though - can you show the issue -without- the recursor in the picture?

**Comment by gitshaw** [comment]
Hi,

Ive commented out any recursor options in my pdns config

```
~# cat pdns.conf

allow-axfr-ips=127.0.0.1

distributor-threads=1

local-address=0.0.0.0
local-port=53

local-ipv6=

#
logging-facility=0
log-dns-details=yes
log-dns-queries=yes
loglevel=9

query-logging=yes

cache-ttl=0
#recursive-cache-ttl=10
#recursor=172.17.0.3:8699
#recursor=8.8.8.8
#
setgid=pdns
setuid=pdns
#
master=yes
slave=no
#
socket-dir=/var/run

version-string=powerdns

launch=bind
bind-config=/usr/local/etc/bindbackend.conf
```

my zone file as per below:

```
;
; Zone file for oogway.mydomain.net
;
;
oogway.mydomain.net. 84600      IN      SOA     ns1.oogway.mydomain.net.      postmaster.oogway.mydomain.net. (
                        2016101404      ; Serial Number (date YYYYMMDD++)
                        86400           ; Refresh (24 hours)
                        1800            ; Retry (1/2 hour)
                        3600000         ; Expire (42 days)
                        21600)          ; Minimum (6 hours)
                        IN      NS      ns1.oogway.mydomain.net.

@                       IN      A       192.168.0.1

ns1                     IN      A       172.17.0.4
stg1                    IN      ALIAS   stg1.oogway.jpsnetworks.net.
```

The output is what i would expect to see if there are no IPv6 records = NOERROR + SOA - obviously this is not resolving the ALIAS anymore.

```
root@6f7542676c2a:/usr/local/etc# dig stg1.oogway.mydomain.net @172.17.0.2 AAAA

; <<>> DiG 9.9.5-9+deb8u7-Debian <<>> stg1.oogway.mydomain.net @172.17.0.2 AAAA
;; global options: +cmd
;; Got answer:
;; ->>HEADER<<- opcode: QUERY, status: NOERROR, id: 4683
;; flags: qr aa rd; QUERY: 1, ANSWER: 0, AUTHORITY: 1, ADDITIONAL: 1
;; WARNING: recursion requested but not available

;; OPT PSEUDOSECTION:
; EDNS: version: 0, flags:; udp: 1680
;; QUESTION SECTION:
;stg1.oogway.mydomain.net.      IN      AAAA

;; AUTHORITY SECTION:
oogway.mydomain.net.    21600   IN      SOA     ns1.oogway.mydomain.net. postmaster.oogway.mydomain.net. 2016101404 86400 1800 3600000 21600

;; Query time: 2 msec
;; SERVER: 172.17.0.2#53(172.17.0.2)
;; WHEN: Sun Oct 16 09:48:04 UTC 2016
;; MSG SIZE  rcvd: 104
```

If i set the recursor to google dns i get the same as using pdns recursor: NOERROR but no SOA.

```
root@6f7542676c2a:/usr/local/etc# dig stg1.oogway.mydomain.net @172.17.0.2 AAAA

; <<>> DiG 9.9.5-9+deb8u7-Debian <<>> stg1.oogway.mydomain.net @172.17.0.2 AAAA
;; global options: +cmd
;; Got answer:
;; ->>HEADER<<- opcode: QUERY, status: NOERROR, id: 52713
;; flags: qr aa rd ra; QUERY: 1, ANSWER: 0, AUTHORITY: 0, ADDITIONAL: 1

;; OPT PSEUDOSECTION:
; EDNS: version: 0, flags:; udp: 1680
;; QUESTION SECTION:
;stg1.oogway.mydomain.net.      IN      AAAA

;; Query time: 724 msec
;; SERVER: 172.17.0.2#53(172.17.0.2)
;; WHEN: Sun Oct 16 09:49:34 UTC 2016
;; MSG SIZE  rcvd: 53
```

**Comment by Habbie** [comment]
I'm sorry - I forgot ALIAS needs a recursor. Your recursor logs are indeed about the 'backend' queries. In that case no further information should be necessary. We will investigate soon. Thanks!

**Comment by gitshaw** [comment]
Thanks very much - appreciate your help.

**Comment by tonysimpson** [comment]
I've made a pull request to fix this, #4588, I'd appreciate someone having a look,

**Comment by taam** [comment]
The missing SOA record prevents proper NODATA caching, which can lead to an excessive amount of DNS queries. Also, such broken caching can also have a very negative performance impact e.g. for websites. From the (first) ANAME draft:

> If the query was for a specific address type, then the response MUST also include the SOA as in a normal NODATA response, [...]

(Just want to make clear, _why_ this is so bad, as it was not mentioned here before explicitly.)

Also I think the title of this issue is somewhat misleading, as this has nothing to do with the recursor, right?

**Comment by Habbie** [comment]
Title fixed, thanks!

**Comment by taam** [comment]
Another issue with the missing SOA record seems to be in combination with DNSSEC validation, even for domains, which are not DNSSEC enabled. Some implementations apparently do not care, but e.g. dnsmasq with DNSSEC validation enabled then gives `SERVFAIL` instead of `NOERROR`, making things even more messy. Also https://dnsviz.net/ shows an error for such NODATA responses.

**Comment by webprofusion-chrisc** [comment]
Hi, does this affect only particular queries or would it also account for no SOA being returned during a CAA query (when there is no CAA record)?

There's stuff going on with Let's Encrypt CAA validation using unbound 1.18 currently and PowerDNS may or may not be affected (anecdotally it is, but it could be an older version): https://community.letsencrypt.org/t/caa-requests-resulting-in-servfail-since-dec-12th/210334/19 - apparently this is due to non-conformance with RFC2308 regarding NODATA responses.

**Comment by Habbie** [comment]
> Hi, does this affect only particular queries or would it also account for no SOA being returned during a CAA query (when there is no CAA record)?

Only for ALIAS. If you can take your LE problem to [Discussions](https://github.com/PowerDNS/pdns/discussions/) we're happy to have a look at it.

**Comment by webprofusion-chrisc** [comment]
@Habbie thanks, created https://github.com/PowerDNS/pdns/discussions/13657
