### ISSUE TITLE
dnsdist: YAML: BackendConfiguration `source` field is ignored

### ISSUE THREAD

**Issue by edmonds** [PowerDNS/pdns#15810]
- [X] This is not a support question, I have read [about opensource](https://www.powerdns.com/opensource.html) and will send support questions to the IRC channel, [GitHub Discussions](https://github.com/PowerDNS/pdns/discussions/) or the mailing list.
- [X] I have read and understood the ['out in the open' support policy](https://blog.powerdns.com/2016/01/18/open-source-support-out-in-the-open/)

 - Program: dnsdist
 - Issue type: Bug report

### Short description

When using YAML to configure a backend, the `source` parameter is ignored and instead the kernel's address selection is used.

### Environment
 - Operating system: Ubuntu 24.04.2 LTS (Noble Numbat)
 - Software version: dnsdist tag `dnsdist-2.0.0-rc1`

### Steps to reproduce

1. Configure a backend like:
```yaml
backends:
  - address: "127.253.253.253:53001"
    source: "127.153.153.153"
    protocol: "Do53"
```
2. Start tcpdump on `lo` for port 53001 traffic.
3. Start dnsdist.

### Expected behaviour

Traffic sent to the backend should use the configured source address.

### Actual behaviour

Traffic sent to the backend originated from 127.0.0.1, not the configured `source` in the dnsdist config.

```
10:52:13.593413 IP 127.0.0.1.56161 > 127.253.253.253.53001: UDP, length 70
10:52:15.595305 IP 127.0.0.1.42897 > 127.253.253.253.53001: UDP, length 70
10:52:17.597107 IP 127.0.0.1.55457 > 127.253.253.253.53001: UDP, length 70
10:52:21.598376 IP 127.0.0.1.38522 > 127.253.253.253.53001: UDP, length 70
10:52:29.598708 IP 127.0.0.1.35897 > 127.253.253.253.53001: UDP, length 70
10:54:07.199378 IP 127.0.0.1.43166 > 127.253.253.253.53001: UDP, length 70
10:54:09.201239 IP 127.0.0.1.54733 > 127.253.253.253.53001: UDP, length 70
10:54:11.202590 IP 127.0.0.1.39286 > 127.253.253.253.53001: UDP, length 70
```

### Other information

The `sourceAddr` field of the config object does not seem to be written to at all when the YAML configuration is parsed.

Something like the following is probably needed.

```diff
diff --git a/pdns/dnsdistdist/dnsdist-configuration-yaml.cc b/pdns/dnsdistdist/dnsdist-configuration-yaml.cc
index 15b6f3742..3599c456c 100644
--- a/pdns/dnsdistdist/dnsdist-configuration-yaml.cc
+++ b/pdns/dnsdistdist/dnsdist-configuration-yaml.cc
@@ -430,6 +430,7 @@ static std::shared_ptr<DownstreamState> createBackendFromConfiguration(const dns
   getLuaFunctionFromConfiguration<DownstreamState::checkfunc_t>(backendConfig.checkFunction, hcConf.function, hcConf.lua, hcConf.lua_file, "backend health-check");

   DownstreamState::parseAvailabilityConfigFromStr(backendConfig, std::string(hcConf.mode));
+  DownstreamState::parseSourceParameter(std::string(config.source), backendConfig);

   backendConfig.d_lazyHealthCheckSampleSize = hcConf.lazy.sample_size;
   backendConfig.d_lazyHealthCheckMinSampleCount = hcConf.lazy.min_sample_count;
```

When I apply this patch I see dnsdist use the configured source address:

```
11:05:26.599093 IP 127.153.153.153.51608 > 127.253.253.253.53001: UDP, length 70
11:05:26.599224 IP 127.253.253.253.53001 > 127.153.153.153.51608: UDP, length 70
```

**Comment by edmonds** [comment]
Or maybe something more like:

```diff
diff --git a/pdns/dnsdistdist/dnsdist-configuration-yaml.cc b/pdns/dnsdistdist/dnsdist-configuration-yaml.cc
index 15b6f3742..857f59706 100644
--- a/pdns/dnsdistdist/dnsdist-configuration-yaml.cc
+++ b/pdns/dnsdistdist/dnsdist-configuration-yaml.cc
@@ -430,6 +430,9 @@ static std::shared_ptr<DownstreamState> createBackendFromConfiguration(const dns
   getLuaFunctionFromConfiguration<DownstreamState::checkfunc_t>(backendConfig.checkFunction, hcConf.function, hcConf.lua, hcConf.lua_file, "backend health-check");

   DownstreamState::parseAvailabilityConfigFromStr(backendConfig, std::string(hcConf.mode));
+  if (!config.source.empty()) {
+    DownstreamState::parseSourceParameter(std::string(config.source), backendConfig);
+  }

   backendConfig.d_lazyHealthCheckSampleSize = hcConf.lazy.sample_size;
   backendConfig.d_lazyHealthCheckMinSampleCount = hcConf.lazy.min_sample_count;
```

**Comment by rgacogne** [comment]
Thanks a lot! I just opened a pull request to fix it based on your patch. We are slowly adding more tests for the YAML configuration but there are a lot of cases to cover, unfortunately :-/
